date,state,positive,probableCases,negative,pending,totalTestResultsSource,totalTestResults,hospitalizedCurrently,hospitalizedCumulative,inIcuCurrently,inIcuCumulative,onVentilatorCurrently,onVentilatorCumulative,recovered,lastUpdateEt,dateModified,checkTimeEt,death,hospitalized,hospitalizedDischarged,dateChecked,totalTestsViral,positiveTestsViral,negativeTestsViral,positiveCasesViral,deathConfirmed,deathProbable,totalTestEncountersViral,totalTestsPeopleViral,totalTestsAntibody,positiveTestsAntibody,negativeTestsAntibody,totalTestsPeopleAntibody,positiveTestsPeopleAntibody,negativeTestsPeopleAntibody,totalTestsPeopleAntigen,positiveTestsPeopleAntigen,totalTestsAntigen,positiveTestsAntigen,fips,positiveIncrease,negativeIncrease,total,totalTestResultsIncrease,posNeg,dataQualityGrade,deathIncrease,hospitalizedIncrease,hash,commercialScore,negativeRegularScore,negativeScore,positiveScore,score,grade
20200304,CA,53,None,462,None,totalTestsViral,515,None,None,None,None,None,None,None,None,None,None,None,None,None,None,515,None,None,53,None,None,None,None,None,None,None,None,None,None,None,None,None,None,06,0,0,515,0,515,None,0,0,41904137a1c45bac0dc5ce126945ed92c92bbde5,0,0,0,0,0,
20200305,CA,53,None,462,None,totalTestsViral,515,None,None,None,None,None,None,None,None,None,None,None,None,None,None,515,None,None,53,None,None,None,None,None,None,None,None,None,None,None,None,None,None,06,0,0,515,0,515,None,0,0,f5e787e564f7a4076d147f14c84f77d4312da17a,0,0,0,0,0,
20200306,CA,60,None,462,None,totalTestsViral,522,None,None,None,None,None,None,None,None,None,None,None,None,None,None,522,None,None,60,None,None,None,None,None,None,None,None,None,None,None,None,None,None,06,7,0,522,7,522,None,0,0,b467e72f47b966bc063738972f6c2e31051919db,0,0,0,0,0,
20200307,CA,69,None,462,None,totalTestsViral,531,None,None,None,None,None,None,None,None,None,None,None,None,None,None,531,None,None,69,None,None,None,None,None,None,None,None,None,None,None,None,None,None,06,9,0,531,9,531,None,0,0,1f70bcab9c5370a1b81ffac6daaf374a941caac5,0,0,0,0,0,
20200308,CA,88,None,462,None,totalTestsViral,550,None,None,None,None,None,None,None,None,None,None,None,None,None,None,550,None,None,88,None,None,None,None,None,None,None,None,None,None,None,None,None,None,06,19,0,550,19,550,None,0,0,32c01c9818d9d58889168f661d1b2ec4a9336a98,0,0,0,0,0,
20200309,CA,114,None,690,None,totalTestsViral,804,None,None,None,None,None,None,None,None,None,None,None,None,None,None,804,None,None,114,None,None,None,None,None,None,None,None,None,None,None,None,None,None,06,26,228,804,254,804,None,0,0,9fc79957ea2bede6a73a51640368c467589b56eb,0,0,0,0,0,
20200310,CA,133,None,690,None,totalTestsViral,823,None,None,None,None,None,None,None,None,None,None,None,None,None,None,823,None,None,133,None,None,None,None,None,None,None,None,None,None,None,None,None,None,06,19,0,823,19,823,None,0,0,e047dbb40e72c843514a3ed8338d7a5bb50e1ebd,0,0,0,0,0,
20200311,CA,157,None,916,None,totalTestsViral,1073,None,None,None,None,None,None,None,None,None,None,None,None,None,None,1073,None,None,157,None,None,None,None,None,None,None,None,None,None,None,None,None,None,06,24,226,1073,250,1073,None,0,0,0a0dee3d1a21828e12a529a566bdef22f9e50b72,0,0,0,0,0,
20200312,CA,202,None,916,None,totalTestsViral,1118,None,None,None,None,None,None,None,3/12/2020 10:00,2020-03-12T10:00:00Z,03/12 06:00,4,None,None,2020-03-12T10:00:00Z,1118,None,None,202,None,None,None,None,None,None,None,None,None,None,None,None,None,None,06,45,0,1118,45,1118,None,4,0,cc68eb8fb04060add5b4558d1340f572a8126273,0,0,0,0,0,
20200313,CA,202,None,916,None,totalTestsViral,1118,None,None,None,None,None,None,None,3/12/2020 10:00,2020-03-12T10:00:00Z,03/12 06:00,4,None,None,2020-03-12T10:00:00Z,1118,None,None,202,None,None,None,None,None,None,None,None,None,None,None,None,None,None,06,0,0,1118,0,1118,None,0,0,ccd7f71d2f5a632b0ff76c75210571fad06531ad,0,0,0,0,0,
20200314,CA,252,None,916,None,totalTestsViral,1168,None,None,None,None,None,None,None,3/13/2020 11:00,2020-03-13T11:00:00Z,03/13 07:00,5,None,None,2020-03-13T11:00:00Z,1168,None,None,252,None,None,None,None,None,None,None,None,None,None,None,None,None,None,06,50,0,1168,50,1168,None,1,0,ef85fea430bcd72f1989953c1b2249d51ca22155,0,0,0,0,0,
20200315,CA,293,None,916,None,totalTestsViral,1209,None,None,None,None,None,None,None,3/14/2020 11:00,2020-03-14T11:00:00Z,03/14 07:00,5,None,None,2020-03-14T11:00:00Z,1209,None,None,293,None,None,None,None,None,None,None,None,None,None,None,None,None,None,06,41,0,1209,41,1209,None,0,0,8da19f4168ecdf5b39e0933596ea160ed1f29777,0,0,0,0,0,
20200316,CA,335,None,7981,None,totalTestsViral,8316,None,None,None,None,None,None,None,3/16/2020 15:10,2020-03-16T15:10:00Z,03/16 11:10,6,None,None,2020-03-16T15:10:00Z,8316,None,None,335,None,None,None,None,None,None,None,None,None,None,None,None,None,None,06,42,7065,8316,7107,8316,None,1,0,4cc065023cb051eb24fc95b1eeab593a8959d226,0,0,0,0,0,
20200317,CA,483,None,7981,None,totalTestsViral,8464,None,None,None,None,None,None,None,3/16/2020 21:00,2020-03-16T21:00:00Z,03/16 17:00,11,None,None,2020-03-16T21:00:00Z,8464,None,None,483,None,None,None,None,None,None,None,None,None,None,None,None,None,None,06,148,0,8464,148,8464,None,5,0,35be563e1fe4520b503ecf30a8bb87bf8b61eff4,0,0,0,0,0,
20200318,CA,611,None,7981,None,totalTestsViral,8592,None,None,None,None,None,None,None,3/17/2020 21:00,2020-03-17T21:00:00Z,03/17 17:00,13,None,None,2020-03-17T21:00:00Z,8592,None,None,611,None,None,None,None,None,None,None,None,None,None,None,None,None,None,06,128,0,8592,128,8592,None,2,0,8f558a2ad9c6dec4402284bd2b359bf6477485bd,0,0,0,0,0,
20200319,CA,924,None,8787,None,totalTestsViral,9711,None,None,None,None,None,None,None,3/19/2020 14:25,2020-03-19T14:25:00Z,03/19 10:25,18,None,None,2020-03-19T14:25:00Z,9711,None,None,924,None,None,None,None,None,None,None,None,None,None,None,None,None,None,06,313,806,9711,1119,9711,None,5,0,855b4eacff9b25bd63b8146f10ca394499b95349,0,0,0,0,0,
20200320,CA,1063,None,10424,None,totalTestsViral,11487,None,None,None,None,None,None,None,3/20/2020 14:41,2020-03-20T14:41:00Z,03/20 10:41,20,None,None,2020-03-20T14:41:00Z,11487,None,None,1063,None,None,None,None,None,None,None,None,None,None,None,None,None,None,06,139,1637,11487,1776,11487,None,2,0,cd65a281f9d8fc87823cb71742b4b5e5fe94bb26,0,0,0,0,0,
20200321,CA,1279,None,11249,None,totalTestsViral,12528,None,None,None,None,None,None,None,3/21/2020 00:00,2020-03-21T00:00:00Z,03/20 20:00,24,None,None,2020-03-21T00:00:00Z,12528,None,None,1279,None,None,None,None,None,None,None,None,None,None,None,None,None,None,06,216,825,12528,1041,12528,None,4,0,830983993218fb387e525a91ad2b902ed191e1fe,0,0,0,0,0,
20200322,CA,1536,None,11304,None,totalTestsViral,12840,None,None,None,None,None,None,None,3/22/2020 13:34,2020-03-22T13:34:00Z,03/22 09:34,27,None,None,2020-03-22T13:34:00Z,12840,None,None,1536,None,None,None,None,None,None,None,None,None,None,None,None,None,None,06,257,55,12840,312,12840,None,3,0,30380b70060e9855447018576f04fff6cab5a6a4,0,0,0,0,0,
20200323,CA,1733,None,12567,12100,totalTestsViral,14300,None,None,None,None,None,None,None,3/23/2020 00:00,2020-03-23T00:00:00Z,03/22 20:00,27,None,None,2020-03-23T00:00:00Z,14300,None,None,1733,None,None,None,None,None,None,None,None,None,None,None,None,None,None,06,197,1263,26400,1460,14300,None,0,0,90786533d921e594863ed412cdf76e77e31ec16a,0,0,0,0,0,
20200324,CA,2102,None,13452,12100,totalTestsViral,15554,None,None,None,None,None,None,None,3/24/2020 00:00,2020-03-24T00:00:00Z,03/23 20:00,40,None,None,2020-03-24T00:00:00Z,15554,None,None,2102,None,None,None,None,None,None,None,None,None,None,None,None,None,None,06,369,885,27654,1254,15554,None,13,0,cd7cb20e548dd724204197244d6161773e40ea29,0,0,0,0,0,
20200325,CA,2355,None,15921,48600,totalTestsViral,18276,None,None,None,None,None,None,None,3/24/2020 00:00,2020-03-24T00:00:00Z,03/23 20:00,53,None,None,2020-03-24T00:00:00Z,18276,None,None,2355,None,None,None,None,None,None,None,None,None,None,None,None,None,None,06,253,2469,66876,2722,18276,None,13,0,01c3d1056562a0f28835acd79ede453e41709f59,0,0,0,0,0,
20200326,CA,3006,None,17380,57400,totalTestsViral,20386,None,None,None,None,None,None,None,3/25/2020 17:00,2020-03-25T17:00:00Z,03/25 13:00,65,None,None,2020-03-25T17:00:00Z,20386,None,None,3006,None,None,None,None,None,None,None,None,None,None,None,None,None,None,06,651,1459,77786,2110,20386,None,12,0,62932c67956131e2c5f9acd6efff97316b9da25a,0,0,0,0,0,
20200327,CA,3879,None,17380,57400,totalTestsViral,21259,746,None,200,None,None,None,None,3/27/2020 00:00,2020-03-27T00:00:00Z,03/26 20:00,78,None,None,2020-03-27T00:00:00Z,21259,None,None,3879,None,None,None,None,None,None,None,None,None,None,None,None,None,None,06,873,0,78659,873,21259,None,13,0,d223ade5d8f2bd1bbdf1b64d7db3c2cbc1b67fba,0,0,0,0,0,
20200328,CA,4643,None,20549,64400,totalTestsViral,25192,1034,None,410,None,None,None,None,3/27/2020 17:00,2020-03-27T17:00:00Z,03/27 13:00,101,None,None,2020-03-27T17:00:00Z,25192,None,None,4643,None,None,None,None,None,None,None,None,None,None,None,None,None,None,06,764,3169,89592,3933,25192,None,23,0,77bc80b79bc20e2452028979f4d7e957ef1721d9,0,0,0,0,0,
20200329,CA,5708,None,20549,64400,totalTestsViral,26257,1034,None,410,None,None,None,None,3/29/2020 14:18,2020-03-29T14:18:00Z,03/29 10:18,123,None,None,2020-03-29T14:18:00Z,26257,None,None,5708,None,None,None,None,None,None,None,None,None,None,None,None,None,None,06,1065,0,90657,1065,26257,None,22,0,a96b1a9cac25dd4b3fa3ae9b05c55db452b39c76,0,0,0,0,0,
20200330,CA,6447,None,20549,64400,totalTestsViral,26996,1432,None,597,None,None,None,None,3/30/2020 00:00,2020-03-30T00:00:00Z,03/29 20:00,133,None,None,2020-03-30T00:00:00Z,26996,None,None,6447,None,None,None,None,None,None,None,None,None,None,None,None,None,None,06,739,0,91396,739,26996,None,10,0,1f8acc953d41298994cc2cd7a3081abe1d41b66e,0,0,0,0,0,
20200331,CA,7482,None,21772,57400,totalTestsViral,29254,1617,None,657,None,None,None,None,3/31/2020 16:00,2020-03-31T16:00:00Z,03/31 12:00,153,None,None,2020-03-31T16:00:00Z,29254,None,None,7482,None,None,None,None,None,None,None,None,None,None,None,None,None,None,06,1035,1223,86654,2258,29254,None,20,0,74ee43e874e4e4a831d0c64d26af64dedb56c7f5,0,0,0,0,0,
20200401,CA,8155,None,21772,57400,totalTestsViral,29927,1855,None,774,None,None,None,None,3/31/2020 00:00,2020-03-31T00:00:00Z,03/30 20:00,171,None,None,2020-03-31T00:00:00Z,29927,None,None,8155,None,None,None,None,None,None,None,None,None,None,None,None,None,None,06,673,0,87327,673,29927,None,18,0,a85b92f2953eb182476ace958a7a951c6c2c405d,0,0,0,0,0,
20200402,CA,9191,None,23809,59500,totalTestsViral,33000,1922,None,816,None,None,None,None,4/2/2020 00:00,2020-04-02T00:00:00Z,04/01 20:00,203,None,None,2020-04-02T00:00:00Z,33000,None,None,9191,None,None,None,None,None,None,None,None,None,None,None,None,None,None,06,1036,2037,92500,3073,33000,None,32,0,26b3f1e1b327de34e9b504a60541401a4096b6ed,0,0,0,0,0,
20200403,CA,10701,None,24599,59500,totalTestsViral,35300,2188,None,901,None,None,None,None,4/2/2020 00:00,2020-04-02T00:00:00Z,04/01 20:00,237,None,None,2020-04-02T00:00:00Z,35300,None,None,10701,None,None,None,None,None,None,None,None,None,None,None,None,None,None,06,1510,790,94800,2300,35300,None,34,0,1551d6371405b3060d1bf7cef898d5df4bf95af6,0,0,0,0,0,
20200404,CA,12026,None,101674,13000,totalTestsViral,113700,2300,None,1008,None,None,None,None,4/2/2020 00:00,2020-04-02T00:00:00Z,04/01 20:00,276,None,None,2020-04-02T00:00:00Z,113700,None,None,12026,None,None,None,None,None,None,None,None,None,None,None,None,None,None,06,1325,77075,126700,78400,113700,None,39,0,677e7bdf562dacd358c8b71b2f8178b661af56a6,0,0,0,0,0,
20200405,CA,13438,None,103095,15000,totalTestsViral,116533,2398,None,1040,None,None,None,None,4/4/2020 00:00,2020-04-04T00:00:00Z,04/03 20:00,319,None,None,2020-04-04T00:00:00Z,116533,None,None,13438,None,None,None,None,None,None,None,None,None,None,None,None,None,None,06,1412,1421,131533,2833,116533,None,43,0,dc4b84938d2b70963c242577dd51610c162dd434,0,0,0,0,0,
20200406,CA,14336,None,103095,15000,totalTestsViral,117431,2509,None,1085,None,None,None,None,4/6/2020 00:00,2020-04-06T00:00:00Z,04/05 20:00,343,None,None,2020-04-06T00:00:00Z,117431,None,None,14336,None,None,None,None,None,None,None,None,None,None,None,None,None,None,06,898,0,132431,898,117431,None,24,0,8735962cb3e8f854b8df3496cb2960be60923a7d,0,0,0,0,0,
20200407,CA,15865,None,115364,14100,totalTestsViral,131229,2611,None,1108,None,None,None,None,4/7/2020 18:00,2020-04-07T18:00:00Z,04/07 14:00,374,None,None,2020-04-07T18:00:00Z,131229,None,None,15865,None,None,None,None,None,None,None,None,None,None,None,None,None,None,06,1529,12269,145329,13798,131229,None,31,0,d6c1a20035e9615080a498c40bc2a59754998540,0,0,0,0,0,
20200408,CA,16957,None,127307,14600,totalTestsViral,144264,2714,None,1154,None,None,None,None,4/7/2020 18:00,2020-04-07T18:00:00Z,04/07 14:00,442,None,None,2020-04-07T18:00:00Z,144264,None,None,16957,None,None,None,None,None,None,None,None,None,None,None,None,None,None,06,1092,11943,158864,13035,144264,None,68,0,4e2060cf2e32c8095f2b77c6f332306dcaf7e079,0,0,0,0,0,
20200409,CA,18309,None,145191,14100,totalTestsViral,163500,2825,None,1132,None,None,None,None,4/8/2020 19:00,2020-04-08T19:00:00Z,04/08 15:00,492,None,None,2020-04-08T19:00:00Z,163500,None,None,18309,None,None,None,None,None,None,None,None,None,None,None,None,None,None,06,1352,17884,177600,19236,163500,None,50,0,a1361d3fbbf49561e9f34f436b265adcba810e90,0,0,0,0,0,
20200410,CA,19472,None,145391,13900,totalTestsViral,164863,2897,None,1145,None,None,None,None,4/9/2020 00:00,2020-04-09T00:00:00Z,04/08 20:00,541,None,None,2020-04-09T00:00:00Z,164863,None,None,19472,None,None,None,None,None,None,None,None,None,None,None,None,None,None,06,1163,200,178763,1363,164863,None,49,0,156e1347ce2ffe7cb70b08c0634857e7c8923982,0,0,0,0,0,
20200411,CA,20615,None,152604,13200,totalTestsViral,173219,5236,None,1591,None,None,None,None,4/9/2020 00:00,2020-04-09T00:00:00Z,04/08 20:00,609,None,None,2020-04-09T00:00:00Z,173219,None,None,20615,None,None,None,None,None,None,None,None,None,None,None,None,None,None,06,1143,7213,186419,8356,173219,None,68,0,5481205e4a37a3c5ab871a87c96f597254592ddf,0,0,0,0,0,
20200412,CA,21794,None,168534,13200,totalTestsViral,190328,5234,None,1539,None,None,None,None,4/11/2020 00:00,2020-04-11T00:00:00Z,04/10 20:00,651,None,None,2020-04-11T00:00:00Z,190328,None,None,21794,None,None,None,None,None,None,None,None,None,None,None,None,None,None,06,1179,15930,203528,17109,190328,None,42,0,8cc21a3fbc33723a82a1e726361d06a427f20cfa,0,0,0,0,0,
20200413,CA,22348,None,168534,13200,totalTestsViral,190882,3015,None,1178,None,None,None,None,4/12/2020 00:00,2020-04-12T00:00:00Z,04/11 20:00,687,None,None,2020-04-12T00:00:00Z,190882,None,None,22348,None,None,None,None,None,None,None,None,None,None,None,None,None,None,06,554,0,204082,554,190882,None,36,0,fd2063ef37704c22cb68165d6efc4cde3b7b6b23,0,0,0,0,0,
20200414,CA,23338,None,178870,13200,totalTestsViral,202208,5163,None,1552,None,None,None,None,4/13/2020 00:00,2020-04-13T00:00:00Z,04/12 20:00,758,None,None,2020-04-13T00:00:00Z,202208,None,None,23338,None,None,None,None,None,None,None,None,None,None,None,None,None,None,06,990,10336,215408,11326,202208,None,71,0,6a50d2745591c7dee79b421d7801adfddf30bcca,0,0,0,0,0,
20200415,CA,24424,None,192062,13200,totalTestsViral,216486,5163,None,1175,None,None,None,None,4/14/2020 00:00,2020-04-14T00:00:00Z,04/13 20:00,821,None,None,2020-04-14T00:00:00Z,216486,None,None,24424,None,None,None,None,None,None,None,None,None,None,None,None,None,None,06,1086,13192,229686,14278,216486,None,63,0,a82abc8cca400221b60a5e36158dace17404eeb3,0,0,0,0,0,
20200416,CA,26182,None,220218,13200,totalTestsViral,246400,5031,None,1568,None,None,None,None,4/15/2020 00:00,2020-04-15T00:00:00Z,04/14 20:00,890,None,None,2020-04-15T00:00:00Z,246400,None,None,26182,None,None,None,None,None,None,None,None,None,None,None,None,None,None,06,1758,28156,259600,29914,246400,None,69,0,9f5f0d435c0c53b4664510a6fd9b177230da4f06,0,0,0,0,0,
20200417,CA,27528,None,224086,7200,totalTestsViral,251614,4892,None,1484,None,None,None,None,4/17/2020 00:00,2020-04-17T00:00:00Z,04/16 20:00,985,None,None,2020-04-17T00:00:00Z,251614,None,None,27528,None,None,None,None,None,None,None,None,None,None,None,None,None,None,06,1346,3868,258814,5214,251614,None,95,0,e1670277c8ba735e2b59599e9ec275f1b5b84d87,0,0,0,0,0,
20200418,CA,28963,None,230703,7200,totalTestsViral,259666,4936,None,1490,None,None,None,None,4/17/2020 00:00,2020-04-17T00:00:00Z,04/16 20:00,1072,None,None,2020-04-17T00:00:00Z,259666,None,None,28963,None,None,None,None,None,None,None,None,None,None,None,None,None,None,06,1435,6617,266866,8052,259666,None,87,0,12391cadc172e5e7dc41ecc1582db6613d24e473,0,0,0,0,0,
20200419,CA,30333,None,250567,7200,totalTestsViral,280900,4731,None,1457,None,None,None,None,4/18/2020 00:00,2020-04-18T00:00:00Z,04/17 20:00,1166,None,None,2020-04-18T00:00:00Z,280900,None,None,30333,None,None,None,None,None,None,None,None,None,None,None,None,None,None,06,1370,19864,288100,21234,280900,None,94,0,3c1e60dd944712983389d99462b72f738fd8b303,0,0,0,0,0,
20200420,CA,30978,None,259522,None,totalTestsViral,290500,4674,None,1480,None,None,None,None,4/19/2020 00:00,2020-04-19T00:00:00Z,04/18 20:00,1208,None,None,2020-04-19T00:00:00Z,290500,None,None,30978,None,None,None,None,None,None,None,None,None,None,None,None,None,None,06,645,8955,290500,9600,290500,None,42,0,9c126f0eda76cd79db89f4bc759b71aea41543e3,0,0,0,0,0,
20200421,CA,33261,None,266839,None,totalTestsViral,300100,4886,None,1502,None,None,None,None,4/21/2020 00:00,2020-04-21T00:00:00Z,04/20 20:00,1268,None,None,2020-04-21T00:00:00Z,300100,None,None,33261,None,None,None,None,None,None,None,None,None,None,None,None,None,None,06,2283,7317,300100,9600,300100,None,60,0,e3a9295130fdad188ae9e973a401ccc63168aec8,0,0,0,0,0,
20200422,CA,35396,None,None,None,totalTestsViral,465327,4984,None,1551,None,None,None,None,4/21/2020 00:00,2020-04-21T00:00:00Z,04/20 20:00,1354,None,None,2020-04-21T00:00:00Z,465327,None,None,35396,None,None,None,None,None,None,None,None,None,None,None,None,None,None,06,2135,-266839,35396,165227,35396,None,86,0,3b17466e643f37b2095c6ee3729296ce3891ec2d,0,0,0,0,0,
20200423,CA,37369,None,None,None,totalTestsViral,482097,4929,None,1531,None,None,None,None,4/22/2020 00:00,2020-04-22T00:00:00Z,04/21 20:00,1469,None,None,2020-04-22T00:00:00Z,482097,None,None,37369,None,None,None,None,None,None,None,None,None,None,None,None,None,None,06,1973,0,37369,16770,37369,None,115,0,1f0a6331664fb3e9d47bdd8c62b22b3627a911d3,0,0,0,0,0,
20200424,CA,39254,None,None,None,totalTestsViral,494173,4880,None,1521,None,None,None,None,4/23/2020 00:00,2020-04-23T00:00:00Z,04/22 20:00,1562,None,None,2020-04-23T00:00:00Z,494173,None,None,39254,None,None,None,None,None,None,None,None,None,None,None,None,None,None,06,1885,0,39254,12076,39254,None,93,0,b157fadb180c37f5229d171b530a1fbf3bee1b6a,0,0,0,0,0,
20200425,CA,41137,None,None,None,totalTestsViral,506035,4847,None,1458,None,None,None,None,4/23/2020 00:00,2020-04-23T00:00:00Z,04/22 20:00,1651,None,None,2020-04-23T00:00:00Z,506035,None,None,41137,None,None,None,None,None,None,None,None,None,None,None,None,None,None,06,1883,0,41137,11862,41137,None,89,0,7cd09505312ce763cda88c86382febda472648f7,0,0,0,0,0,
20200426,CA,42164,None,None,None,totalTestsViral,526084,4928,None,1473,None,None,None,None,4/25/2020 00:00,2020-04-25T00:00:00Z,04/24 20:00,1710,None,None,2020-04-25T00:00:00Z,526084,None,None,42164,None,None,None,None,None,None,None,None,None,None,None,None,None,None,06,1027,0,42164,20049,42164,None,59,0,1cf08ded6fbff7acd0953e67c752642c92f6201d,0,0,0,0,0,
20200427,CA,43464,None,None,None,totalTestsViral,553409,4878,None,1499,None,None,None,None,4/27/2020 00:00,2020-04-27T00:00:00Z,04/26 20:00,1755,None,None,2020-04-27T00:00:00Z,553409,None,None,43464,None,None,None,None,None,None,None,None,None,None,None,None,None,None,06,1300,0,43464,27325,43464,None,45,0,37dfb5b6bfaa5cda984d8f74d4af3928e0dd5a3b,0,0,0,0,0,
20200428,CA,45031,None,None,None,totalTestsViral,577608,4983,None,1485,None,None,None,None,4/27/2020 00:00,2020-04-27T00:00:00Z,04/26 20:00,1809,None,None,2020-04-27T00:00:00Z,577608,None,None,45031,None,None,None,None,None,None,None,None,None,None,None,None,None,None,06,1567,0,45031,24199,45031,None,54,0,d1459f19abd8e27d0a1c8418f590f0121a548496,0,0,0,0,0,
20200429,CA,46500,None,None,None,totalTestsViral,603139,5011,None,1512,None,None,None,None,4/29/2020 00:00,2020-04-29T00:00:00Z,04/28 20:00,1887,None,None,2020-04-29T00:00:00Z,603139,None,None,46500,None,None,None,None,None,None,None,None,None,None,None,None,None,None,06,1469,0,46500,25531,46500,None,78,0,80d6502a18cc8676d5f4ff742fc3f3189d474be6,0,0,0,0,0,
20200430,CA,48917,None,None,None,totalTestsViral,625337,4981,None,1473,None,None,None,None,4/29/2020 00:00,2020-04-29T00:00:00Z,04/28 20:00,1982,None,None,2020-04-29T00:00:00Z,625337,None,None,48917,None,None,None,None,None,None,None,None,None,None,None,None,None,None,06,2417,0,48917,22198,48917,None,95,0,409d57b349f64aae76f60c3f871de3ae150db14e,0,0,0,0,0,
20200501,CA,50442,None,None,None,totalTestsViral,654985,4706,None,1434,None,None,None,None,4/30/2020 00:00,2020-04-30T00:00:00Z,04/29 20:00,2073,None,None,2020-04-30T00:00:00Z,654985,None,None,50442,None,None,None,None,None,None,None,None,None,None,None,None,None,None,06,1525,0,50442,29648,50442,None,91,0,fe3d06094d0cddd0fbcebd63a43efbbebdf67669,0,0,0,0,0,
20200502,CA,52197,None,None,None,totalTestsViral,685048,4722,None,1433,None,None,None,None,5/1/2020 00:00,2020-05-01T00:00:00Z,04/30 20:00,2171,None,None,2020-05-01T00:00:00Z,685048,None,None,52197,None,None,None,None,None,None,None,None,None,None,None,None,None,None,06,1755,0,52197,30063,52197,None,98,0,73b722a64af60fe54151968b108db975c2f7a9d5,0,0,0,0,0,
20200503,CA,53616,None,None,None,totalTestsViral,715751,4734,None,1468,None,None,None,None,5/3/2020 14:00,2020-05-03T14:00:00Z,05/03 10:00,2215,None,None,2020-05-03T14:00:00Z,715751,None,None,53616,None,None,None,None,None,None,None,None,None,None,None,None,None,None,06,1419,0,53616,30703,53616,None,44,0,f290e5cdf3bfd1f4fe978e666e76c68ac6944c9b,0,0,0,0,0,
20200504,CA,54937,None,None,None,totalTestsViral,747874,4616,None,1464,None,None,None,None,5/4/2020 14:00,2020-05-04T14:00:00Z,05/04 10:00,2254,None,None,2020-05-04T14:00:00Z,747874,None,None,54937,None,None,None,None,None,None,None,None,None,None,None,None,None,None,06,1321,0,54937,32123,54937,None,39,0,5b1d971a593106fb9c737a4e165688e0b3673e97,0,0,0,0,0,
20200505,CA,56212,None,None,None,totalTestsViral,779902,4622,None,1388,None,None,None,None,5/5/2020 14:00,2020-05-05T14:00:00Z,05/05 10:00,2317,None,None,2020-05-05T14:00:00Z,779902,None,None,56212,None,None,None,None,None,None,None,None,None,None,None,None,None,None,06,1275,0,56212,32028,56212,None,63,0,11edd53ea024949adf46d3861badbff4138ea965,0,0,0,0,0,
20200506,CA,58815,None,None,None,totalTestsViral,809036,4681,None,1415,None,None,None,None,5/5/2020 14:00,2020-05-05T14:00:00Z,05/05 10:00,2412,None,None,2020-05-05T14:00:00Z,809036,None,None,58815,None,None,None,None,None,None,None,None,None,None,None,None,None,None,06,2603,0,58815,29134,58815,None,95,0,cf25f224d915dca398ed56c731e25c4a542daebb,0,0,0,0,0,
20200507,CA,60614,None,None,None,totalTestsViral,842874,4560,None,1374,None,None,None,None,5/7/2020 14:00,2020-05-07T14:00:00Z,05/07 10:00,2504,None,None,2020-05-07T14:00:00Z,842874,None,None,60614,None,None,None,None,None,None,None,None,None,None,None,None,None,None,06,1799,0,60614,33838,60614,None,92,0,d62c6ed2d0740c89abb2a1c1c232e3bb543b61f1,0,0,0,0,0,
20200508,CA,62512,None,None,None,totalTestsViral,875272,4514,None,1342,None,None,None,None,5/8/2020 14:00,2020-05-08T14:00:00Z,05/08 10:00,2585,None,None,2020-05-08T14:00:00Z,875272,None,None,62512,None,None,None,None,None,None,None,None,None,None,None,None,None,None,06,1898,0,62512,32398,62512,None,81,0,402aa7a14a8a6184741940301293066508e40a05,0,0,0,0,0,
20200509,CA,64561,None,None,None,totalTestsViral,912570,4538,None,1349,None,None,None,None,5/9/2020 14:00,2020-05-09T14:00:00Z,05/09 10:00,2678,None,None,2020-05-09T14:00:00Z,912570,None,None,64561,None,None,None,None,None,None,None,None,None,None,None,None,None,None,06,2049,0,64561,37298,64561,None,93,0,d2c0c81cfeefbd333d25caf87531dea2410dd998,0,0,0,0,0,
20200510,CA,66680,None,None,None,totalTestsViral,955664,4555,None,1328,None,None,None,None,5/10/2020 00:00,2020-05-10T00:00:00Z,05/09 20:00,2745,None,None,2020-05-10T00:00:00Z,955664,None,None,66680,None,None,None,None,None,None,None,None,None,None,None,None,None,None,06,2119,0,66680,43094,66680,None,67,0,b7860574c750ec59e7a2a480d88f60bbde2004d0,0,0,0,0,0,
20200511,CA,67939,None,None,None,totalTestsViral,991897,4549,None,1329,None,None,None,None,5/11/2020 00:00,2020-05-11T00:00:00Z,05/10 20:00,2770,None,None,2020-05-11T00:00:00Z,991897,None,None,67939,None,None,None,None,None,None,None,None,None,None,None,None,None,None,06,1259,0,67939,36233,67939,None,25,0,f8ab47aa75bf103337b33842e9c66f5d0b965852,0,0,0,0,0,
20200512,CA,69382,None,None,None,totalTestsViral,1033370,4544,None,1349,None,None,None,None,5/12/2020 00:00,2020-05-12T00:00:00Z,05/11 20:00,2847,None,None,2020-05-12T00:00:00Z,1033370,None,None,69382,None,None,None,None,None,None,None,None,None,None,None,None,None,None,06,1443,0,69382,41473,69382,None,77,0,754811eb833e4ba5a71743469b951c95cf103621,0,0,0,0,0,
20200513,CA,71141,None,None,None,totalTestsViral,1065592,4545,None,1314,None,None,None,None,5/13/2020 00:00,2020-05-13T00:00:00Z,05/12 20:00,2934,None,None,2020-05-13T00:00:00Z,1065592,None,None,71141,None,None,None,None,None,None,None,None,None,None,None,None,None,None,06,1759,0,71141,32222,71141,None,87,0,8ee0e0e72dfd0665acbed1adce11b35cf0f1f555,0,0,0,0,0,
20200514,CA,73164,None,None,None,totalTestsViral,1104651,4655,None,1324,None,None,None,None,5/14/2020 00:00,2020-05-14T00:00:00Z,05/13 20:00,3032,None,None,2020-05-14T00:00:00Z,1104651,None,None,73164,None,None,None,None,None,None,None,None,None,None,None,None,None,None,06,2023,0,73164,39059,73164,None,98,0,36b89845f4ee80736760c6c7f561fff47f8a9e2a,0,0,0,0,0,
20200515,CA,74936,None,None,None,totalTestsViral,1133906,4519,None,1324,None,None,None,None,5/14/2020 00:00,2020-05-14T00:00:00Z,05/13 20:00,3108,None,None,2020-05-14T00:00:00Z,1133906,None,None,74936,None,None,None,None,None,None,None,None,None,None,None,None,None,None,06,1772,0,74936,29255,74936,None,76,0,f8afce7edf428927116b4e117c5c9917e2d64612,0,0,0,0,0,
20200516,CA,76793,None,None,None,totalTestsViral,1179126,4424,None,1313,None,None,None,None,5/16/2020 00:00,2020-05-16T00:00:00Z,05/15 20:00,3204,None,None,2020-05-16T00:00:00Z,1179126,None,None,76793,None,None,None,None,None,None,None,None,None,None,None,None,None,None,06,1857,0,76793,45220,76793,None,96,0,151d9f93f68e7df282721886ba4d3473ddc071e7,0,0,0,0,0,
20200517,CA,78839,None,None,None,totalTestsViral,1235243,4291,None,1293,None,None,None,None,5/17/2020 00:00,2020-05-17T00:00:00Z,05/16 20:00,3261,None,None,2020-05-17T00:00:00Z,1235243,None,None,78839,None,None,None,None,None,None,None,None,None,None,None,None,None,None,06,2046,0,78839,56117,78839,None,57,0,6dd7f6932aed52f00a5f4e35b47c6e1bf2ef8d86,0,0,0,0,0,
20200518,CA,80430,None,None,None,totalTestsViral,1292672,4391,None,1325,None,None,None,None,5/17/2020 00:00,2020-05-17T00:00:00Z,05/16 20:00,3302,None,None,2020-05-17T00:00:00Z,1292672,None,None,80430,None,None,None,None,None,None,None,None,None,None,None,None,None,None,06,1591,0,80430,57429,80430,None,41,0,8d8d33e28ef4aca20f40e18f2ba2f4327ea22561,0,0,0,0,0,
20200519,CA,81795,None,None,None,totalTestsViral,1339316,4363,None,1307,None,None,None,None,5/19/2020 00:00,2020-05-19T00:00:00Z,05/18 20:00,3334,None,None,2020-05-19T00:00:00Z,1339316,None,None,81795,None,None,None,None,None,None,None,None,None,None,None,None,None,None,06,1365,0,81795,46644,81795,None,32,0,0bb1670202504565f551a039a6ec6084731a9f5d,0,0,0,0,0,
20200520,CA,84057,None,None,None,totalTestsViral,1380120,4681,None,1345,None,None,None,None,5/20/2020 00:00,2020-05-20T00:00:00Z,05/19 20:00,3436,None,None,2020-05-20T00:00:00Z,1380120,None,None,84057,None,None,None,None,None,None,None,None,None,None,None,None,None,None,06,2262,0,84057,40804,84057,None,102,0,3299471b35a160d2f1c985255a10824a38f7bb84,0,0,0,0,0,
20200521,CA,86197,None,None,None,totalTestsViral,1421127,4735,None,1310,None,None,None,None,5/21/2020 00:00,2020-05-21T00:00:00Z,05/20 20:00,3542,None,None,2020-05-21T00:00:00Z,1421127,None,None,86197,None,None,None,None,None,None,None,None,None,None,None,None,None,None,06,2140,0,86197,41007,86197,None,106,0,23fbe47a85427585037a466003147bf2274e5db1,0,0,0,0,0,
20200522,CA,88444,None,None,None,totalTestsViral,1466773,4762,None,1317,None,None,None,None,5/21/2020 00:00,2020-05-21T00:00:00Z,05/20 20:00,3630,None,None,2020-05-21T00:00:00Z,1466773,None,None,88444,None,None,None,None,None,None,None,None,None,None,None,None,None,None,06,2247,0,88444,45646,88444,None,88,0,a0a5024b655b7c120bdf472e11815166e1694b38,0,0,0,0,0,
20200523,CA,90631,None,None,None,totalTestsViral,1515306,4342,None,1312,None,None,None,None,5/23/2020 00:00,2020-05-23T00:00:00Z,05/22 20:00,3708,None,None,2020-05-23T00:00:00Z,1515306,None,None,90631,None,None,None,None,None,None,None,None,None,None,None,None,None,None,06,2187,0,90631,48533,90631,None,78,0,5cd2447073d8a222203cee05ee5ccce12d857b4d,0,0,0,0,0,
20200524,CA,92710,None,None,None,totalTestsViral,1582745,4300,None,1315,None,None,None,None,5/24/2020 00:00,2020-05-24T00:00:00Z,05/23 20:00,3774,None,None,2020-05-24T00:00:00Z,1582745,None,None,92710,None,None,None,None,None,None,None,None,None,None,None,None,None,None,06,2079,0,92710,67439,92710,None,66,0,fb3fb10f01c71835aa5d8b9ff1c9876270beac12,0,0,0,0,0,
20200525,CA,94558,None,None,None,totalTestsViral,1644102,4306,None,1301,None,None,None,None,5/25/2020 00:00,2020-05-25T00:00:00Z,05/24 20:00,3795,None,None,2020-05-25T00:00:00Z,1644102,None,None,94558,None,None,None,None,None,None,None,None,None,None,None,None,None,None,06,1848,0,94558,61357,94558,None,21,0,f2821bb165438515825a55ff000e70f5a0edc3c4,0,0,0,0,0,
20200526,CA,96733,None,None,None,totalTestsViral,1696396,4404,None,1392,None,None,None,None,5/26/2020 00:00,2020-05-26T00:00:00Z,05/25 20:00,3814,None,None,2020-05-26T00:00:00Z,1696396,None,None,96733,None,None,None,None,None,None,None,None,None,None,None,None,None,None,06,2175,0,96733,52294,96733,None,19,0,1ba4c38919ca3d9b7b68805fd7c1279bfc7c0d67,0,0,0,0,0,
20200527,CA,98980,None,None,None,totalTestsViral,1736894,4544,None,1407,None,None,None,None,5/27/2020 00:00,2020-05-27T00:00:00Z,05/26 20:00,3884,None,None,2020-05-27T00:00:00Z,1736894,None,None,98980,None,None,None,None,None,None,None,None,None,None,None,None,None,None,06,2247,0,98980,40498,98980,None,70,0,a70d579086252ff6a0aedf1b69502e6b0eb54304,0,0,0,0,0,
20200528,CA,101697,None,None,None,totalTestsViral,1790559,4529,None,1325,None,None,None,None,5/28/2020 00:00,2020-05-28T00:00:00Z,05/27 20:00,3973,None,None,2020-05-28T00:00:00Z,1790559,None,None,101697,None,None,None,None,None,None,None,None,None,None,None,None,None,None,06,2717,0,101697,53665,101697,None,89,0,c8a55d3cb038d83f69b8d00300f1f2fb1f19caa0,0,0,0,0,0,
20200529,CA,103886,None,None,None,totalTestsViral,1835478,4414,None,1328,None,None,None,None,5/29/2020 00:00,2020-05-29T00:00:00Z,05/28 20:00,4068,None,None,2020-05-29T00:00:00Z,1835478,None,None,103886,None,None,None,None,None,None,None,None,None,None,None,None,None,None,06,2189,0,103886,44919,103886,None,95,0,68c9183e759d058fcdb3d773674cdf7b13d12d56,0,0,0,0,0,
20200530,CA,106878,None,None,None,totalTestsViral,1888595,4215,None,1273,None,None,None,None,5/30/2020 00:00,2020-05-30T00:00:00Z,05/29 20:00,4156,None,None,2020-05-30T00:00:00Z,1888595,None,None,106878,None,None,None,None,None,None,None,None,None,None,None,None,None,None,06,2992,0,106878,53117,106878,None,88,0,4f1fdbad457bc173ad5c7f8262bda9b9f5fb81c1,0,0,0,0,0,
20200531,CA,110583,None,None,None,totalTestsViral,1944848,4331,None,1324,None,None,None,None,5/30/2020 00:00,2020-05-30T00:00:00Z,05/29 20:00,4213,None,None,2020-05-30T00:00:00Z,1944848,None,None,110583,None,None,None,None,None,None,None,None,None,None,None,None,None,None,06,3705,0,110583,56253,110583,None,57,0,19fe138736ec0ffd8fb49b091f1438417def2d32,0,0,0,0,0,
20200601,CA,113006,None,None,None,totalTestsViral,2012583,4258,None,1273,None,None,None,None,6/1/2020 00:00,2020-06-01T00:00:00Z,05/31 20:00,4251,None,None,2020-06-01T00:00:00Z,2012583,None,None,113006,None,None,None,None,None,None,None,None,None,None,None,None,None,None,06,2423,0,113006,67735,113006,None,38,0,867c12c28c4aad010209ef23363cdca5f88612c7,0,0,0,0,0,
20200602,CA,115310,None,None,None,totalTestsViral,2071591,4393,None,1286,None,None,None,None,6/2/2020 00:00,2020-06-02T00:00:00Z,06/01 20:00,4286,None,None,2020-06-02T00:00:00Z,2071591,None,None,115310,None,None,None,None,None,None,None,None,None,None,None,None,None,None,06,2304,0,115310,59008,115310,None,35,0,99e0fbbf26c01c5b2511f642be0569137ddce5c9,0,0,0,0,0,
20200603,CA,117687,None,None,None,totalTestsViral,2131294,4458,None,1313,None,None,None,None,6/3/2020 00:00,2020-06-03T00:00:00Z,06/02 20:00,4361,None,None,2020-06-03T00:00:00Z,2131294,None,None,117687,None,None,None,None,None,None,None,None,None,None,None,None,None,None,06,2377,0,117687,59703,117687,None,75,0,1ae5d57d7d70f73dc79d1ee4113b4ce186191be7,0,0,0,0,0,
20200604,CA,119807,None,None,None,totalTestsViral,2182671,4455,None,1279,None,None,None,None,6/4/2020 00:00,2020-06-04T00:00:00Z,06/03 20:00,4422,None,None,2020-06-04T00:00:00Z,2182671,None,None,119807,None,None,None,None,None,None,None,None,None,None,None,None,None,None,06,2120,0,119807,51377,119807,None,61,0,3a121215a61cc3157d6355131599c3645748f77b,0,0,0,0,0,
20200605,CA,122901,None,None,None,totalTestsViral,2238463,4625,None,1333,None,None,None,None,6/5/2020 00:00,2020-06-05T00:00:00Z,06/04 20:00,4485,None,None,2020-06-05T00:00:00Z,2238463,None,None,122901,None,None,None,None,None,None,None,None,None,None,None,None,None,None,06,3094,0,122901,55792,122901,None,63,0,2896e73d62ce1ddb019f8940d63e5b3c19cbcfe5,0,0,0,0,0,
20200606,CA,126016,None,None,None,totalTestsViral,2308300,4526,None,1315,None,None,None,None,6/6/2020 00:00,2020-06-06T00:00:00Z,06/05 20:00,4559,None,None,2020-06-06T00:00:00Z,2308300,None,None,126016,None,None,None,None,None,None,None,None,None,None,None,None,None,None,06,3115,0,126016,69837,126016,None,74,0,948b9f4ad15697f21cb63dd51e742e68b2881c30,0,0,0,0,0,
20200607,CA,128812,None,None,None,totalTestsViral,2362218,4525,None,1288,None,None,None,None,6/7/2020 00:00,2020-06-07T00:00:00Z,06/06 20:00,4626,None,None,2020-06-07T00:00:00Z,2362218,None,None,128812,None,None,None,None,None,None,None,None,None,None,None,None,None,None,06,2796,0,128812,53918,128812,None,67,0,063cac811a32b880d86e53a6f0e7b56555be5060,0,0,0,0,0,
20200608,CA,131319,None,None,None,totalTestsViral,2431190,4506,None,1301,None,None,None,None,6/8/2020 00:00,2020-06-08T00:00:00Z,06/07 20:00,4653,None,None,2020-06-08T00:00:00Z,2431190,None,None,131319,None,None,None,None,None,None,None,None,None,None,None,None,None,None,06,2507,0,131319,68972,131319,None,27,0,de555f8f9b0b397d1a28abcf725422462fa38728,0,0,0,0,0,
20200609,CA,133489,None,None,None,totalTestsViral,2486245,4583,None,1345,None,None,None,None,6/9/2020 00:00,2020-06-09T00:00:00Z,06/08 20:00,4697,None,None,2020-06-09T00:00:00Z,2486245,None,None,133489,None,None,None,None,None,None,None,None,None,None,None,None,None,None,06,2170,0,133489,55055,133489,None,44,0,ac5751b8e8903fcaf3a2f49ff7c132450676bbc5,0,0,0,0,0,
20200610,CA,136191,None,None,None,totalTestsViral,2540798,4719,None,1326,None,None,None,None,6/10/2020 00:00,2020-06-10T00:00:00Z,06/09 20:00,4776,None,None,2020-06-10T00:00:00Z,2540798,None,None,136191,None,None,None,None,None,None,None,None,None,None,None,None,None,None,06,2702,0,136191,54553,136191,None,79,0,ad71677094f33da1f46ab1bb56222f5c805e6841,0,0,0,0,0,
20200611,CA,139281,None,None,None,totalTestsViral,2597647,4534,None,1325,None,None,None,None,6/11/2020 00:00,2020-06-11T00:00:00Z,06/10 20:00,4881,None,None,2020-06-11T00:00:00Z,2597647,None,None,139281,None,None,None,None,None,None,None,None,None,None,None,None,None,None,06,3090,0,139281,56849,139281,None,105,0,60b7445002f2ae05c27d6465c2bcbb352e2767a7,0,0,0,0,0,
20200612,CA,141983,None,None,None,totalTestsViral,2662258,4480,None,1310,None,None,None,None,6/12/2020 00:00,2020-06-12T00:00:00Z,06/11 20:00,4943,None,None,2020-06-12T00:00:00Z,2662258,None,None,141983,None,None,None,None,None,None,None,None,None,None,None,None,None,None,06,2702,0,141983,64611,141983,None,62,0,64afe304f63ee49a66f0b98ec8c3fe998a8a3115,0,0,0,0,0,
20200613,CA,145643,None,None,None,totalTestsViral,2724393,4411,None,1313,None,None,None,None,6/13/2020 00:00,2020-06-13T00:00:00Z,06/12 20:00,4989,None,None,2020-06-13T00:00:00Z,2724393,None,None,145643,None,None,None,None,None,None,None,None,None,None,None,None,None,None,06,3660,0,145643,62135,145643,None,46,0,cce4f89c343399affb4a19e035feb98baed36d39,0,0,0,0,0,
20200614,CA,148855,None,None,None,totalTestsViral,2801996,4247,None,1280,None,None,None,None,6/14/2020 00:00,2020-06-14T00:00:00Z,06/13 20:00,5063,None,None,2020-06-14T00:00:00Z,2801996,None,None,148855,None,None,None,None,None,None,None,None,None,None,None,None,None,None,06,3212,0,148855,77603,148855,None,74,0,9dc41ee796bd121b5d2c4ea2778845ae52b210c7,0,0,0,0,0,
20200615,CA,151452,None,None,None,totalTestsViral,2868182,4323,None,1270,None,None,None,None,6/15/2020 00:00,2020-06-15T00:00:00Z,06/14 20:00,5089,None,None,2020-06-15T00:00:00Z,2868182,None,None,151452,None,None,None,None,None,None,None,None,None,None,None,None,None,None,06,2597,0,151452,66186,151452,None,26,0,2d7b9e5aeb751295810376c0639f524a12a20911,0,0,0,0,0,
20200616,CA,153560,None,None,None,totalTestsViral,2937755,4462,None,1272,None,None,None,None,6/16/2020 00:00,2020-06-16T00:00:00Z,06/15 20:00,5121,None,None,2020-06-16T00:00:00Z,2937755,None,None,153560,None,None,None,None,None,None,None,None,None,None,None,None,None,None,06,2108,0,153560,69573,153560,None,32,0,b3048918da7f3a074ef80e6420cadc8dd73199b6,0,0,0,0,0,
20200617,CA,157015,None,None,None,totalTestsViral,2997988,4522,None,1318,None,None,None,None,6/17/2020 00:00,2020-06-17T00:00:00Z,06/16 20:00,5208,None,None,2020-06-17T00:00:00Z,2997988,None,None,157015,None,None,None,None,None,None,None,None,None,None,None,None,None,None,06,3455,0,157015,60233,157015,None,87,0,ba8ec106172022f2f7f3375e9665a6546719c47a,0,0,0,0,0,
20200618,CA,161099,None,None,None,totalTestsViral,3074530,4584,None,1298,None,None,None,None,6/18/2020 00:00,2020-06-18T00:00:00Z,06/17 20:00,5290,None,None,2020-06-18T00:00:00Z,3074530,None,None,161099,None,None,None,None,None,None,None,None,None,None,None,None,None,None,06,4084,0,161099,76542,161099,None,82,0,1c711f2097a7a30b0c47852d42ed228cd7a695bd,0,0,0,0,0,
20200619,CA,165416,None,None,None,totalTestsViral,3155702,4587,None,1329,None,None,None,None,6/19/2020 00:00,2020-06-19T00:00:00Z,06/18 20:00,5360,None,None,2020-06-19T00:00:00Z,3155702,None,None,165416,None,None,None,None,None,None,None,None,None,None,None,None,None,None,06,4317,0,165416,81172,165416,None,70,0,d4bac2e3015d2f2b8e8a4ec530738cb58db0381f,0,0,0,0,0,
20200620,CA,169309,None,None,None,totalTestsViral,3234412,4582,None,1332,None,None,None,None,6/20/2020 00:00,2020-06-20T00:00:00Z,06/19 20:00,5424,None,None,2020-06-20T00:00:00Z,3234412,None,None,169309,None,None,None,None,None,None,None,None,None,None,None,None,None,None,06,3893,0,169309,78710,169309,None,64,0,7d499d7831b883d46a06d87b7fb10ee9ad08b381,0,0,0,0,0,
20200621,CA,173824,None,None,None,totalTestsViral,3319256,4679,None,1366,None,None,None,None,6/21/2020 00:00,2020-06-21T00:00:00Z,06/20 20:00,5495,None,None,2020-06-21T00:00:00Z,3319256,None,None,173824,None,None,None,None,None,None,None,None,None,None,None,None,None,None,06,4515,0,173824,84844,173824,None,71,0,4af791371ead1a47bace0a71b5f5942b9aafdd9c,0,0,0,0,0,
20200622,CA,178054,None,None,None,totalTestsViral,3411686,4804,None,1412,None,None,None,None,6/22/2020 00:00,2020-06-22T00:00:00Z,06/21 20:00,5515,None,None,2020-06-22T00:00:00Z,3411686,None,None,178054,None,None,None,None,None,None,None,None,None,None,None,None,None,None,06,4230,0,178054,92430,178054,None,20,0,85473b612e5e3e06ddcd6f434a206edca885675e,0,0,0,0,0,
20200623,CA,183073,None,None,None,totalTestsViral,3496929,5065,None,1421,None,None,None,None,6/23/2020 00:00,2020-06-23T00:00:00Z,06/22 20:00,5580,None,None,2020-06-23T00:00:00Z,3496929,None,None,183073,None,None,None,None,None,None,None,None,None,None,None,None,None,None,06,5019,0,183073,85243,183073,None,65,0,bf2919cb09469efb1a58edaf97106672600ab260,0,0,0,0,0,
20200624,CA,190222,None,None,None,totalTestsViral,3592899,5399,None,1487,None,None,None,None,6/24/2020 00:00,2020-06-24T00:00:00Z,06/23 20:00,5632,None,None,2020-06-24T00:00:00Z,3592899,None,None,190222,None,None,None,None,None,None,None,None,None,None,None,None,None,None,06,7149,0,190222,95970,190222,None,52,0,5985848642a3bbf14e5ea2aeaaf5e5ba7e5c4256,0,0,0,0,0,
20200625,CA,195571,None,None,None,totalTestsViral,3694345,5522,None,1523,None,None,None,None,6/25/2020 00:00,2020-06-25T00:00:00Z,06/24 20:00,5733,None,None,2020-06-25T00:00:00Z,3694345,None,None,195571,None,None,None,None,None,None,None,None,None,None,None,None,None,None,06,5349,0,195571,101446,195571,None,101,0,445b456fa6c357ec78e3b71a435a053e800914c8,0,0,0,0,0,
20200626,CA,200461,None,None,None,totalTestsViral,3771314,5639,None,1570,None,None,None,None,6/26/2020 00:00,2020-06-26T00:00:00Z,06/25 20:00,5812,None,None,2020-06-26T00:00:00Z,3771314,None,None,200461,None,None,None,None,None,None,None,None,None,None,None,None,None,None,06,4890,0,200461,76969,200461,None,79,0,3e993494a9eb1797d4019701799eb203df7cdd15,0,0,0,0,0,
20200627,CA,206433,None,None,None,totalTestsViral,3862310,5790,None,1562,None,None,None,None,6/27/2020 00:00,2020-06-27T00:00:00Z,06/26 20:00,5872,None,None,2020-06-27T00:00:00Z,3862310,None,None,206433,None,None,None,None,None,None,None,None,None,None,None,None,None,None,06,5972,0,206433,90996,206433,None,60,0,74b7cf89e05aa5a3a634b351688aff0f420c2267,0,0,0,0,0,
20200628,CA,211243,None,None,None,totalTestsViral,3955952,5956,None,1602,None,None,None,None,6/28/2020 00:00,2020-06-28T00:00:00Z,06/27 20:00,5905,None,None,2020-06-28T00:00:00Z,3955952,None,None,211243,None,None,None,None,None,None,None,None,None,None,None,None,None,None,06,4810,0,211243,93642,211243,None,33,0,663f14b7fe243150eb5f5d8a08df536ac5b47c47,0,0,0,0,0,
20200629,CA,219252,None,None,None,totalTestsViral,4061692,6179,None,1686,None,None,None,None,6/29/2020 00:00,2020-06-29T00:00:00Z,06/28 20:00,5936,None,None,2020-06-29T00:00:00Z,4061692,None,None,219252,None,None,None,None,None,None,None,None,None,None,None,None,None,None,06,8009,0,219252,105740,219252,None,31,0,4c84ba553f59309faf657bf2982e61de092e9258,0,0,0,0,0,
20200630,CA,228732,None,None,None,totalTestsViral,4167139,6466,None,1751,None,None,None,None,6/30/2020 00:00,2020-06-30T00:00:00Z,06/29 20:00,5980,None,None,2020-06-30T00:00:00Z,4167139,None,None,228732,None,None,None,None,None,None,None,None,None,None,None,None,None,None,06,9480,0,228732,105447,228732,None,44,0,fe87fbb0899adb882a87b0b95b68aaa63db52b5a,0,0,0,0,0,
20200701,CA,236139,None,None,None,totalTestsViral,4254176,6612,None,1859,None,None,None,None,7/1/2020 00:00,2020-07-01T00:00:00Z,06/30 20:00,6090,None,None,2020-07-01T00:00:00Z,4254176,None,None,236139,None,None,None,None,None,None,None,None,None,None,None,None,None,None,06,7407,0,236139,87037,236139,None,110,0,851fbf0f952796f223bf8869f6ac941dfee8d998,0,0,0,0,0,
20200702,CA,242547,None,None,None,totalTestsViral,4338718,6812,None,1934,None,None,None,None,7/2/2020 00:00,2020-07-02T00:00:00Z,07/01 20:00,6163,None,None,2020-07-02T00:00:00Z,4338718,None,None,242547,None,None,None,None,None,None,None,None,None,None,None,None,None,None,06,6408,0,242547,84542,242547,None,73,0,f3e5fedb3370e26d0863c527b8a60e8ea00af65f,0,0,0,0,0,
20200703,CA,248235,None,None,None,totalTestsViral,4448176,7024,None,1871,None,None,None,None,7/3/2020 00:00,2020-07-03T00:00:00Z,07/02 20:00,6263,None,None,2020-07-03T00:00:00Z,4448176,None,None,248235,None,None,None,None,None,None,None,None,None,None,None,None,None,None,06,5688,0,248235,109458,248235,None,100,0,999bdc8b686af105a5864d8c4b480258a1726662,0,0,0,0,0,
20200704,CA,257388,None,None,None,totalTestsViral,4553031,7092,None,1888,None,None,None,None,7/4/2020 00:00,2020-07-04T00:00:00Z,07/03 20:00,6313,None,None,2020-07-04T00:00:00Z,4553031,None,None,257388,None,None,None,None,None,None,None,None,None,None,None,None,None,None,06,9153,0,257388,104855,257388,None,50,0,293c90a05bfa1cd84b654967f05bcfcf2a82f260,0,0,0,0,0,
20200705,CA,265985,None,None,None,totalTestsViral,4680138,7149,None,1907,None,None,None,None,7/5/2020 00:00,2020-07-05T00:00:00Z,07/04 20:00,6331,None,None,2020-07-05T00:00:00Z,4680138,None,None,265985,None,None,None,None,None,None,None,None,None,None,None,None,None,None,06,8597,0,265985,127107,265985,None,18,0,0df36671dbf8df4b7c2dcef16742f7a9291029c5,0,0,0,0,0,
20200706,CA,271684,None,None,None,totalTestsViral,4793353,7278,None,1937,None,None,None,None,7/6/2020 00:00,2020-07-06T00:00:00Z,07/05 20:00,6337,None,None,2020-07-06T00:00:00Z,4793353,None,None,271684,None,None,None,None,None,None,None,None,None,None,None,None,None,None,06,5699,0,271684,113215,271684,None,6,0,fbc9b34f23a434c767a9f59d7cbbbff2276f444f,0,0,0,0,0,
20200707,CA,277774,None,None,None,totalTestsViral,4896370,7499,None,1984,None,None,None,None,7/7/2020 00:00,2020-07-07T00:00:00Z,07/06 20:00,6448,None,None,2020-07-07T00:00:00Z,4896370,None,None,277774,None,None,None,None,None,None,None,None,None,None,None,None,None,None,06,6090,0,277774,103017,277774,None,111,0,6406d1da6c988755f5759f9166922eb3aaabdff2,0,0,0,0,0,
20200708,CA,289468,None,None,None,totalTestsViral,4996175,7705,None,1976,None,None,None,None,7/8/2020 00:00,2020-07-08T00:00:00Z,07/07 20:00,6562,None,None,2020-07-08T00:00:00Z,4996175,None,None,289468,None,None,None,None,None,None,None,None,None,None,None,None,None,None,06,11694,0,289468,99805,289468,None,114,0,6af380dc15aa715dfbde8ef888c7dab5bbc9491f,0,0,0,0,0,
20200709,CA,296499,None,None,None,totalTestsViral,5078434,7821,None,1957,None,None,None,None,7/9/2020 00:00,2020-07-09T00:00:00Z,07/08 20:00,6711,None,None,2020-07-09T00:00:00Z,5078434,None,None,296499,None,None,None,None,None,None,None,None,None,None,None,None,None,None,06,7031,0,296499,82259,296499,None,149,0,ca7c7fd094c45c215fb5cfca576f761408f20f01,0,0,0,0,0,
20200710,CA,304297,None,None,None,totalTestsViral,5175737,7896,None,2005,None,None,None,None,7/10/2020 00:00,2020-07-10T00:00:00Z,07/09 20:00,6851,None,None,2020-07-10T00:00:00Z,5175737,None,None,304297,None,None,None,None,None,None,None,None,None,None,None,None,None,None,06,7798,0,304297,97303,304297,None,140,0,ac9dec370090875d301417d54bc7e968f84bcaa2,0,0,0,0,0,
20200711,CA,312344,None,None,None,totalTestsViral,5275695,7904,None,2021,None,None,None,None,7/11/2020 00:00,2020-07-11T00:00:00Z,07/10 20:00,6945,None,None,2020-07-11T00:00:00Z,5275695,None,None,312344,None,None,None,None,None,None,None,None,None,None,None,None,None,None,06,8047,0,312344,99958,312344,None,94,0,a4a350ec08800df318da56c82b688e2f2e879a8f,0,0,0,0,0,
20200712,CA,320804,None,None,None,totalTestsViral,5406599,7854,None,2020,None,None,None,None,7/12/2020 00:00,2020-07-12T00:00:00Z,07/11 20:00,7017,None,None,2020-07-12T00:00:00Z,5406599,None,None,320804,None,None,None,None,None,None,None,None,None,None,None,None,None,None,06,8460,0,320804,130904,320804,None,72,0,3e3325a8e04946d6e008d3a103d57198bfbcf32b,0,0,0,0,0,
20200713,CA,329162,None,None,None,totalTestsViral,5544365,7895,None,2021,None,None,None,None,7/13/2020 00:00,2020-07-13T00:00:00Z,07/12 20:00,7040,None,None,2020-07-13T00:00:00Z,5544365,None,None,329162,None,None,None,None,None,None,None,None,None,None,None,None,None,None,06,8358,0,329162,137766,329162,None,23,0,8a08fea59a513ddf08cbf40ffffdec212ac38d3a,0,0,0,0,0,
20200714,CA,336508,None,None,None,totalTestsViral,5674955,8145,None,2083,None,None,None,None,7/14/2020 00:00,2020-07-14T00:00:00Z,07/13 20:00,7087,None,None,2020-07-14T00:00:00Z,5674955,None,None,336508,None,None,None,None,None,None,None,None,None,None,None,None,None,None,06,7346,0,336508,130590,336508,None,47,0,d366c644fc8fa7999e552994805a611f811d4c29,0,0,0,0,0,
20200715,CA,347634,None,None,None,totalTestsViral,5793276,8353,None,2110,None,None,None,None,7/15/2020 00:00,2020-07-15T00:00:00Z,07/14 20:00,7227,None,None,2020-07-15T00:00:00Z,5793276,None,None,347634,None,None,None,None,None,None,None,None,None,None,None,None,None,None,06,11126,0,347634,118321,347634,None,140,0,f78f9dda75d50f1f2bc74ba6a6de47626d775442,0,0,0,0,0,
20200716,CA,356178,None,None,None,totalTestsViral,5915508,8363,None,2120,None,None,None,None,7/16/2020 00:00,2020-07-16T00:00:00Z,07/15 20:00,7345,None,None,2020-07-16T00:00:00Z,5915508,None,None,356178,None,None,None,None,None,None,None,None,None,None,None,None,None,None,06,8544,0,356178,122232,356178,None,118,0,687eabba30f72bf7e0c42669d006a9fee1803ed4,0,0,0,0,0,
20200717,CA,366164,None,None,None,totalTestsViral,6044099,8450,None,2153,None,None,None,None,7/17/2020 00:00,2020-07-17T00:00:00Z,07/16 20:00,7475,None,None,2020-07-17T00:00:00Z,6044099,None,None,366164,None,None,None,None,None,None,None,None,None,None,None,None,None,None,06,9986,0,366164,128591,366164,None,130,0,9e3cab08f0f2b66dce43f629b70f4bcaa6c2830f,0,0,0,0,0,
20200718,CA,375363,None,None,None,totalTestsViral,6167218,8502,None,2125,None,None,None,None,7/18/2020 00:00,2020-07-18T00:00:00Z,07/17 20:00,7595,None,None,2020-07-18T00:00:00Z,6167218,None,None,375363,None,None,None,None,None,None,None,None,None,None,None,None,None,None,06,9199,0,375363,123119,375363,None,120,0,fd0a494e5eb561493d581a786a0f6c519409e78f,0,0,0,0,0,
20200719,CA,384692,None,None,None,totalTestsViral,6286852,8398,None,2107,None,None,None,None,7/19/2020 00:00,2020-07-19T00:00:00Z,07/18 20:00,7685,None,None,2020-07-19T00:00:00Z,6286852,None,None,384692,None,None,None,None,None,None,None,None,None,None,None,None,None,None,06,9329,0,384692,119634,384692,None,90,0,4965aee118fc42c88705c4d04af0812c1b06b916,0,0,0,0,0,
20200720,CA,391538,None,None,None,totalTestsViral,6414321,8419,None,2157,None,None,None,None,7/20/2020 00:00,2020-07-20T00:00:00Z,07/19 20:00,7694,None,None,2020-07-20T00:00:00Z,6414321,None,None,391538,None,None,None,None,None,None,None,None,None,None,None,None,None,None,06,6846,0,391538,127469,391538,None,9,0,b1326546080f9767b5bcf53be8850f10ff7f9686,0,0,0,0,0,
20200721,CA,400769,None,None,None,totalTestsViral,6536932,8681,None,2226,None,None,None,None,7/21/2020 00:00,2020-07-21T00:00:00Z,07/20 20:00,7755,None,None,2020-07-21T00:00:00Z,6536932,None,None,400769,None,None,None,None,None,None,None,None,None,None,None,None,None,None,06,9231,0,400769,122611,400769,None,61,0,f622126d4a79bbf87685e8e7c1cfa00d6d9e73dc,0,0,0,0,0,
20200722,CA,413576,None,None,None,totalTestsViral,6664419,8820,None,2284,None,None,None,None,7/22/2020 00:00,2020-07-22T00:00:00Z,07/21 20:00,7870,None,None,2020-07-22T00:00:00Z,6664419,None,None,413576,None,None,None,None,None,None,None,None,None,None,None,None,None,None,06,12807,0,413576,127487,413576,None,115,0,9a4a1895b9725e153f73d67b852d494af90616b3,0,0,0,0,0,
20200723,CA,425616,None,None,None,totalTestsViral,6778304,8820,None,2284,None,None,None,None,7/23/2020 00:00,2020-07-23T00:00:00Z,07/22 20:00,8027,None,None,2020-07-23T00:00:00Z,6778304,None,None,425616,None,None,None,None,None,None,None,None,None,None,None,None,None,None,06,12040,0,425616,113885,425616,None,157,0,1f64c5ca177720c9e86f2b00a6c5ad87451702ef,0,0,0,0,0,
20200724,CA,435334,None,None,None,totalTestsViral,6915876,8820,None,2284,None,None,None,None,7/24/2020 00:00,2020-07-24T00:00:00Z,07/23 20:00,8186,None,None,2020-07-24T00:00:00Z,6915876,None,None,435334,None,None,None,None,None,None,None,None,None,None,None,None,None,None,06,9718,0,435334,137572,435334,None,159,0,6609d8a6870d327546175a168c796036cafa85d6,0,0,0,0,0,
20200725,CA,445400,None,None,None,totalTestsViral,7047355,8820,None,2284,None,None,None,None,7/25/2020 00:00,2020-07-25T00:00:00Z,07/24 20:00,8337,None,None,2020-07-25T00:00:00Z,7047355,None,None,445400,None,None,None,None,None,None,None,None,None,None,None,None,None,None,06,10066,0,445400,131479,445400,None,151,0,6d592ad91bcd939d2aee395aa115fac12fbf66db,0,0,0,0,0,
20200726,CA,453659,None,None,None,totalTestsViral,7168139,8820,None,2284,None,None,None,None,7/26/2020 00:00,2020-07-26T00:00:00Z,07/25 20:00,8416,None,None,2020-07-26T00:00:00Z,7168139,None,None,453659,None,None,None,None,None,None,None,None,None,None,None,None,None,None,06,8259,0,453659,120784,453659,None,79,0,6eba4d7f381f7f93c751e32973509ffe053fe008,0,0,0,0,0,
20200727,CA,460550,None,None,None,totalTestsViral,7296578,8820,None,2284,None,None,None,None,7/27/2020 00:00,2020-07-27T00:00:00Z,07/26 20:00,8445,None,None,2020-07-27T00:00:00Z,7296578,None,None,460550,None,None,None,None,None,None,None,None,None,None,None,None,None,None,06,6891,0,460550,128439,460550,None,29,0,ef13e70ac76d69900d26abc867e5367844de343c,0,0,0,0,0,
20200728,CA,466550,None,None,None,totalTestsViral,7417866,8317,None,2198,None,None,None,None,7/28/2020 00:00,2020-07-28T00:00:00Z,07/27 20:00,8518,None,None,2020-07-28T00:00:00Z,7417866,None,None,466550,None,None,None,None,None,None,None,None,None,None,None,None,None,None,06,6000,0,466550,121288,466550,None,73,0,9e609a27db4060f59ecf21241ccf94f498cbe190,0,0,0,0,0,
20200729,CA,475305,None,None,None,totalTestsViral,7517466,8439,None,2209,None,None,None,None,7/29/2020 00:00,2020-07-29T00:00:00Z,07/28 20:00,8715,None,None,2020-07-29T00:00:00Z,7517466,None,None,475305,None,None,None,None,None,None,None,None,None,None,None,None,None,None,06,8755,0,475305,99600,475305,None,197,0,2ef58463814804476fa7fba82f36e814edf00acb,0,0,0,0,0,
20200730,CA,485502,None,None,None,totalTestsViral,7633840,8198,None,2220,None,None,None,None,7/30/2020 00:00,2020-07-30T00:00:00Z,07/29 20:00,8909,None,None,2020-07-30T00:00:00Z,7633840,None,None,485502,None,None,None,None,None,None,None,None,None,None,None,None,None,None,06,10197,0,485502,116374,485502,None,194,0,4836c1469c752a390173c5f9f9f45b035e1ce251,0,0,0,0,0,
20200731,CA,493588,None,None,None,totalTestsViral,7811041,7999,None,2163,None,None,None,None,7/31/2020 00:00,2020-07-31T00:00:00Z,07/30 20:00,9005,None,None,2020-07-31T00:00:00Z,7811041,None,None,493588,None,None,None,None,None,None,None,None,None,None,None,None,None,None,06,8086,0,493588,177201,493588,None,96,0,1eb7f684b3e7773ab0f07641dbee28613472f14d,0,0,0,0,0,
20200801,CA,500130,None,None,None,totalTestsViral,7886587,7754,None,2120,None,None,None,None,7/31/2020 00:00,2020-07-31T00:00:00Z,07/30 20:00,9224,None,None,2020-07-31T00:00:00Z,7886587,None,None,500130,None,None,None,None,None,None,None,None,None,None,None,None,None,None,06,6542,0,500130,75546,500130,None,219,0,f2a2d04088f9c784d1c650e93599aed6b5c765a2,0,0,0,0,0,
20200802,CA,509162,None,None,None,totalTestsViral,8035975,7761,None,2119,None,None,None,None,8/2/2020 00:00,2020-08-02T00:00:00Z,08/01 20:00,9356,None,None,2020-08-02T00:00:00Z,8035975,None,None,509162,None,None,None,None,None,None,None,None,None,None,None,None,None,None,06,9032,0,509162,149388,509162,None,132,0,e41cd836c003244dee559262a89febb7755242a3,0,0,0,0,0,
20200803,CA,514901,None,None,None,totalTestsViral,8184696,7629,None,2069,None,None,None,None,8/3/2020 00:00,2020-08-03T00:00:00Z,08/02 20:00,9388,None,None,2020-08-03T00:00:00Z,8184696,None,None,514901,None,None,None,None,None,None,None,None,None,None,None,None,None,None,06,5739,0,514901,148721,514901,None,32,0,a83ea766d1d9ce5a7dbb00bac1b5f559663a50e4,0,0,0,0,0,
20200804,CA,519427,None,None,None,totalTestsViral,8305713,7630,None,2082,None,None,None,None,8/4/2020 00:00,2020-08-04T00:00:00Z,08/03 20:00,9501,None,None,2020-08-04T00:00:00Z,8305713,None,None,519427,None,None,None,None,None,None,None,None,None,None,None,None,None,None,06,4526,0,519427,121017,519427,None,113,0,009a914a2c309e99e178e32570606af5607b3fe0,0,0,0,0,0,
20200805,CA,524722,None,None,None,totalTestsViral,8409400,7552,None,2005,None,None,None,None,8/5/2020 00:00,2020-08-05T00:00:00Z,08/04 20:00,9703,None,None,2020-08-05T00:00:00Z,8409400,None,None,524722,None,None,None,None,None,None,None,None,None,None,None,None,None,None,06,5295,0,524722,103687,524722,None,202,0,7a475e9f20c68b5363adbdf0b67fee2274d77df8,0,0,0,0,0,
20200806,CA,529980,None,None,None,totalTestsViral,8500463,7485,None,2026,None,None,None,None,8/6/2020 00:00,2020-08-06T00:00:00Z,08/05 20:00,9869,None,None,2020-08-06T00:00:00Z,8500463,None,None,529980,None,None,None,None,None,None,None,None,None,None,None,None,None,None,06,5258,0,529980,91063,529980,None,166,0,795e604f71b237f5a8e882181b93f3cf795f6dad,0,0,0,0,0,
20200807,CA,538416,None,None,None,totalTestsViral,8596882,7277,None,1978,None,None,None,None,8/7/2020 00:00,2020-08-07T00:00:00Z,08/06 20:00,10011,None,None,2020-08-07T00:00:00Z,8596882,None,None,538416,None,None,None,None,None,None,None,None,None,None,None,None,None,None,06,8436,0,538416,96419,538416,None,142,0,123c2d33f39ce9b44888128114b7120ffb3dba16,0,0,0,0,0,
20200808,CA,545787,None,None,None,totalTestsViral,8707527,6956,None,2038,None,None,None,None,8/8/2020 00:00,2020-08-08T00:00:00Z,08/07 20:00,10189,None,None,2020-08-08T00:00:00Z,8707527,None,None,545787,None,None,None,None,None,None,None,None,None,None,None,None,None,None,06,7371,0,545787,110645,545787,None,178,0,841258a5ac15ce9f9ab90cd1de796bf966a1d136,0,0,0,0,0,
20200809,CA,554160,None,None,None,totalTestsViral,8826119,6849,None,1891,None,None,None,None,8/9/2020 00:00,2020-08-09T00:00:00Z,08/08 20:00,10293,None,None,2020-08-09T00:00:00Z,8826119,None,None,554160,None,None,None,None,None,None,None,None,None,None,None,None,None,None,06,8373,0,554160,118592,554160,None,104,0,f3ec349d607fb6850f0d596afff9b82424174310,0,0,0,0,0,
20200810,CA,561911,None,None,None,totalTestsViral,8998353,6770,None,1879,None,None,None,None,8/9/2020 00:00,2020-08-09T00:00:00Z,08/08 20:00,10359,None,None,2020-08-09T00:00:00Z,8998353,None,None,561911,None,None,None,None,None,None,None,None,None,None,None,None,None,None,06,7751,0,561911,172234,561911,None,66,0,e2559e56dd7b756719fac024ca2bef8c241712a9,0,0,0,0,0,
20200811,CA,574411,None,None,None,totalTestsViral,9186279,6759,None,1885,None,None,None,None,8/10/2020 00:00,2020-08-10T00:00:00Z,08/09 20:00,10468,None,None,2020-08-10T00:00:00Z,9186279,None,None,574411,None,None,None,None,None,None,None,None,None,None,None,None,None,None,06,12500,0,574411,187926,574411,None,109,0,e142146f595443b615b2c8ecb4c71359788ff0dc,0,0,0,0,0,
20200812,CA,586056,None,None,None,totalTestsViral,9303467,6647,None,1873,None,None,None,None,8/11/2020 00:00,2020-08-11T00:00:00Z,08/10 20:00,10648,None,None,2020-08-11T00:00:00Z,9303467,None,None,586056,None,None,None,None,None,None,None,None,None,None,None,None,None,None,06,11645,0,586056,117188,586056,None,180,0,7a46b32d71feea3e20f93840ee146363048bc7ad,0,0,0,0,0,
20200813,CA,593141,None,None,None,totalTestsViral,9445493,6424,None,1826,None,None,None,None,8/13/2020 00:00,2020-08-13T00:00:00Z,08/12 20:00,10808,None,None,2020-08-13T00:00:00Z,9445493,None,None,593141,None,None,None,None,None,None,None,None,None,None,None,None,None,None,06,7085,0,593141,142026,593141,None,160,0,3b09eede30db9b92bb368fc319a2a618c9bd6419,0,0,0,0,0,
20200814,CA,601075,None,None,None,totalTestsViral,9556598,6364,None,1850,None,None,None,None,8/14/2020 00:00,2020-08-14T00:00:00Z,08/13 20:00,10996,None,None,2020-08-14T00:00:00Z,9556598,None,None,601075,None,None,None,None,None,None,None,None,None,None,None,None,None,None,06,7934,0,601075,111105,601075,None,188,0,26732834bc0884147b15e801238a5f609556c185,0,0,0,0,0,
20200815,CA,613689,None,None,None,totalTestsViral,9681111,6327,None,1812,None,None,None,None,8/15/2020 00:00,2020-08-15T00:00:00Z,08/14 20:00,11147,None,None,2020-08-15T00:00:00Z,9681111,None,None,613689,None,None,None,None,None,None,None,None,None,None,None,None,None,None,06,12614,0,613689,124513,613689,None,151,0,8dee5339399c647df9b00f2c642bdc9db33b8110,0,0,0,0,0,
20200816,CA,621562,None,None,None,totalTestsViral,9798135,6309,None,1820,None,None,None,None,8/16/2020 00:00,2020-08-16T00:00:00Z,08/15 20:00,11224,None,None,2020-08-16T00:00:00Z,9798135,None,None,621562,None,None,None,None,None,None,None,None,None,None,None,None,None,None,06,7873,0,621562,117024,621562,None,77,0,81c36f3d4b3a7dd050fadc97c1e2261b519bc60b,0,0,0,0,0,
20200817,CA,628031,None,None,None,totalTestsViral,9933780,6332,None,1811,None,None,None,None,8/17/2020 00:00,2020-08-17T00:00:00Z,08/16 20:00,11242,None,None,2020-08-17T00:00:00Z,9933780,None,None,628031,None,None,None,None,None,None,None,None,None,None,None,None,None,None,06,6469,0,628031,135645,628031,None,18,0,57f723b00ececb2fca50803a8ad1559365044f59,0,0,0,0,0,
20200818,CA,632667,None,None,None,totalTestsViral,10049039,6360,None,1801,None,None,None,None,8/18/2020 00:00,2020-08-18T00:00:00Z,08/17 20:00,11342,None,None,2020-08-18T00:00:00Z,10049039,None,None,632667,None,None,None,None,None,None,None,None,None,None,None,None,None,None,06,4636,0,632667,115259,632667,None,100,0,15009bbb3fcdd1486bcd4870fb11dd34c3273123,0,0,0,0,0,
20200819,CA,638831,None,None,None,totalTestsViral,10140683,6479,None,1761,None,None,None,None,8/19/2020 00:00,2020-08-19T00:00:00Z,08/18 20:00,11523,None,None,2020-08-19T00:00:00Z,10140683,None,None,638831,None,None,None,None,None,None,None,None,None,None,None,None,None,None,06,6164,0,638831,91644,638831,None,181,0,5aeacadc844124709fba0a2aa0815f14495d1430,0,0,0,0,0,
20200820,CA,644751,None,None,None,totalTestsViral,10227966,6212,None,1707,None,None,None,None,8/20/2020 00:00,2020-08-20T00:00:00Z,08/19 20:00,11686,None,None,2020-08-20T00:00:00Z,10227966,None,None,644751,None,None,None,None,None,None,None,None,None,None,None,None,None,None,06,5920,0,644751,87283,644751,None,163,0,37d2c713209ac2a1313173da2a0f89c0555d9391,0,0,0,0,0,
20200821,CA,650336,None,None,None,totalTestsViral,10329372,6039,None,1706,None,None,None,None,8/21/2020 00:00,2020-08-21T00:00:00Z,08/20 20:00,11821,None,None,2020-08-21T00:00:00Z,10329372,None,None,650336,None,None,None,None,None,None,None,None,None,None,None,None,None,None,06,5585,0,650336,101406,650336,None,135,0,021e88f17fda6336c1d4eeae917c2cb2897475f7,0,0,0,0,0,
20200822,CA,656892,None,None,None,totalTestsViral,10436352,5873,None,1675,None,None,None,None,8/22/2020 00:00,2020-08-22T00:00:00Z,08/21 20:00,11988,None,None,2020-08-22T00:00:00Z,10436352,None,None,656892,None,None,None,None,None,None,None,None,None,None,None,None,None,None,06,6556,0,656892,106980,656892,None,167,0,8e3a43c50d207e309ce4ed00fdd67b283486498c,0,0,0,0,0,
20200823,CA,663669,None,None,None,totalTestsViral,10541031,5665,None,1582,None,None,None,None,8/23/2020 00:00,2020-08-23T00:00:00Z,08/22 20:00,12134,None,None,2020-08-23T00:00:00Z,10541031,None,None,663669,None,None,None,None,None,None,None,None,None,None,None,None,None,None,06,6777,0,663669,104679,663669,None,146,0,1b5a49276255a9d38c83e152d905ccefd14977c5,0,0,0,0,0,
20200824,CA,668615,None,None,None,totalTestsViral,10652487,5618,None,1549,None,None,None,None,8/24/2020 00:00,2020-08-24T00:00:00Z,08/23 20:00,12152,None,None,2020-08-24T00:00:00Z,10652487,None,None,668615,None,None,None,None,None,None,None,None,None,None,None,None,None,None,06,4946,0,668615,111456,668615,None,18,0,29b124857bec2aaa099590f470e9de75cec7025a,0,0,0,0,0,
20200825,CA,673095,None,None,None,totalTestsViral,10762506,5561,None,1540,None,None,None,None,8/25/2020 02:59,2020-08-25T02:59:00Z,08/24 22:59,12257,None,None,2020-08-25T02:59:00Z,10762506,None,None,673095,None,None,None,None,None,None,None,None,None,None,None,None,None,None,06,4480,0,673095,110019,673095,None,105,0,6f3e2b3dce5c5179fc033220614c097e090960d2,0,0,0,0,0,
20200826,CA,679099,None,None,None,totalTestsViral,10832757,5537,None,1507,None,None,None,None,8/26/2020 02:59,2020-08-26T02:59:00Z,08/25 22:59,12407,None,None,2020-08-26T02:59:00Z,10832757,None,None,679099,None,None,None,None,None,None,None,None,None,None,None,None,None,None,06,6004,0,679099,70251,679099,None,150,0,abdde1e77d5621bbb67f9a63d3baa8082cadb128,0,0,0,0,0,
20200827,CA,683529,None,None,None,totalTestsViral,10918415,5397,None,1492,None,None,None,None,8/27/2020 02:59,2020-08-27T02:59:00Z,08/26 22:59,12550,None,None,2020-08-27T02:59:00Z,10918415,None,None,683529,None,None,None,None,None,None,None,None,None,None,None,None,None,None,06,4430,0,683529,85658,683529,None,143,0,2f41e1966c65b200365542ec5675877bad393f3d,0,0,0,0,0,
20200828,CA,688858,None,None,None,totalTestsViral,11010637,5267,None,1477,None,None,None,None,8/28/2020 02:59,2020-08-28T02:59:00Z,08/27 22:59,12690,None,None,2020-08-28T02:59:00Z,11010637,None,None,688858,None,None,None,None,None,None,None,None,None,None,None,None,None,None,06,5329,0,688858,92222,688858,None,140,0,6b308b87e2470d550a296c0b1dd61dc20d0b22a7,0,0,0,0,0,
20200829,CA,693839,None,None,None,totalTestsViral,11109630,5063,None,1411,None,None,None,None,8/29/2020 02:59,2020-08-29T02:59:00Z,08/28 22:59,12834,None,None,2020-08-29T02:59:00Z,11109630,None,None,693839,None,None,None,None,None,None,None,None,None,None,None,None,None,None,06,4981,0,693839,98993,693839,None,144,0,d44b69e8589ae8e0fb703500bfac30d46514461e,0,0,0,0,0,
20200830,CA,699909,None,None,None,totalTestsViral,11231829,4943,None,1396,None,None,None,None,8/30/2020 02:59,2020-08-30T02:59:00Z,08/29 22:59,12905,None,None,2020-08-30T02:59:00Z,11231829,None,None,699909,None,None,None,None,None,None,None,None,None,None,None,None,None,None,06,6070,0,699909,122199,699909,None,71,0,1e101e8ee5e3dd85e5d39c75ba17d2368fb378d0,0,0,0,0,0,
20200831,CA,704085,None,None,None,totalTestsViral,11373305,4829,None,1346,None,None,None,None,8/31/2020 02:59,2020-08-31T02:59:00Z,08/30 22:59,12933,None,None,2020-08-31T02:59:00Z,11373305,None,None,704085,None,None,None,None,None,None,None,None,None,None,None,None,None,None,06,4176,0,704085,141476,704085,None,28,0,5b3e4ef5178cab50a02891fe16bf81bbf235cbb3,0,0,0,0,0,
20200901,CA,707797,None,None,None,totalTestsViral,11470696,4869,None,1352,None,None,None,None,9/1/2020 02:59,2020-09-01T02:59:00Z,08/31 22:59,13018,None,None,2020-09-01T02:59:00Z,11470696,None,None,707797,None,None,None,None,None,None,None,None,None,None,None,None,None,None,06,3712,0,707797,97391,707797,None,85,0,f93861a9f0bfc8b07e17a72e03d1c90d0aad28fd,0,0,0,0,0,
20200902,CA,712052,None,None,None,totalTestsViral,11580370,4851,None,1339,None,None,None,None,9/2/2020 02:59,2020-09-02T02:59:00Z,09/01 22:59,13163,None,None,2020-09-02T02:59:00Z,11580370,None,None,712052,None,None,None,None,None,None,None,None,None,None,None,None,None,None,06,4255,0,712052,109674,712052,None,145,0,e0151068aeb8cb38ec245473b94b1d607a72acff,0,0,0,0,0,
20200903,CA,717177,None,None,None,totalTestsViral,11663924,4571,None,1270,None,None,None,None,9/3/2020 02:59,2020-09-03T02:59:00Z,09/02 22:59,13327,None,None,2020-09-03T02:59:00Z,11663924,None,None,717177,None,None,None,None,None,None,None,None,None,None,None,None,None,None,06,5125,0,717177,83554,717177,None,164,0,470d71b5aa6bcc2e150fa3e724408e5b18c8e9eb,0,0,0,0,0,
20200904,CA,722283,None,None,None,totalTestsViral,11796970,4401,None,1235,None,None,None,None,9/4/2020 02:59,2020-09-04T02:59:00Z,09/03 22:59,13490,None,None,2020-09-04T02:59:00Z,11796970,None,None,722283,None,None,None,None,None,None,None,None,None,None,None,None,None,None,06,5106,0,722283,133046,722283,None,163,0,41a3ded603bec6e1160a53503126078e975fa31b,0,0,0,0,0,
20200905,CA,727239,None,None,None,totalTestsViral,11916323,4242,None,1242,None,None,None,None,9/5/2020 02:59,2020-09-05T02:59:00Z,09/04 22:59,13643,None,None,2020-09-05T02:59:00Z,11916323,None,None,727239,None,None,None,None,None,None,None,None,None,None,None,None,None,None,06,4956,0,727239,119353,727239,None,153,0,7216683e7edbe67e078095782f590575234f00f3,0,0,0,0,0,
20200906,CA,732144,None,None,None,totalTestsViral,12047191,4226,None,1201,None,None,None,None,9/6/2020 02:59,2020-09-06T02:59:00Z,09/05 22:59,13709,None,None,2020-09-06T02:59:00Z,12047191,None,None,732144,None,None,None,None,None,None,None,None,None,None,None,None,None,None,06,4905,0,732144,130868,732144,None,66,0,c1fda97b6ff8b286debd457366b5e6bd22913a4a,0,0,0,0,0,
20200907,CA,735235,None,None,None,totalTestsViral,12158292,4285,None,1244,None,None,None,None,9/6/2020 02:59,2020-09-06T02:59:00Z,09/05 22:59,13726,None,None,2020-09-06T02:59:00Z,12158292,None,None,735235,None,None,None,None,None,None,None,None,None,None,None,None,None,None,06,3091,0,735235,111101,735235,None,17,0,4701e28f1a74e0586fd39f7f07c87b94fef24f66,0,0,0,0,0,
20200908,CA,737911,None,None,None,totalTestsViral,12267948,4297,None,1217,None,None,None,None,9/8/2020 02:59,2020-09-08T02:59:00Z,09/07 22:59,13758,None,None,2020-09-08T02:59:00Z,12267948,None,None,737911,None,None,None,None,None,None,None,None,None,None,None,None,None,None,06,2676,0,737911,109656,737911,None,32,0,453cf478f0cb8c622a082fa79181d2bef860b44d,0,0,0,0,0,
20200909,CA,739527,None,None,None,totalTestsViral,12343797,4425,None,1233,None,None,None,None,9/9/2020 02:59,2020-09-09T02:59:00Z,09/08 22:59,13841,None,None,2020-09-09T02:59:00Z,12343797,None,None,739527,None,None,None,None,None,None,None,None,None,None,None,None,None,None,06,1616,0,739527,75849,739527,None,83,0,b5eb61392c5fc55c0fc8ade0b721c2486a36e84f,0,0,0,0,0,
20200910,CA,742865,None,None,None,totalTestsViral,12389991,4225,None,1184,None,None,None,None,9/10/2020 02:59,2020-09-10T02:59:00Z,09/09 22:59,13978,None,None,2020-09-10T02:59:00Z,12389991,None,None,742865,None,None,None,None,None,None,None,None,None,None,None,None,None,None,06,3338,0,742865,46194,742865,None,137,0,c52682873324cdf1a71d2344db8d26265989c256,0,0,0,0,0,
20200911,CA,746191,None,None,None,totalTestsViral,12451660,4023,None,1172,None,None,None,None,9/11/2020 02:59,2020-09-11T02:59:00Z,09/10 22:59,14089,None,None,2020-09-11T02:59:00Z,12451660,None,None,746191,None,None,None,None,None,None,None,None,None,None,None,None,None,None,06,3326,0,746191,61669,746191,None,111,0,493e68882056275752a4b7db06606ab112dc040e,0,0,0,0,0,
20200912,CA,750298,None,None,None,totalTestsViral,12556967,3848,None,1120,None,None,None,None,9/12/2020 02:59,2020-09-12T02:59:00Z,09/11 22:59,14251,None,None,2020-09-12T02:59:00Z,12556967,None,None,750298,None,None,None,None,None,None,None,None,None,None,None,None,None,None,06,4107,0,750298,105307,750298,None,162,0,12edcf5de8fb91f1733018acc23b8477a68aa818,0,0,0,0,0,
20200913,CA,754923,None,None,None,totalTestsViral,12690016,3741,None,1056,None,None,None,None,9/13/2020 02:59,2020-09-13T02:59:00Z,09/12 22:59,14329,None,None,2020-09-13T02:59:00Z,12690016,None,None,754923,None,None,None,None,None,None,None,None,None,None,None,None,None,None,06,4625,0,754923,133049,754923,None,78,0,4c6c8090ad328a2642b114b1421c34381c7b428f,0,0,0,0,0,
20200914,CA,757778,None,None,None,totalTestsViral,12806189,3665,None,1040,None,None,None,None,9/14/2020 02:59,2020-09-14T02:59:00Z,09/13 22:59,14385,None,None,2020-09-14T02:59:00Z,12806189,None,None,757778,None,None,None,None,None,None,None,None,None,None,None,None,None,None,06,2855,0,757778,116173,757778,None,56,0,5d1f0bafb2d8bb8c8df93c83715409d22c971ba3,0,0,0,0,0,
20200915,CA,760013,None,None,None,totalTestsViral,12928170,3735,None,1044,None,None,None,None,9/15/2020 02:59,2020-09-15T02:59:00Z,09/14 22:59,14451,None,None,2020-09-15T02:59:00Z,12928170,None,None,760013,None,None,None,None,None,None,None,None,None,None,None,None,None,None,06,2235,0,760013,121981,760013,None,66,0,cc4ccd7442986256b2f9efaf80ddc05912c2c399,0,0,0,0,0,
20200916,CA,762963,None,None,None,totalTestsViral,13000522,3685,None,1032,None,None,None,None,9/16/2020 02:59,2020-09-16T02:59:00Z,09/15 22:59,14615,None,None,2020-09-16T02:59:00Z,13000522,None,None,762963,None,None,None,None,None,None,None,None,None,None,None,None,None,None,06,2950,0,762963,72352,762963,None,164,0,9e5b7b49ab36abf9963bf91d9545c4ca79de1830,0,0,0,0,0,
20200917,CA,766201,None,None,None,totalTestsViral,13080037,3621,None,997,None,None,None,None,9/17/2020 02:59,2020-09-17T02:59:00Z,09/16 22:59,14721,None,None,2020-09-17T02:59:00Z,13080037,None,None,766201,None,None,None,None,None,None,None,None,None,None,None,None,None,None,06,3238,0,766201,79515,766201,None,106,0,e09cf5d3b7d1ccd37629c9439085f0e957b96168,0,0,0,0,0,
20200918,CA,769831,None,None,None,totalTestsViral,13177186,3570,None,965,None,None,None,None,9/18/2020 02:59,2020-09-18T02:59:00Z,09/17 22:59,14812,None,None,2020-09-18T02:59:00Z,13177186,None,None,769831,None,None,None,None,None,None,None,None,None,None,None,None,None,None,06,3630,0,769831,97149,769831,None,91,0,19313caaf40961ecb35423c483773fe00c168a72,0,0,0,0,0,
20200919,CA,774135,None,None,None,totalTestsViral,13343886,3510,None,970,None,None,None,None,9/19/2020 02:59,2020-09-19T02:59:00Z,09/18 22:59,14912,None,None,2020-09-19T02:59:00Z,13343886,None,None,774135,None,None,None,None,None,None,None,None,None,None,None,None,None,None,06,4304,0,774135,166700,774135,None,100,0,b7f7983f9372dba2eaea742e9c5d0e1f8f4aa9e9,0,0,0,0,0,
20200920,CA,778400,None,None,None,totalTestsViral,13523158,3441,None,925,None,None,None,None,9/20/2020 02:59,2020-09-20T02:59:00Z,09/19 22:59,14987,None,None,2020-09-20T02:59:00Z,13523158,None,None,778400,None,None,None,None,None,None,None,None,None,None,None,None,None,None,06,4265,0,778400,179272,778400,None,75,0,0cb1d659dedbf5a1ff8c8bc150e9947436d7ba05,0,0,0,0,0,
20200921,CA,781694,None,None,None,totalTestsViral,13672782,3459,None,960,None,None,None,None,9/21/2020 02:59,2020-09-21T02:59:00Z,09/20 22:59,15018,None,None,2020-09-21T02:59:00Z,13672782,None,None,781694,None,None,None,None,None,None,None,None,None,None,None,None,None,None,06,3294,0,781694,149624,781694,None,31,0,87315af79eab47e432abc954cc6c69fd9443a57e,0,0,0,0,0,
20200922,CA,784324,None,None,None,totalTestsViral,13804055,3520,None,923,None,None,None,None,9/22/2020 02:59,2020-09-22T02:59:00Z,09/21 22:59,15071,None,None,2020-09-22T02:59:00Z,13804055,None,None,784324,None,None,None,None,None,None,None,None,None,None,None,None,None,None,06,2630,0,784324,131273,784324,None,53,0,b15337957afedacecede7ac566380f36bb1a604b,0,0,0,0,0,
20200923,CA,787470,None,None,None,totalTestsViral,13879423,3557,None,905,None,None,None,None,9/23/2020 02:59,2020-09-23T02:59:00Z,09/22 22:59,15204,None,None,2020-09-23T02:59:00Z,13879423,None,None,787470,None,None,None,None,None,None,None,None,None,None,None,None,None,None,06,3146,0,787470,75368,787470,None,133,0,df753ee372b4fe8cf92e76476d23777741210baa,0,0,0,0,0,
20200924,CA,790640,None,None,None,totalTestsViral,13952857,3484,None,914,None,None,None,None,9/24/2020 02:59,2020-09-24T02:59:00Z,09/23 22:59,15314,None,None,2020-09-24T02:59:00Z,13952857,None,None,790640,None,None,None,None,None,None,None,None,None,None,None,None,None,None,06,3170,0,790640,73434,790640,None,110,0,ac259097854bb04fda66b6bf6cb5efbfc73306f5,0,0,0,0,0,
20200925,CA,794040,None,None,None,totalTestsViral,14052247,3307,None,899,None,None,None,None,9/24/2020 02:59,2020-09-24T02:59:00Z,09/23 22:59,15398,None,None,2020-09-24T02:59:00Z,14052247,None,None,794040,None,None,None,None,None,None,None,None,None,None,None,None,None,None,06,3400,0,794040,99390,794040,None,84,0,650abb70684ca982997cf4fb0c15b096e4ca498f,0,0,0,0,0,
20200926,CA,798237,None,None,None,totalTestsViral,14182730,3203,None,862,None,None,None,None,9/26/2020 02:59,2020-09-26T02:59:00Z,09/25 22:59,15532,None,None,2020-09-26T02:59:00Z,14182730,None,None,798237,None,None,None,None,None,None,None,None,None,None,None,None,None,None,06,4197,0,798237,130483,798237,None,134,0,82b07d7b1fc8e35627f622c20e695f0657d93730,0,0,0,0,0,
20200927,CA,802308,None,None,None,totalTestsViral,14333498,3129,None,892,None,None,None,None,9/27/2020 02:59,2020-09-27T02:59:00Z,09/26 22:59,15587,None,None,2020-09-27T02:59:00Z,14333498,None,None,802308,None,None,None,None,None,None,None,None,None,None,None,None,None,None,06,4071,0,802308,150768,802308,None,55,0,b349bcded9488c9cae15949f77534f850638dc33,0,0,0,0,0,
20200928,CA,805263,None,None,None,totalTestsViral,14484852,3160,None,831,None,None,None,None,9/28/2020 02:59,2020-09-28T02:59:00Z,09/27 22:59,15608,None,None,2020-09-28T02:59:00Z,14484852,None,None,805263,None,None,None,None,None,None,None,None,None,None,None,None,None,None,06,2955,0,805263,151354,805263,None,21,0,60275593dfa6927ea37db1d058ffbfc2fa249bb9,0,0,0,0,0,
20200929,CA,807425,None,None,None,totalTestsViral,14613545,3223,None,828,None,None,None,None,9/29/2020 02:59,2020-09-29T02:59:00Z,09/28 22:59,15640,None,None,2020-09-29T02:59:00Z,14613545,None,None,807425,None,None,None,None,None,None,None,None,None,None,None,None,None,None,06,2162,0,807425,128693,807425,None,32,0,db2c79741cbcae46da5f03d74df55c5a5b5b44dd,0,0,0,0,0,
20200930,CA,810625,None,None,None,totalTestsViral,14705202,3267,None,830,None,None,None,None,9/30/2020 02:59,2020-09-30T02:59:00Z,09/29 22:59,15792,None,None,2020-09-30T02:59:00Z,14705202,None,None,810625,None,None,None,None,None,None,None,None,None,None,None,None,None,None,06,3200,0,810625,91657,810625,None,152,0,64b2c3299667c39b0f42f75ff6bcef5e19ba6c52,0,0,0,0,0,
20201001,CA,813687,None,None,None,totalTestsViral,14771851,3205,None,817,None,None,None,None,10/1/2020 02:59,2020-10-01T02:59:00Z,09/30 22:59,15888,None,None,2020-10-01T02:59:00Z,14771851,None,None,813687,None,None,None,None,None,None,None,None,None,None,None,None,None,None,06,3062,0,813687,66649,813687,None,96,0,e12087d48c1c42da6b180d0cdc5600a21afe92ab,0,0,0,0,0,
20201002,CA,817277,None,None,None,totalTestsViral,14868431,3166,None,796,None,None,None,None,10/2/2020 02:59,2020-10-02T02:59:00Z,10/01 22:59,15986,None,None,2020-10-02T02:59:00Z,14868431,None,None,817277,None,None,None,None,None,None,None,None,None,None,None,None,None,None,06,3590,0,817277,96580,817277,None,98,0,9079720ea6b3fa45bbba080f7ab3d8a7595c0719,0,0,0,0,0,
20201003,CA,819436,None,None,None,totalTestsViral,14998888,3079,None,787,None,None,None,None,10/3/2020 02:59,2020-10-03T02:59:00Z,10/02 22:59,16074,None,None,2020-10-03T02:59:00Z,14998888,None,None,819436,None,None,None,None,None,None,None,None,None,None,None,None,None,None,06,2159,0,819436,130457,819436,None,88,0,74881170ea3404e884eb572fdbfb51af901641e0,0,0,0,0,0,
20201004,CA,823729,None,None,None,totalTestsViral,15160287,3129,None,787,None,None,None,None,10/4/2020 02:59,2020-10-04T02:59:00Z,10/03 22:59,16120,None,None,2020-10-04T02:59:00Z,15160287,None,None,823729,None,None,None,None,None,None,None,None,None,None,None,None,None,None,06,4293,0,823729,161399,823729,None,46,0,dfcf7d80e84686eb17e406839c856b833142343c,0,0,0,0,0,
20201005,CA,826784,None,None,None,totalTestsViral,15301681,3146,None,805,None,None,None,None,10/5/2020 02:59,2020-10-05T02:59:00Z,10/04 22:59,16149,None,None,2020-10-05T02:59:00Z,15301681,None,None,826784,None,None,None,None,None,None,None,None,None,None,None,None,None,None,06,3055,0,826784,141394,826784,None,29,0,096ef381368a47ccde17bc26f248ed56da4f289b,0,0,0,0,0,
20201006,CA,828461,None,None,None,totalTestsViral,15430421,3175,None,809,None,None,None,None,10/6/2020 02:59,2020-10-06T02:59:00Z,10/05 22:59,16177,None,None,2020-10-06T02:59:00Z,15430421,None,None,828461,None,None,None,None,None,None,None,None,None,None,None,None,None,None,06,1677,0,828461,128740,828461,None,28,0,9253966fefefc90aeaeb33177eee6515f154fbd7,0,0,0,0,0,
20201007,CA,831225,None,None,None,totalTestsViral,15556706,3204,None,797,None,None,None,None,10/7/2020 02:59,2020-10-07T02:59:00Z,10/06 22:59,16228,None,None,2020-10-07T02:59:00Z,15556706,None,None,831225,None,None,None,None,None,None,None,None,None,None,None,None,None,None,06,2764,0,831225,126285,831225,None,51,0,3f2d2bdeee4d6434b64f9386486b26de638dda05,0,0,0,0,0,
20201008,CA,834800,None,None,None,totalTestsViral,15623623,3186,None,754,None,None,None,None,10/8/2020 02:59,2020-10-08T02:59:00Z,10/07 22:59,16361,None,None,2020-10-08T02:59:00Z,15623623,None,None,834800,None,None,None,None,None,None,None,None,None,None,None,None,None,None,06,3575,0,834800,66917,834800,None,133,0,c0b41796c7996fb2f46acb76b21834f5cd3940ca,0,0,0,0,0,
20201009,CA,838606,None,None,None,totalTestsViral,15736497,3186,None,742,None,None,None,None,10/9/2020 02:59,2020-10-09T02:59:00Z,10/08 22:59,16428,None,None,2020-10-09T02:59:00Z,15736497,None,None,838606,None,None,None,None,None,None,None,None,None,None,None,None,None,None,06,3806,0,838606,112874,838606,None,67,0,cefb0a2adb2f0c1b09a2cebaa52e04c3b307a45c,0,0,0,0,0,
20201010,CA,842776,None,None,None,totalTestsViral,15878445,3084,None,732,None,None,None,None,10/10/2020 02:59,2020-10-10T02:59:00Z,10/09 22:59,16500,None,None,2020-10-10T02:59:00Z,15878445,None,None,842776,None,None,None,None,None,None,None,None,None,None,None,None,None,None,06,4170,0,842776,141948,842776,None,72,0,f3716bad847ad45d61ffd4c23a413cbc3d58f579,0,0,0,0,0,
20201011,CA,846579,None,None,None,totalTestsViral,16047004,3103,None,735,None,None,None,None,10/11/2020 02:59,2020-10-11T02:59:00Z,10/10 22:59,16564,None,None,2020-10-11T02:59:00Z,16047004,None,None,846579,None,None,None,None,None,None,None,None,None,None,None,None,None,None,06,3803,0,846579,168559,846579,None,64,0,31784f62bab73d3733862712c29c2792ddb6aa0e,0,0,0,0,0,
20201012,CA,850028,None,None,None,totalTestsViral,16191341,3070,None,736,None,None,None,None,10/12/2020 02:59,2020-10-12T02:59:00Z,10/11 22:59,16572,None,None,2020-10-12T02:59:00Z,16191341,None,None,850028,None,None,None,None,None,None,None,None,None,None,None,None,None,None,06,3449,0,850028,144337,850028,None,8,0,f059b0fdd28835cbd09a1ef111ae10bdb71712e0,0,0,0,0,0,
20201013,CA,852406,None,None,None,totalTestsViral,16333717,3060,None,748,None,None,None,None,10/13/2020 02:59,2020-10-13T02:59:00Z,10/12 22:59,16581,None,None,2020-10-13T02:59:00Z,16333717,None,None,852406,None,None,None,None,None,None,None,None,None,None,None,None,None,None,06,2378,0,852406,142376,852406,None,9,0,8365f323a854374e481463f4a24361a8693aa15f,0,0,0,0,0,
20201014,CA,855072,None,None,None,totalTestsViral,16425487,3126,None,753,None,None,None,None,10/14/2020 02:59,2020-10-14T02:59:00Z,10/13 22:59,16639,None,None,2020-10-14T02:59:00Z,16425487,None,None,855072,None,None,None,None,None,None,None,None,None,None,None,None,None,None,06,2666,0,855072,91770,855072,None,58,0,b9943f2be78a728322270db2b2b9079aac3b1c2e,0,0,0,0,0,
20201015,CA,858401,None,None,None,totalTestsViral,16517812,3078,None,706,None,None,None,None,10/15/2020 02:59,2020-10-15T02:59:00Z,10/14 22:59,16757,None,None,2020-10-15T02:59:00Z,16517812,None,None,858401,None,None,None,None,None,None,None,None,None,None,None,None,None,None,06,3329,0,858401,92325,858401,None,118,0,96c95f61980774711166ab24b3afa44d7f34a866,0,0,0,0,0,
20201016,CA,861476,None,None,None,totalTestsViral,16621956,3035,None,713,None,None,None,None,10/16/2020 02:59,2020-10-16T02:59:00Z,10/15 22:59,16830,None,None,2020-10-16T02:59:00Z,16621956,None,None,861476,None,None,None,None,None,None,None,None,None,None,None,None,None,None,06,3075,0,861476,104144,861476,None,73,0,2131cd564e6696a591c77f17b02d7f512cc03160,0,0,0,0,0,
20201017,CA,864455,None,None,None,totalTestsViral,16756711,2995,None,743,None,None,None,None,10/17/2020 02:59,2020-10-17T02:59:00Z,10/16 22:59,16899,None,None,2020-10-17T02:59:00Z,16756711,None,None,864455,None,None,None,None,None,None,None,None,None,None,None,None,None,None,06,2979,0,864455,134755,864455,None,69,0,b43e2b1ea7bad6fe6924feb653fb7360251a942c,0,0,0,0,0,
20201018,CA,867317,None,None,None,totalTestsViral,16892062,3020,None,727,None,None,None,None,10/18/2020 02:59,2020-10-18T02:59:00Z,10/17 22:59,16943,None,None,2020-10-18T02:59:00Z,16892062,None,None,867317,None,None,None,None,None,None,None,None,None,None,None,None,None,None,06,2862,0,867317,135351,867317,None,44,0,8bacb128e7d6453f739d81e89f1380999aff5a63,0,0,0,0,0,
20201019,CA,870791,None,None,None,totalTestsViral,17042408,3002,None,758,None,None,None,None,10/19/2020 02:59,2020-10-19T02:59:00Z,10/18 22:59,16970,None,None,2020-10-19T02:59:00Z,17042408,None,None,870791,None,None,None,None,None,None,None,None,None,None,None,None,None,None,06,3474,0,870791,150346,870791,None,27,0,a01c74a4d29ec6a29789269a05e624f0e96af571,0,0,0,0,0,
20201020,CA,874077,None,None,None,totalTestsViral,17189070,3104,None,781,None,None,None,None,10/20/2020 02:59,2020-10-20T02:59:00Z,10/19 22:59,16992,None,None,2020-10-20T02:59:00Z,17189070,None,None,874077,None,None,None,None,None,None,None,None,None,None,None,None,None,None,06,3286,0,874077,146662,874077,None,22,0,85030fd4b38e8fc917f5bd00bf8aeecb0e4ae82e,0,0,0,0,0,
20201021,CA,877784,None,None,None,totalTestsViral,17293139,3077,None,763,None,None,None,None,10/21/2020 02:59,2020-10-21T02:59:00Z,10/20 22:59,17027,None,None,2020-10-21T02:59:00Z,17293139,None,None,877784,None,None,None,None,None,None,None,None,None,None,None,None,None,None,06,3707,0,877784,104069,877784,None,35,0,ed1adc552ec6e24dd069226abf435d42a3a34123,0,0,0,0,0,
20201022,CA,880724,None,None,None,totalTestsViral,17358770,3051,None,758,None,None,None,None,10/22/2020 02:59,2020-10-22T02:59:00Z,10/21 22:59,17189,None,None,2020-10-22T02:59:00Z,17358770,None,None,880724,None,None,None,None,None,None,None,None,None,None,None,None,None,None,06,2940,0,880724,65631,880724,None,162,0,7140310ec1d96ca25db667d0a0032b18dac77dc0,0,0,0,0,0,
20201023,CA,886865,None,None,None,totalTestsViral,17483293,3011,None,754,None,None,None,None,10/23/2020 02:59,2020-10-23T02:59:00Z,10/22 22:59,17262,None,None,2020-10-23T02:59:00Z,17483293,None,None,886865,None,None,None,None,None,None,None,None,None,None,None,None,None,None,06,6141,0,886865,124523,886865,None,73,0,3d5d49c3b089916fd4b78472b781d8af32b82a48,0,0,0,0,0,
20201024,CA,892810,None,None,None,totalTestsViral,17609179,3007,None,744,None,None,None,None,10/24/2020 02:59,2020-10-24T02:59:00Z,10/23 22:59,17311,None,None,2020-10-24T02:59:00Z,17609179,None,None,892810,None,None,None,None,None,None,None,None,None,None,None,None,None,None,06,5945,0,892810,125886,892810,None,49,0,5ed3bb7f87c2aef4d2322a16d451121fab6f277e,0,0,0,0,0,
20201025,CA,898029,None,None,None,totalTestsViral,17787885,2969,None,722,None,None,None,None,10/25/2020 02:59,2020-10-25T02:59:00Z,10/24 22:59,17345,None,None,2020-10-25T02:59:00Z,17787885,None,None,898029,None,None,None,None,None,None,None,None,None,None,None,None,None,None,06,5219,0,898029,178706,898029,None,34,0,2f01a73ccb6e4b039b48c18abbe3a8e29c9e5381,0,0,0,0,0,
20201026,CA,901010,None,None,None,totalTestsViral,17982829,2991,None,735,None,None,None,None,10/26/2020 02:59,2020-10-26T02:59:00Z,10/25 22:59,17357,None,None,2020-10-26T02:59:00Z,17982829,None,None,901010,None,None,None,None,None,None,None,None,None,None,None,None,None,None,06,2981,0,901010,194944,901010,None,12,0,6c5cd516b159226c920c0cbf57c4e3a0211ea8bf,0,0,0,0,0,
20201027,CA,904198,None,None,None,totalTestsViral,18127049,3000,None,774,None,None,None,None,10/27/2020 02:59,2020-10-27T02:59:00Z,10/26 22:59,17400,None,None,2020-10-27T02:59:00Z,18127049,None,None,904198,None,None,None,None,None,None,None,None,None,None,None,None,None,None,06,3188,0,904198,144220,904198,None,43,0,e95792268da16b77f100c8fd4ebb6b8e880ff173,0,0,0,0,0,
20201028,CA,908713,None,None,None,totalTestsViral,18223596,2998,None,770,None,None,None,None,10/28/2020 02:59,2020-10-28T02:59:00Z,10/27 22:59,17475,None,None,2020-10-28T02:59:00Z,18223596,None,None,908713,None,None,None,None,None,None,None,None,None,None,None,None,None,None,06,4515,0,908713,96547,908713,None,75,0,08c5369208a402bfa33225c86cf4deb9d39c0ff2,0,0,0,0,0,
20201029,CA,912904,None,None,None,totalTestsViral,18323771,3083,None,768,None,None,None,None,10/29/2020 02:59,2020-10-29T02:59:00Z,10/28 22:59,17541,None,None,2020-10-29T02:59:00Z,18323771,None,None,912904,None,None,None,None,None,None,None,None,None,None,None,None,None,None,06,4191,0,912904,100175,912904,None,66,0,e7d47e90028c8e5149de7c83792ef7a9c32b667f,0,0,0,0,0,
20201030,CA,916918,None,None,None,totalTestsViral,18444523,3148,None,772,None,None,None,None,10/30/2020 02:59,2020-10-30T02:59:00Z,10/29 22:59,17571,None,None,2020-10-30T02:59:00Z,18444523,None,None,916918,None,None,None,None,None,None,None,None,None,None,None,None,None,None,06,4014,0,916918,120752,916918,None,30,0,d4a916c18b1eeb1a05777c306764e2dc6851948c,0,0,0,0,0,
20201031,CA,922005,None,None,None,totalTestsViral,18602317,3212,None,771,None,None,None,None,10/31/2020 02:59,2020-10-31T02:59:00Z,10/30 22:59,17626,None,None,2020-10-31T02:59:00Z,18602317,None,None,922005,None,None,None,None,None,None,None,None,None,None,None,None,None,None,06,5087,0,922005,157794,922005,None,55,0,83d149dcc0e85bc9bba2e78ac8f9bb96b790928b,0,0,0,0,0,
20201101,CA,926534,None,None,None,totalTestsViral,18743315,3193,None,791,None,None,None,None,11/1/2020 02:59,2020-11-01T02:59:00Z,10/31 22:59,17667,None,None,2020-11-01T02:59:00Z,18743315,None,None,926534,None,None,None,None,None,None,None,None,None,None,None,None,None,None,06,4529,0,926534,140998,926534,None,41,0,8b1ef500e6c6c001402062e16005e156ed17241d,0,0,0,0,0,
20201102,CA,930628,None,None,None,totalTestsViral,18912501,3241,None,823,None,None,None,None,11/2/2020 02:59,2020-11-02T02:59:00Z,11/01 21:59,17672,None,None,2020-11-02T02:59:00Z,18912501,None,None,930628,None,None,None,None,None,None,None,None,None,None,None,None,None,None,06,4094,0,930628,169186,930628,None,5,0,47236c46a10457e485935e1222cfde276b41f9b8,0,0,0,0,0,
20201103,CA,934672,None,None,None,totalTestsViral,19074921,3270,None,840,None,None,None,None,11/3/2020 02:59,2020-11-03T02:59:00Z,11/02 21:59,17686,None,None,2020-11-03T02:59:00Z,19074921,None,None,934672,None,None,None,None,None,None,None,None,None,None,None,None,None,None,06,4044,0,934672,162420,934672,None,14,0,1e7b4402e31ec86e235ab1a61d101c78a6a4549e,0,0,0,0,0,
20201104,CA,940010,None,None,None,totalTestsViral,19181012,3410,None,901,None,None,None,None,11/4/2020 02:59,2020-11-04T02:59:00Z,11/03 21:59,17752,None,None,2020-11-04T02:59:00Z,19181012,None,None,940010,None,None,None,None,None,None,None,None,None,None,None,None,None,None,06,5338,0,940010,106091,940010,None,66,0,d856e4cae3ce53da0e85b515d903bf8fa67972bb,0,0,0,0,0,
20201105,CA,944576,None,None,None,totalTestsViral,19266363,3462,None,922,None,None,None,None,11/5/2020 02:59,2020-11-05T02:59:00Z,11/04 21:59,17815,None,None,2020-11-05T02:59:00Z,19266363,None,None,944576,None,None,None,None,None,None,None,None,None,None,None,None,None,None,06,4566,0,944576,85351,944576,None,63,0,cbd6e55bdfead0ac775f7d142d947ab1c0e70b55,0,0,0,0,0,
20201106,CA,951094,None,None,None,totalTestsViral,19396349,3489,None,923,None,None,None,None,11/6/2020 02:59,2020-11-06T02:59:00Z,11/05 21:59,17866,None,None,2020-11-06T02:59:00Z,19396349,None,None,951094,None,None,None,None,None,None,None,None,None,None,None,None,None,None,06,6518,0,951094,129986,951094,None,51,0,0a3f233e4d2a706dd4fdbfb3c1ce1d680c43e342,0,0,0,0,0,
20201107,CA,956957,None,None,None,totalTestsViral,19565151,3456,None,901,None,None,None,None,11/7/2020 02:59,2020-11-07T02:59:00Z,11/06 21:59,17939,None,None,2020-11-07T02:59:00Z,19565151,None,None,956957,None,None,None,None,None,None,None,None,None,None,None,None,None,None,06,5863,0,956957,168802,956957,None,73,0,1a67b7c5a78404acefabffdeecf832b72cc00c94,0,0,0,0,0,
20201108,CA,964639,None,None,None,totalTestsViral,19724628,3554,None,910,None,None,None,None,11/8/2020 02:59,2020-11-08T02:59:00Z,11/07 21:59,17963,None,None,2020-11-08T02:59:00Z,19724628,None,None,964639,None,None,None,None,None,None,None,None,None,None,None,None,None,None,06,7682,0,964639,159477,964639,None,24,0,830bdd3a43e22556b2a13a0d73ef5d7cc8cf949a,0,0,0,0,0,
20201109,CA,971851,None,None,None,totalTestsViral,19918479,3668,None,941,None,None,None,None,11/9/2020 02:59,2020-11-09T02:59:00Z,11/08 21:59,17977,None,None,2020-11-09T02:59:00Z,19918479,None,None,971851,None,None,None,None,None,None,None,None,None,None,None,None,None,None,06,7212,0,971851,193851,971851,None,14,0,0b652c6189832c34ebe0e0e291bfe209eee93a5f,0,0,0,0,0,
20201110,CA,977218,None,None,None,totalTestsViral,20094641,3799,None,984,None,None,None,None,11/10/2020 02:59,2020-11-10T02:59:00Z,11/09 21:59,18001,None,None,2020-11-10T02:59:00Z,20094641,None,None,977218,None,None,None,None,None,None,None,None,None,None,None,None,None,None,06,5367,0,977218,176162,977218,None,24,0,a90cc7e54c1e115da37c0fe6db64af871d4898ea,0,0,0,0,0,
20201111,CA,984682,None,None,None,totalTestsViral,20222093,3987,None,1006,None,None,None,None,11/11/2020 02:59,2020-11-11T02:59:00Z,11/10 21:59,18070,None,None,2020-11-11T02:59:00Z,20222093,None,None,984682,None,None,None,None,None,None,None,None,None,None,None,None,None,None,06,7464,0,984682,127452,984682,None,69,0,8e58a5007ab39213ab7da781621140d4df703985,0,0,0,0,0,
20201112,CA,991609,None,None,None,totalTestsViral,20342072,4002,None,1010,None,None,None,None,11/12/2020 02:59,2020-11-12T02:59:00Z,11/11 21:59,18108,None,None,2020-11-12T02:59:00Z,20342072,None,None,991609,None,None,None,None,None,None,None,None,None,None,None,None,None,None,06,6927,0,991609,119979,991609,None,38,0,e683c3cf455d4e13a560615a89e13bf48ec64650,0,0,0,0,0,
20201113,CA,998502,None,None,None,totalTestsViral,20478500,4138,None,1031,None,None,None,None,11/13/2020 02:59,2020-11-13T02:59:00Z,11/12 21:59,18137,None,None,2020-11-13T02:59:00Z,20478500,None,None,998502,None,None,None,None,None,None,None,None,None,None,None,None,None,None,06,6893,0,998502,136428,998502,None,29,0,bbfce643fbce8eb52ddd3830e2e67e58992c0b92,0,0,0,0,0,
20201114,CA,1008377,None,None,None,totalTestsViral,20671596,4212,None,1024,None,None,None,None,11/14/2020 02:59,2020-11-14T02:59:00Z,11/13 21:59,18218,None,None,2020-11-14T02:59:00Z,20671596,None,None,1008377,None,None,None,None,None,None,None,None,None,None,None,None,None,None,06,9875,0,1008377,193096,1008377,None,81,0,76b8d37cde6dd99ef9147f010d358101fa879616,0,0,0,0,0,
20201115,CA,1019345,None,None,None,totalTestsViral,20866785,4454,None,1094,None,None,None,None,11/15/2020 02:59,2020-11-15T02:59:00Z,11/14 21:59,18253,None,None,2020-11-15T02:59:00Z,20866785,None,None,1019345,None,None,None,None,None,None,None,None,None,None,None,None,None,None,06,10968,0,1019345,195189,1019345,None,35,0,ce4190b640567c0dde0d144be5d1c946b94ca508,0,0,0,0,0,
20201116,CA,1029235,None,None,None,totalTestsViral,21068894,4559,None,1131,None,None,None,None,11/16/2020 02:59,2020-11-16T02:59:00Z,11/15 21:59,18263,None,None,2020-11-16T02:59:00Z,21068894,None,None,1029235,None,None,None,None,None,None,None,None,None,None,None,None,None,None,06,9890,0,1029235,202109,1029235,None,10,0,28619328062a400133a9582fe0c7dfdb7c27e3f6,0,0,0,0,0,
20201117,CA,1037978,None,None,None,totalTestsViral,21259076,4885,None,1206,None,None,None,None,11/17/2020 02:59,2020-11-17T02:59:00Z,11/16 21:59,18299,None,None,2020-11-17T02:59:00Z,21259076,None,None,1037978,None,None,None,None,None,None,None,None,None,None,None,None,None,None,06,8743,0,1037978,190182,1037978,None,36,0,8cdd46ce053e4e00aabb299827b4c9d4a42576f7,0,0,0,0,0,
20201118,CA,1047789,None,None,None,totalTestsViral,21418543,5078,None,1258,None,None,None,None,11/18/2020 02:59,2020-11-18T02:59:00Z,11/17 21:59,18360,None,None,2020-11-18T02:59:00Z,21418543,None,None,1047789,None,None,None,None,None,None,None,None,None,None,None,None,None,None,06,9811,0,1047789,159467,1047789,None,61,0,619d506bd12d6bf393c2279ca15d59c3feaa2d6c,0,0,0,0,0,
20201119,CA,1059267,None,None,None,totalTestsViral,21552528,5319,None,1253,None,None,None,None,11/19/2020 02:59,2020-11-19T02:59:00Z,11/18 21:59,18466,None,None,2020-11-19T02:59:00Z,21552528,None,None,1059267,None,None,None,None,None,None,None,None,None,None,None,None,None,None,06,11478,0,1059267,133985,1059267,None,106,0,f860d177f62a9a86bc074d69edf0991470582372,0,0,0,0,0,
20201120,CA,1072272,None,None,None,totalTestsViral,21730551,5497,None,1332,None,None,None,None,11/20/2020 02:59,2020-11-20T02:59:00Z,11/19 21:59,18557,None,None,2020-11-20T02:59:00Z,21730551,None,None,1072272,None,None,None,None,None,None,None,None,None,None,None,None,None,None,06,13005,0,1072272,178023,1072272,None,91,0,56ae7e8efa8a36d770688b60a5f3a5479f7881d3,0,0,0,0,0,
20201121,CA,1087714,None,None,None,totalTestsViral,21971832,5745,None,1332,None,None,None,None,11/21/2020 02:59,2020-11-21T02:59:00Z,11/20 21:59,18643,None,None,2020-11-21T02:59:00Z,21971832,None,None,1087714,None,None,None,None,None,None,None,None,None,None,None,None,None,None,06,15442,0,1087714,241281,1087714,None,86,0,c7ec3f9d32fecc3a4aaa238586185dfe79b5f1fc,0,0,0,0,0,
20201122,CA,1102033,None,None,None,totalTestsViral,22237309,5918,None,1390,None,None,None,None,11/22/2020 02:59,2020-11-22T02:59:00Z,11/21 21:59,18676,None,None,2020-11-22T02:59:00Z,22237309,None,None,1102033,None,None,None,None,None,None,None,None,None,None,None,None,None,None,06,14319,0,1102033,265477,1102033,None,33,0,e3c83e03a457bbed44d1ae63d85488ecc5392759,0,0,0,0,0,
20201123,CA,1110370,None,None,None,totalTestsViral,22457544,6254,None,1455,None,None,None,None,11/23/2020 02:59,2020-11-23T02:59:00Z,11/22 21:59,18726,None,None,2020-11-23T02:59:00Z,22457544,None,None,1110370,None,None,None,None,None,None,None,None,None,None,None,None,None,None,06,8337,0,1110370,220235,1110370,None,50,0,f0660f95a1439c09e07a4bfa0c16aaa16d243f0c,0,0,0,0,0,
20201124,CA,1125699,None,None,None,totalTestsViral,22741363,6641,None,1514,None,None,None,None,11/24/2020 02:59,2020-11-24T02:59:00Z,11/23 21:59,18769,None,None,2020-11-24T02:59:00Z,22741363,None,None,1125699,None,None,None,None,None,None,None,None,None,None,None,None,None,None,06,15329,0,1125699,283819,1125699,None,43,0,c66ac95831a96caffa597e76751fe51a28122d8f,0,0,0,0,0,
20201125,CA,1144049,None,None,None,totalTestsViral,22910351,7049,None,1551,None,None,None,None,11/25/2020 02:59,2020-11-25T02:59:00Z,11/24 21:59,18875,None,None,2020-11-25T02:59:00Z,22910351,None,None,1144049,None,None,None,None,None,None,None,None,None,None,None,None,None,None,06,18350,0,1144049,168988,1144049,None,106,0,2804024b3c7245517f6fb0b33d8b073b86a25d3b,0,0,0,0,0,
20201126,CA,1158689,None,None,None,totalTestsViral,23096745,7197,None,1617,None,None,None,None,11/26/2020 02:59,2020-11-26T02:59:00Z,11/25 21:59,18979,None,None,2020-11-26T02:59:00Z,23096745,None,None,1158689,None,None,None,None,None,None,None,None,None,None,None,None,None,None,06,14640,0,1158689,186394,1158689,None,104,0,b93bac9da681439aa9073dd3d2869d582022682b,0,0,0,0,0,
20201127,CA,1171324,None,None,None,totalTestsViral,23315918,7388,None,1726,None,None,None,None,11/27/2020 02:59,2020-11-27T02:59:00Z,11/26 21:59,19033,None,None,2020-11-27T02:59:00Z,23315918,None,None,1171324,None,None,None,None,None,None,None,None,None,None,None,None,None,None,06,12635,0,1171324,219173,1171324,None,54,0,6c3a6c4635ec63135c09b6c9e61429d2d1504f8e,0,0,0,0,0,
20201128,CA,1183320,None,None,None,totalTestsViral,23573182,7684,None,1763,None,None,None,None,11/28/2020 02:59,2020-11-28T02:59:00Z,11/27 21:59,19089,None,None,2020-11-28T02:59:00Z,23573182,None,None,1183320,None,None,None,None,None,None,None,None,None,None,None,None,None,None,06,11996,0,1183320,257264,1183320,None,56,0,cd25f79eeb4f47d701babe5acd86985aa5050eb7,0,0,0,0,0,
20201129,CA,1198934,None,None,None,totalTestsViral,23807501,8198,None,1823,None,None,None,None,11/29/2020 02:59,2020-11-29T02:59:00Z,11/28 21:59,19121,None,None,2020-11-29T02:59:00Z,23807501,None,None,1198934,None,None,None,None,None,None,None,None,None,None,None,None,None,None,06,15614,0,1198934,234319,1198934,None,32,0,60aa88c94b708c3c254d2b0d5a20e6b4d5429fda,0,0,0,0,0,
20201130,CA,1212968,None,None,None,totalTestsViral,24025171,8578,None,1919,None,None,None,None,11/30/2020 02:59,2020-11-30T02:59:00Z,11/29 21:59,19141,None,None,2020-11-30T02:59:00Z,24025171,None,None,1212968,None,None,None,None,None,None,None,None,None,None,None,None,None,None,06,14034,0,1212968,217670,1212968,None,20,0,5adc5a6e83fd5a6af0c221718cf810e537aa4a07,0,0,0,0,0,
20201201,CA,1225189,None,None,None,totalTestsViral,24161313,9049,None,2000,None,None,None,None,12/1/2020 02:59,2020-12-01T02:59:00Z,11/30 21:59,19211,None,None,2020-12-01T02:59:00Z,24161313,None,None,1225189,None,None,None,None,None,None,None,None,None,None,None,None,None,None,06,12221,0,1225189,136142,1225189,None,70,0,db3a86443cff0a39c8466e7fe18b4f7f8ffa93e7,0,0,0,0,0,
