date,state,positive,probableCases,negative,pending,totalTestResultsSource,totalTestResults,hospitalizedCurrently,hospitalizedCumulative,inIcuCurrently,inIcuCumulative,onVentilatorCurrently,onVentilatorCumulative,recovered,lastUpdateEt,dateModified,checkTimeEt,death,hospitalized,hospitalizedDischarged,dateChecked,totalTestsViral,positiveTestsViral,negativeTestsViral,positiveCasesViral,deathConfirmed,deathProbable,totalTestEncountersViral,totalTestsPeopleViral,totalTestsAntibody,positiveTestsAntibody,negativeTestsAntibody,totalTestsPeopleAntibody,positiveTestsPeopleAntibody,negativeTestsPeopleAntibody,totalTestsPeopleAntigen,positiveTestsPeopleAntigen,totalTestsAntigen,positiveTestsAntigen,fips,positiveIncrease,negativeIncrease,total,totalTestResultsIncrease,posNeg,dataQualityGrade,deathIncrease,hospitalizedIncrease,hash,commercialScore,negativeRegularScore,negativeScore,positiveScore,score,grade
2020-03-02,NY,0,None,None,None,totalTestEncountersViral,0,None,None,None,None,None,None,None,None,None,None,None,None,None,None,None,None,None,None,None,None,0,None,None,None,None,None,None,None,None,None,None,None,36,0,0,0,0,0,None,0,0,b348e3592c0b30cb944b37ddbc88044ceeeadfc9,0,0,0,0,0,
2020-03-03,NY,1,None,None,None,totalTestEncountersViral,1,None,None,None,None,None,None,None,None,None,None,None,None,None,None,None,None,None,None,None,None,1,None,None,None,None,None,None,None,None,None,None,None,36,1,0,1,1,1,None,0,0,9e3daed71a696c0c3fa30150ee6423a0a94de8f5,0,0,0,0,0,
2020-03-04,NY,1,None,None,24,totalTestEncountersViral,10,None,None,None,None,None,None,None,None,None,None,None,None,None,None,None,None,None,None,0,None,10,None,None,None,None,None,None,None,None,None,None,None,36,0,0,25,9,1,None,0,0,3feb3bdb879194f81d11c8bbf994d8e3ea2a5252,0,0,0,0,0,
2020-03-05,NY,3,None,None,24,totalTestEncountersViral,30,None,None,None,None,None,None,None,None,None,None,None,None,None,None,None,None,None,None,None,None,30,None,None,None,None,None,None,None,None,None,None,None,36,2,0,27,20,3,None,0,0,04e82e80db72556a73999ead493c993e90b8969e,0,0,0,0,0,
2020-03-06,NY,25,None,None,236,totalTestEncountersViral,122,None,None,None,None,None,None,None,None,None,None,None,None,None,None,None,None,None,None,None,None,122,None,None,None,None,None,None,None,None,None,None,None,36,22,0,261,92,25,None,0,0,9e99ccc04e6d33397cc412ee1b0fbecddbaeecd8,0,0,0,0,0,
2020-03-07,NY,36,None,None,236,totalTestEncountersViral,188,None,None,None,None,None,None,None,None,None,None,None,None,None,None,None,None,None,None,None,None,188,None,None,None,None,None,None,None,None,None,None,None,36,11,0,272,66,36,None,0,0,d8b00fdd707cfcec7e7dd5f580a0fad157a1f86c,0,0,0,0,0,
2020-03-08,NY,60,None,None,None,totalTestEncountersViral,388,None,None,None,None,None,None,None,None,None,None,None,None,None,None,None,None,None,None,None,None,388,None,None,None,None,None,None,None,None,None,None,None,36,24,0,60,200,60,None,0,0,ffc2521d3a8b7d1db4c71fd3ed42e3f29e779a56,0,0,0,0,0,
2020-03-09,NY,88,None,None,None,totalTestEncountersViral,695,None,None,None,None,None,None,None,None,None,None,None,None,None,None,None,None,None,None,None,None,695,None,None,None,None,None,None,None,None,None,None,None,36,28,0,88,307,88,None,0,0,e5b9a7b61793e3dfd6e7c941a3f02d6fa754fc48,0,0,0,0,0,
2020-03-10,NY,151,None,None,None,totalTestEncountersViral,1096,None,None,None,None,None,None,None,None,None,None,None,None,None,None,None,None,None,None,None,None,1096,None,None,None,None,None,None,None,None,None,None,None,36,63,0,151,401,151,None,0,0,add30e6fc2cdd69d3ab64f94472eed1fc93b61df,0,0,0,0,0,
2020-03-11,NY,195,None,None,None,totalTestEncountersViral,1521,None,None,None,None,None,None,None,None,None,None,None,None,None,None,None,None,None,None,None,None,1521,None,None,None,None,None,None,None,None,None,None,None,36,44,0,195,425,195,None,0,0,5b970ce185791660ab76b08d73d94f8015919e9e,0,0,0,0,0,
2020-03-12,NY,251,None,None,None,totalTestEncountersViral,2074,None,None,None,None,None,None,None,3/11/2020 16:00,2020-03-11T16:00:00Z,03/11 12:00,None,None,None,2020-03-11T16:00:00Z,None,None,None,None,None,None,2074,None,None,None,None,None,None,None,None,None,None,None,36,56,0,251,553,251,None,0,0,517fee71118f73755dbb0806cf9f585904f53cc5,0,0,0,0,0,
2020-03-13,NY,353,None,None,None,totalTestEncountersViral,2836,None,None,None,None,None,None,None,3/12/2020 16:00,2020-03-12T16:00:00Z,03/12 12:00,None,None,None,2020-03-12T16:00:00Z,None,None,None,None,None,None,2836,None,None,None,None,None,None,None,None,None,None,None,36,102,0,353,762,353,None,0,0,d8d29ed7ff7b713627621192b4eea8e40111f17f,0,0,0,0,0,
2020-03-14,NY,517,None,None,None,totalTestEncountersViral,4126,None,None,None,None,None,None,None,3/14/2020 12:30,2020-03-14T12:30:00Z,03/14 08:30,None,None,None,2020-03-14T12:30:00Z,None,None,None,None,None,None,4126,None,None,None,None,None,None,None,None,None,None,None,36,164,0,517,1290,517,None,0,0,628882159f6f5e48ed57b732f4d81dd2cfe1af32,0,0,0,0,0,
2020-03-15,NY,648,None,None,None,totalTestEncountersViral,5419,None,None,None,None,None,None,None,3/15/2020 00:00,2020-03-15T00:00:00Z,03/14 20:00,3,None,None,2020-03-15T00:00:00Z,None,None,None,None,None,None,5419,None,None,None,None,None,None,None,None,None,None,None,36,131,0,648,1293,648,None,3,0,9128c63e111b8ff32af7d7ec430c608a49dc28d5,0,0,0,0,0,
2020-03-16,NY,942,None,None,None,totalTestEncountersViral,7355,None,None,None,None,None,None,None,3/16/2020 16:22,2020-03-16T16:22:00Z,03/16 12:22,7,None,None,2020-03-16T16:22:00Z,None,None,None,None,None,None,7355,None,None,None,None,None,None,None,None,None,None,None,36,294,0,942,1936,942,None,4,0,0af7dfa76482974b0831ff2d1ae224d6ff3544b4,0,0,0,0,0,
2020-03-17,NY,1374,None,None,None,totalTestEncountersViral,10262,325,None,None,None,None,None,None,3/16/2020 15:00,2020-03-16T15:00:00Z,03/16 11:00,7,None,None,2020-03-16T15:00:00Z,None,None,None,None,None,None,10262,None,None,None,None,None,None,None,None,None,None,None,36,432,0,1374,2907,1374,None,0,0,16b1718013a666cf8d5e13ac21ae5c4dbcf6af68,0,0,0,0,0,
2020-03-18,NY,2383,None,None,None,totalTestEncountersViral,14815,416,None,None,None,None,None,None,3/18/2020 15:05,2020-03-18T15:05:00Z,03/18 11:05,12,None,None,2020-03-18T15:05:00Z,None,None,None,None,None,None,14815,None,None,None,None,None,None,None,None,None,None,None,36,1009,0,2383,4553,2383,None,5,0,694d6c64876caf9b72daf7aeff012f64a258a13a,0,0,0,0,0,
2020-03-19,NY,4152,None,None,None,totalTestEncountersViral,22513,617,None,None,None,None,None,None,3/19/2020 13:20,2020-03-19T13:20:00Z,03/19 09:20,12,None,None,2020-03-19T13:20:00Z,None,None,None,None,None,None,22513,None,None,None,None,None,None,None,None,None,None,None,36,1769,0,4152,7698,4152,None,0,0,4de72ec1713c2c9953b26994dc5cb65ae17596c7,0,0,0,0,0,
2020-03-20,NY,7102,None,None,None,totalTestEncountersViral,32637,1042,None,None,None,None,None,None,3/20/2020 13:20,2020-03-20T13:20:00Z,03/20 09:20,35,None,None,2020-03-20T13:20:00Z,None,None,None,None,None,None,32637,None,None,None,None,None,None,None,None,None,None,None,36,2950,0,7102,10124,7102,None,23,0,d54cebf6b59362c56b5ef5bc8ffcded9a9d065e9,0,0,0,0,0,
2020-03-21,NY,10356,None,None,None,totalTestEncountersViral,45724,1436,1531,None,None,None,None,None,3/20/2020 21:22,2020-03-20T21:22:00Z,03/20 17:22,44,1531,None,2020-03-20T21:22:00Z,None,None,None,None,None,None,45724,None,None,None,None,None,None,None,None,None,None,None,36,3254,0,10356,13087,10356,None,9,1531,f3c52ac066588efec35d322d6e9c8a0d747e9be8,0,0,0,0,0,
2020-03-22,NY,15168,None,None,None,totalTestEncountersViral,61753,2043,2354,None,None,None,None,None,3/22/2020 11:00,2020-03-22T11:00:00Z,03/22 07:00,114,2354,None,2020-03-22T11:00:00Z,None,None,None,None,None,None,61753,None,None,None,None,None,None,None,None,None,None,None,36,4812,0,15168,16029,15168,None,70,823,fbdcd39f2f2fb7473c5cbad3b2f8534cc38565a0,0,0,0,0,0,
2020-03-23,NY,20875,None,None,None,totalTestEncountersViral,78565,2629,3125,None,None,None,None,None,3/23/2020 11:36,2020-03-23T11:36:00Z,03/23 07:36,114,3125,None,2020-03-23T11:36:00Z,None,None,None,None,None,None,78565,None,None,None,None,None,None,None,None,None,None,None,36,5707,0,20875,16812,20875,None,0,771,67f7a263090ce098f7d79423fe7052f6ad629980,0,0,0,0,0,
2020-03-24,NY,25665,None,None,None,totalTestEncountersViral,91517,3343,4041,None,None,None,None,None,3/24/2020 11:30,2020-03-24T11:30:00Z,03/24 07:30,210,4041,None,2020-03-24T11:30:00Z,None,None,None,None,None,None,91517,None,None,None,None,None,None,None,None,None,None,None,36,4790,0,25665,12952,25665,None,96,916,92a1d186dc05559c550a88bca72483f80a07fcc4,0,0,0,0,0,
2020-03-25,NY,30810,None,None,None,totalTestEncountersViral,103659,4079,5126,None,None,None,None,None,3/25/2020 11:45,2020-03-25T11:45:00Z,03/25 07:45,285,5126,None,2020-03-25T11:45:00Z,None,None,None,None,None,None,103659,None,None,None,None,None,None,None,None,None,None,None,36,5145,0,30810,12142,30810,None,75,1085,ec92ead0e39147b870b20cd1ff1794000c60c070,0,0,0,0,0,
2020-03-26,NY,37258,None,None,None,totalTestEncountersViral,122310,5327,6921,1290,None,None,None,None,3/26/2020 16:59,2020-03-26T16:59:00Z,03/26 12:59,385,6921,None,2020-03-26T16:59:00Z,None,None,None,None,None,None,122310,None,None,None,None,None,None,None,None,None,None,None,36,6448,0,37258,18651,37258,None,100,1795,74388736c1eab22b67d2286c3b4645a9448a71cf,0,0,0,0,0,
2020-03-27,NY,44637,None,None,None,totalTestEncountersViral,138625,6481,8732,1583,None,None,None,None,3/27/2020 11:15,2020-03-27T11:15:00Z,03/27 07:15,519,8732,2045,2020-03-27T11:15:00Z,None,None,None,None,None,None,138625,None,None,None,None,None,None,None,None,None,None,None,36,7379,0,44637,16315,44637,None,134,1811,edda86f7e8527a04ba0fbcb377133aba352fd2a7,0,0,0,0,0,
2020-03-28,NY,52318,None,None,None,totalTestEncountersViral,156069,7328,10454,1755,None,None,None,None,3/28/2020 13:15,2020-03-28T13:15:00Z,03/28 09:15,728,10454,2726,2020-03-28T13:15:00Z,None,None,None,None,None,None,156069,None,None,None,None,None,None,None,None,None,None,None,36,7681,0,52318,17444,52318,None,209,1722,4e698bf68b21140c89ab0c6ebead34b398fb2841,0,0,0,0,0,
2020-03-29,NY,59513,None,None,None,totalTestEncountersViral,172470,8503,12695,2037,None,None,None,None,3/29/2020 09:16,2020-03-29T09:16:00Z,03/29 05:16,965,12695,3572,2020-03-29T09:16:00Z,None,None,None,None,None,None,172470,None,None,None,None,None,None,None,None,None,None,None,36,7195,0,59513,16401,59513,None,237,2241,c39b0ae3ab971baa393ead1f068b50ef1350c0bb,0,0,0,0,0,
2020-03-30,NY,66497,None,None,None,totalTestEncountersViral,186585,9517,14578,2352,None,None,None,None,3/29/2020 09:16,2020-03-29T09:16:00Z,03/29 05:16,1218,14578,4204,2020-03-29T09:16:00Z,None,None,None,None,None,None,186585,None,None,None,None,None,None,None,None,None,None,None,36,6984,0,66497,14115,66497,None,253,1883,80ab0af762d868cc47c9f67bcfcc5f1a8d0e9551,0,0,0,0,0,
2020-03-31,NY,75795,None,None,None,totalTestEncountersViral,205233,10929,17085,2710,None,None,None,None,3/29/2020 09:16,2020-03-29T09:16:00Z,03/29 05:16,1550,17085,4975,2020-03-29T09:16:00Z,None,None,None,None,None,None,205233,None,None,None,None,None,None,None,None,None,None,None,36,9298,0,75795,18648,75795,None,332,2507,3f3afb2185399beddaf354e009c7318364baa232,0,0,0,0,0,
2020-04-01,NY,83712,None,None,None,totalTestEncountersViral,220934,12226,19929,3022,None,None,None,None,4/1/2020 12:00,2020-04-01T12:00:00Z,04/01 08:00,1941,19929,6142,2020-04-01T12:00:00Z,None,None,None,None,None,None,220934,None,None,None,None,None,None,None,None,None,None,None,36,7917,0,83712,15701,83712,None,391,2844,04bee6b5f078deeca930c4343d4cbde3c41a9996,0,0,0,0,0,
2020-04-02,NY,92381,None,None,None,totalTestEncountersViral,238965,13383,22786,3396,None,None,None,None,4/2/2020 11:45,2020-04-02T11:45:00Z,04/02 07:45,2373,22786,7434,2020-04-02T11:45:00Z,None,None,None,None,None,None,238965,None,None,None,None,None,None,None,None,None,None,None,36,8669,0,92381,18031,92381,None,432,2857,e827aa185c7eaed91f167288629730ef21bda4ce,0,0,0,0,0,
2020-04-03,NY,102863,None,None,None,totalTestEncountersViral,260520,14810,26210,3731,None,None,None,None,4/3/2020 11:00,2020-04-03T11:00:00Z,04/03 07:00,2935,26210,8886,2020-04-03T11:00:00Z,None,None,None,None,None,None,260520,None,None,None,None,None,None,None,None,None,None,None,36,10482,0,102863,21555,102863,None,562,3424,44f2d7468aa417e4cb1bf768ad1bc0ad53f5791e,0,0,0,0,0,
2020-04-04,NY,113704,None,None,None,totalTestEncountersViral,283621,15905,29471,4126,None,None,None,None,4/3/2020 11:00,2020-04-03T11:00:00Z,04/03 07:00,3565,29471,10478,2020-04-03T11:00:00Z,None,None,None,None,None,None,283621,None,None,None,None,None,None,None,None,None,None,None,36,10841,0,113704,23101,113704,None,630,3261,5089141b8c38994b9f0c6ada42b771cd51bc3ed3,0,0,0,0,0,
2020-04-05,NY,122031,None,None,None,totalTestEncountersViral,302280,16479,32293,4376,None,None,None,None,4/4/2020 00:00,2020-04-04T00:00:00Z,04/03 20:00,4159,32293,12187,2020-04-04T00:00:00Z,None,None,None,None,None,None,302280,None,None,None,None,None,None,None,None,None,None,None,36,8327,0,122031,18659,122031,None,594,2822,41073546a1668714fd742af4cc4f0d60e0e87d71,0,0,0,0,0,
2020-04-06,NY,130689,None,None,None,totalTestEncountersViral,320811,16837,34377,4504,None,None,None,None,4/6/2020 00:00,2020-04-06T00:00:00Z,04/05 20:00,4758,34377,13366,2020-04-06T00:00:00Z,None,None,None,None,None,None,320811,None,None,None,None,None,None,None,None,None,None,None,36,8658,0,130689,18531,130689,None,599,2084,b8a6f0637bafdec5b1e48a047dda04feb6a03f5e,0,0,0,0,0,
2020-04-07,NY,138863,None,None,None,totalTestEncountersViral,340058,17493,36932,4539,None,None,None,None,4/6/2020 00:00,2020-04-06T00:00:00Z,04/05 20:00,5489,36932,14590,2020-04-06T00:00:00Z,None,None,None,None,None,None,340058,None,None,None,None,None,None,None,None,None,None,None,36,8174,0,138863,19247,138863,None,731,2555,821edb6b878f47a3a667584818b7488e104624da,0,0,0,0,0,
2020-04-08,NY,149316,None,None,None,totalTestEncountersViral,365153,18079,39982,4841,None,None,None,None,4/7/2020 00:00,2020-04-07T00:00:00Z,04/06 20:00,6268,39982,16353,2020-04-07T00:00:00Z,None,None,None,None,None,None,365153,None,None,None,None,None,None,None,None,None,None,None,36,10453,0,149316,25095,149316,None,779,3050,8a7432860713ca91454aa7592215105deff5cc08,0,0,0,0,0,
2020-04-09,NY,159937,None,None,None,totalTestEncountersViral,391549,18279,42852,4925,None,None,None,None,4/9/2020 00:00,2020-04-09T00:00:00Z,04/08 20:00,7067,42852,18297,2020-04-09T00:00:00Z,None,None,None,None,None,None,391549,None,None,None,None,None,None,None,None,None,None,None,36,10621,0,159937,26396,159937,None,799,2870,9c10d1f51b392bb88dd3553501c2dc9c4299e5d4,0,0,0,0,0,
2020-04-10,NY,170512,None,None,None,totalTestEncountersViral,417885,18569,45768,4908,None,None,None,None,4/10/2020 00:00,2020-04-10T00:00:00Z,04/09 20:00,7844,45768,20249,2020-04-10T00:00:00Z,None,None,None,None,None,None,417885,None,None,None,None,None,None,None,None,None,None,None,36,10575,0,170512,26336,170512,None,777,2916,31d1d51107cdc98b1c2f507cad868c86c803739a,0,0,0,0,0,
2020-04-11,NY,180458,None,None,None,totalTestEncountersViral,440980,18654,48297,5009,None,None,None,None,4/11/2020 00:00,2020-04-11T00:00:00Z,04/10 20:00,8627,48297,22025,2020-04-11T00:00:00Z,None,None,None,None,None,None,440980,None,None,None,None,None,None,None,None,None,None,None,36,9946,0,180458,23095,180458,None,783,2529,88541d07c2d749ca717a4f8f13d4e4b7d46eb368,0,0,0,0,0,
2020-04-12,NY,188694,None,None,None,totalTestEncountersViral,461601,18707,50919,5198,None,None,None,None,4/12/2020 00:00,2020-04-12T00:00:00Z,04/11 20:00,9385,50919,23887,2020-04-12T00:00:00Z,None,None,None,None,None,None,461601,None,None,None,None,None,None,None,None,None,None,None,36,8236,0,188694,20621,188694,None,758,2622,53991f7e9408565e2c9b00e5f7e5312098b8a18f,0,0,0,0,0,
2020-04-13,NY,195031,None,None,None,totalTestEncountersViral,478357,18825,52936,5156,None,None,None,None,4/13/2020 00:00,2020-04-13T00:00:00Z,04/12 20:00,10056,52936,23887,2020-04-13T00:00:00Z,None,None,None,None,None,None,478357,None,None,None,None,None,None,None,None,None,None,None,36,6337,0,195031,16756,195031,None,671,2017,df06631a5f291f903d7f12714ddefdf239ca2972,0,0,0,0,0,
2020-04-14,NY,202208,None,None,None,totalTestEncountersViral,499143,18697,54653,5225,None,None,None,None,4/14/2020 00:00,2020-04-14T00:00:00Z,04/13 20:00,10834,54653,25589,2020-04-14T00:00:00Z,None,None,None,None,None,None,499143,None,None,None,None,None,None,None,None,None,None,None,36,7177,0,202208,20786,202208,None,778,1717,c9bfee3a4fcec35130aa589b79dcb3aeaeff0e25,0,0,0,0,0,
2020-04-15,NY,213779,None,None,None,totalTestEncountersViral,526012,18335,56968,5205,None,None,None,None,4/15/2020 00:00,2020-04-15T00:00:00Z,04/14 20:00,11586,56968,28004,2020-04-15T00:00:00Z,None,None,None,None,None,None,526012,None,None,None,None,None,None,None,None,None,None,None,36,11571,0,213779,26869,213779,None,752,2315,f7a61ecad4efb446e83554bea0c8a15d0ab48e71,0,0,0,0,0,
2020-04-16,NY,222284,None,None,None,totalTestEncountersViral,550579,17735,59052,5071,None,None,None,None,4/16/2020 00:00,2020-04-16T00:00:00Z,04/15 20:00,12192,59052,30800,2020-04-16T00:00:00Z,None,None,None,None,None,None,550579,None,None,None,None,None,None,None,None,None,None,None,36,8505,0,222284,24567,222284,None,606,2084,284611b95abad43e88fb67f205bd66941a39cb45,0,0,0,0,0,
2020-04-17,NY,229642,None,None,None,totalTestEncountersViral,573223,17316,61120,5039,None,None,None,None,4/17/2020 14:00,2020-04-17T14:00:00Z,04/17 10:00,12822,61120,33392,2020-04-17T14:00:00Z,None,None,None,None,None,None,573223,None,None,None,None,None,None,None,None,None,None,None,36,7358,0,229642,22644,229642,None,630,2068,6d86b1f70de42421f21d2bec2de094f681f35e40,0,0,0,0,0,
2020-04-18,NY,236732,None,None,None,totalTestEncountersViral,596532,16967,63103,4996,None,None,None,None,4/18/2020 00:00,2020-04-18T00:00:00Z,04/17 20:00,13362,63103,35458,2020-04-18T00:00:00Z,None,None,None,None,None,None,596532,None,None,None,None,None,None,None,None,None,None,None,36,7090,0,236732,23309,236732,None,540,1983,5f6c4861b9280f2fdd4982bd6f9d427a5588690c,0,0,0,0,0,
2020-04-19,NY,242786,None,None,None,totalTestEncountersViral,617555,16213,64550,4878,None,None,None,None,4/19/2020 00:00,2020-04-19T00:00:00Z,04/18 20:00,13869,64550,37596,2020-04-19T00:00:00Z,None,None,None,None,None,None,617555,None,None,None,None,None,None,None,None,None,None,None,36,6054,0,242786,21023,242786,None,507,1447,c38729f89f7d05e6ac67e04b81a0394b9a859b9a,0,0,0,0,0,
2020-04-20,NY,247512,None,None,None,totalTestEncountersViral,633861,16103,65969,4814,None,None,None,None,4/20/2020 00:00,2020-04-20T00:00:00Z,04/19 20:00,14347,65969,39085,2020-04-20T00:00:00Z,None,None,None,None,None,None,633861,None,None,None,None,None,None,None,None,None,None,None,36,4726,0,247512,16306,247512,None,478,1419,a5bef3a673c4e9ad266b51af78ceeee1e0b6c2c2,0,0,0,0,0,
2020-04-21,NY,251690,None,None,None,totalTestEncountersViral,649325,16135,67271,4729,None,None,None,None,4/21/2020 00:00,2020-04-21T00:00:00Z,04/20 20:00,14828,67271,40482,2020-04-21T00:00:00Z,None,None,None,None,None,None,649325,None,None,None,None,None,None,None,None,None,None,None,36,4178,0,251690,15464,251690,None,481,1302,ae52d1b42aa3e734f714d1ab9ba0d5b4b23395bb,0,0,0,0,0,
2020-04-22,NY,257216,None,None,None,totalTestEncountersViral,669982,15599,68773,4690,None,None,None,None,4/22/2020 00:00,2020-04-22T00:00:00Z,04/21 20:00,15302,68773,42308,2020-04-22T00:00:00Z,None,None,None,None,None,None,669982,None,None,None,None,None,None,None,None,None,None,None,36,5526,0,257216,20657,257216,None,474,1502,975e6106a8a24d64fed747358e68f486052d4ca4,0,0,0,0,0,
2020-04-23,NY,263460,None,None,None,totalTestEncountersViral,695920,15021,70182,4597,None,None,None,None,4/23/2020 00:00,2020-04-23T00:00:00Z,04/22 20:00,15740,70182,44244,2020-04-23T00:00:00Z,None,None,None,None,None,None,695920,None,None,None,None,None,None,None,None,None,None,None,36,6244,0,263460,25938,263460,None,438,1409,6e7153f32dda81314e817492ddf05b958b4e7807,0,0,0,0,0,
2020-04-24,NY,271590,None,None,None,totalTestEncountersViral,730656,14258,71373,4540,None,None,None,None,4/24/2020 00:00,2020-04-24T00:00:00Z,04/23 20:00,16162,71373,46156,2020-04-24T00:00:00Z,None,None,None,None,None,None,730656,None,None,None,None,None,None,None,None,None,None,None,36,8130,0,271590,34736,271590,None,422,1191,25b2561f95d75f9165ddd65ff5cadb655a4f4498,0,0,0,0,0,
2020-04-25,NY,282143,None,None,None,totalTestEncountersViral,777568,13524,72444,4410,None,None,None,None,4/25/2020 00:00,2020-04-25T00:00:00Z,04/24 20:00,16599,72444,47935,2020-04-25T00:00:00Z,None,None,None,None,None,None,777568,None,None,None,None,None,None,None,None,None,None,None,36,10553,0,282143,46912,282143,None,437,1071,dc667665d2fd5d28f607bba667a755f20049c828,0,0,0,0,0,
2020-04-26,NY,288045,None,None,None,totalTestEncountersViral,805350,12839,73540,4284,None,None,None,None,4/26/2020 00:00,2020-04-26T00:00:00Z,04/25 20:00,16966,73540,49687,2020-04-26T00:00:00Z,None,None,None,None,None,None,805350,None,None,None,None,None,None,None,None,None,None,None,36,5902,0,288045,27782,288045,None,367,1096,b8b2e5f5b19866fab9380a4157d232d1c7a34f6d,0,0,0,0,0,
2020-04-27,NY,291996,None,None,None,totalTestEncountersViral,826095,12819,74602,4157,None,None,None,None,4/27/2020 00:00,2020-04-27T00:00:00Z,04/26 20:00,17303,74602,50751,2020-04-27T00:00:00Z,None,None,None,None,None,None,826095,None,None,None,None,None,None,None,None,None,None,None,36,3951,0,291996,20745,291996,None,337,1062,dc990569b719e8eca5e193e975442af4f21954f4,0,0,0,0,0,
2020-04-28,NY,295106,None,None,None,totalTestEncountersViral,844994,12646,75362,4071,None,None,None,None,4/28/2020 00:00,2020-04-28T00:00:00Z,04/27 20:00,17638,75362,51673,2020-04-28T00:00:00Z,None,None,None,None,None,None,844994,None,None,None,None,None,None,None,None,None,None,None,36,3110,0,295106,18899,295106,None,335,760,393a0852730a2b4053a96fb85aa042eec001c8f1,0,0,0,0,0,
2020-04-29,NY,299691,None,None,None,totalTestEncountersViral,872481,12159,76450,3923,None,None,None,None,4/29/2020 00:00,2020-04-29T00:00:00Z,04/28 20:00,18015,76450,53238,2020-04-29T00:00:00Z,None,None,None,None,None,None,872481,None,None,None,None,None,None,None,None,None,None,None,36,4585,0,299691,27487,299691,None,377,1088,ae2172f3d414018c742acb2b2d71d082eba284c2,0,0,0,0,0,
2020-04-30,NY,304372,None,None,None,totalTestEncountersViral,900636,11598,77400,3769,None,None,None,None,4/30/2020 00:00,2020-04-30T00:00:00Z,04/29 20:00,18321,77400,54771,2020-04-30T00:00:00Z,None,None,None,None,None,None,900636,None,None,None,None,None,None,None,None,None,None,None,36,4681,0,304372,28155,304372,None,306,950,1db78dd60fdaf097e5968d28bb532348a85f3633,0,0,0,0,0,
2020-05-01,NY,308314,None,None,None,totalTestEncountersViral,927438,10993,78224,3640,None,None,None,None,5/1/2020 00:00,2020-05-01T00:00:00Z,04/30 20:00,18610,78224,56187,2020-05-01T00:00:00Z,None,None,None,None,None,None,927438,None,None,None,None,None,None,None,None,None,None,None,36,3942,0,308314,26802,308314,None,289,824,d73dd2ca833a1bb46f0afa6d8d8f15b530d6cf9b,0,0,0,0,0,
2020-05-02,NY,312977,None,None,None,totalTestEncountersViral,959017,10350,78942,3501,None,None,None,None,5/2/2020 00:00,2020-05-02T00:00:00Z,05/01 20:00,18909,78942,57540,2020-05-02T00:00:00Z,None,None,None,None,None,None,959017,None,None,None,None,None,None,None,None,None,None,None,36,4663,0,312977,31579,312977,None,299,718,31c26f88e5632c6239c2fbbb6bae76162153045a,0,0,0,0,0,
2020-05-03,NY,316415,None,None,None,totalTestEncountersViral,985911,9786,79768,3430,None,None,None,None,5/3/2020 00:00,2020-05-03T00:00:00Z,05/02 20:00,19189,79768,58950,2020-05-03T00:00:00Z,None,None,None,None,None,None,985911,None,None,None,None,None,None,None,None,None,None,None,36,3438,0,316415,26894,316415,None,280,826,5f6a0f817e888471e5906902af37fb4878959533,0,0,0,0,0,
2020-05-04,NY,318953,None,None,None,totalTestEncountersViral,1007310,9647,80376,3330,None,None,None,None,5/4/2020 00:00,2020-05-04T00:00:00Z,05/03 20:00,19415,80376,58950,2020-05-04T00:00:00Z,None,None,None,None,None,None,1007310,None,None,None,None,None,None,None,None,None,None,None,36,2538,0,318953,21399,318953,None,226,608,cee45dd8e36cc5a358d62e7ecdf2aaa64a014d5d,0,0,0,0,0,
2020-05-05,NY,321192,None,None,None,totalTestEncountersViral,1028899,9600,80918,3281,None,None,None,None,5/5/2020 00:00,2020-05-05T00:00:00Z,05/04 20:00,19645,80918,58950,2020-05-05T00:00:00Z,None,None,None,None,None,None,1028899,None,None,None,None,None,None,None,None,None,None,None,36,2239,0,321192,21589,321192,None,230,542,fb9415543df64b101752ed85a79e5572dc4a15cd,0,0,0,0,0,
2020-05-06,NY,323978,None,None,None,totalTestEncountersViral,1055921,9179,81570,3098,None,None,None,None,5/6/2020 00:00,2020-05-06T00:00:00Z,05/05 20:00,19877,81570,54597,2020-05-06T00:00:00Z,None,None,None,None,None,None,1055921,None,None,None,None,None,None,None,None,None,None,None,36,2786,0,323978,27022,323978,None,232,652,2c44c0e832b42497d7555f2a90195ebe9fdddb62,0,0,0,0,0,
2020-05-07,NY,327469,None,None,None,totalTestEncountersViral,1089916,8665,82197,2976,None,2425,None,None,5/7/2020 00:00,2020-05-07T00:00:00Z,05/06 20:00,20828,82197,55547,2020-05-07T00:00:00Z,None,None,None,None,None,None,1089916,None,None,None,None,None,None,None,None,None,None,None,36,3491,0,327469,33995,327469,None,951,627,4283dde4723e8db52d8eb85459f76d0a9e48dfdc,0,0,0,0,0,
2020-05-08,NY,330407,None,None,None,totalTestEncountersViral,1121543,8196,82730,2811,None,2295,None,None,5/8/2020 00:00,2020-05-08T00:00:00Z,05/07 20:00,21045,82730,56378,2020-05-08T00:00:00Z,None,None,None,None,None,None,1121543,None,None,None,None,None,None,None,None,None,None,None,36,2938,0,330407,31627,330407,None,217,533,2271340fc4c3c3a2a1946e159caaba87718fc4a4,0,0,0,0,0,
2020-05-09,NY,333122,None,None,None,totalTestEncountersViral,1153768,7776,83285,2664,None,2203,None,None,5/9/2020 00:00,2020-05-09T00:00:00Z,05/08 20:00,21271,83285,57180,2020-05-09T00:00:00Z,None,None,None,None,None,None,1153768,None,None,None,None,None,None,None,None,None,None,None,36,2715,0,333122,32225,333122,None,226,555,7b0d78d7a20a66659e65729995802f1e6d2bc907,0,0,0,0,0,
2020-05-10,NY,335395,None,None,None,totalTestEncountersViral,1182998,7262,83761,2488,None,2073,None,None,5/10/2020 00:00,2020-05-10T00:00:00Z,05/09 20:00,21478,83761,58006,2020-05-10T00:00:00Z,None,None,None,None,None,None,1182998,None,None,None,None,None,None,None,None,None,None,None,36,2273,0,335395,29230,335395,None,207,476,95fb9d6983b4ff46cccac61b07cfc41cab710e9d,0,0,0,0,0,
2020-05-11,NY,337055,None,None,None,totalTestEncountersViral,1204650,7226,84194,2450,None,2020,None,None,5/10/2020 00:00,2020-05-10T00:00:00Z,05/09 20:00,21640,84194,58363,2020-05-10T00:00:00Z,None,None,None,None,None,None,1204650,None,None,None,None,None,None,None,None,None,None,None,36,1660,0,337055,21652,337055,None,162,433,30decd303b42c478156d44dabee6ccf70119a43d,0,0,0,0,0,
2020-05-12,NY,338485,None,None,None,totalTestEncountersViral,1225113,7063,84489,2375,None,1964,None,None,5/12/2020 00:00,2020-05-12T00:00:00Z,05/11 20:00,21845,84489,58679,2020-05-12T00:00:00Z,None,None,None,None,None,None,1225113,None,None,None,None,None,None,None,None,None,None,None,36,1430,0,338485,20463,338485,None,205,295,297810eda44f7fc1990059400e691a19a4719881,0,0,0,0,0,
2020-05-13,NY,340661,None,None,None,totalTestEncountersViral,1258907,6946,85008,2308,None,1908,None,None,5/13/2020 00:00,2020-05-13T00:00:00Z,05/12 20:00,22013,85008,59193,2020-05-13T00:00:00Z,None,None,None,None,None,None,1258907,None,None,None,None,None,None,None,None,None,None,None,36,2176,0,340661,33794,340661,None,168,519,77ac67574ef80b102b9b3af0c5afd63651e0d053,0,0,0,0,0,
2020-05-14,NY,343051,None,None,None,totalTestEncountersViral,1298757,6706,85454,2223,None,1846,None,None,5/14/2020 00:00,2020-05-14T00:00:00Z,05/13 20:00,22170,85454,59758,2020-05-14T00:00:00Z,None,None,None,None,None,None,1298757,None,None,None,None,None,None,None,None,None,None,None,36,2390,0,343051,39850,343051,None,157,446,8209a04499f83268f28a2998e79a9a6be75d7448,0,0,0,0,0,
2020-05-15,NY,345813,None,None,None,totalTestEncountersViral,1338048,6394,85782,2156,None,1774,None,None,5/14/2020 00:00,2020-05-14T00:00:00Z,05/13 20:00,22304,85782,60302,2020-05-14T00:00:00Z,None,None,None,None,None,None,1338048,None,None,None,None,None,None,None,None,None,None,None,36,2762,0,345813,39291,345813,None,134,328,a0f2a1f3ada300c3330b814b47948ea9eff30a3b,0,0,0,0,0,
2020-05-16,NY,348232,None,None,None,totalTestEncountersViral,1378717,6220,86207,2077,None,1674,None,None,5/16/2020 00:00,2020-05-16T00:00:00Z,05/15 20:00,22478,86207,60796,2020-05-16T00:00:00Z,None,None,None,None,None,None,1378717,None,None,None,None,None,None,None,None,None,None,None,36,2419,0,348232,40669,348232,None,174,425,511c668856f2e031fa801ad7b61e56bb2aa903e5,0,0,0,0,0,
2020-05-17,NY,350121,None,None,None,totalTestEncountersViral,1413396,5897,86575,1981,None,1601,None,None,5/17/2020 00:00,2020-05-17T00:00:00Z,05/16 20:00,22619,86575,61381,2020-05-17T00:00:00Z,None,None,None,None,None,None,1413396,None,None,None,None,None,None,None,None,None,None,None,36,1889,0,350121,34679,350121,None,141,368,8a906daa1a01e140e5f0e9b5994e3034b03bac1b,0,0,0,0,0,
2020-05-18,NY,351371,None,None,None,totalTestEncountersViral,1439557,5840,86901,1908,None,1538,None,None,5/18/2020 00:00,2020-05-18T00:00:00Z,05/17 20:00,22729,86901,61681,2020-05-18T00:00:00Z,None,None,None,None,None,None,1439557,None,None,None,None,None,None,None,None,None,None,None,36,1250,0,351371,26161,351371,None,110,326,338d00b941efe7dfb8fe7f38f82dc2412965a43e,0,0,0,0,0,
2020-05-19,NY,352845,None,None,None,totalTestEncountersViral,1467739,5818,87169,1836,None,1481,None,None,5/19/2020 00:00,2020-05-19T00:00:00Z,05/18 20:00,22843,87169,61886,2020-05-19T00:00:00Z,None,None,None,None,None,None,1467739,None,None,None,None,None,None,None,None,None,None,None,36,1474,0,352845,28182,352845,None,114,268,721df5d940dd2a4ab0c3a5a38813cf14228c21a2,0,0,0,0,0,
2020-05-20,NY,354370,None,None,None,totalTestEncountersViral,1505836,5570,87459,1761,None,1421,None,None,5/20/2020 00:00,2020-05-20T00:00:00Z,05/19 20:00,22976,87459,61886,2020-05-20T00:00:00Z,None,None,None,None,None,None,1505836,None,None,None,None,None,None,None,None,None,None,None,36,1525,0,354370,38097,354370,None,133,290,913843d0cab7dad76b0f9d66fba3a939f6928a08,0,0,0,0,0,
2020-05-21,NY,356458,None,None,None,totalTestEncountersViral,1555055,5187,87638,1695,None,1345,None,None,5/21/2020 00:00,2020-05-21T00:00:00Z,05/20 20:00,23083,87638,62826,2020-05-21T00:00:00Z,None,None,None,None,None,None,1555055,None,None,None,None,None,None,None,None,None,None,None,36,2088,0,356458,49219,356458,None,107,179,3432076cd328f96f6d868493f7ec44d7adde4f39,0,0,0,0,0,
2020-05-22,NY,358154,None,None,None,totalTestEncountersViral,1600793,4844,87843,1581,None,1254,None,None,5/22/2020 00:00,2020-05-22T00:00:00Z,05/21 20:00,23195,87843,63292,2020-05-22T00:00:00Z,None,None,None,None,None,None,1600793,None,None,None,None,None,None,None,None,None,None,None,36,1696,0,358154,45738,358154,None,112,205,dc718509e697002eab2dd844af6e27243dde8851,0,0,0,0,0,
2020-05-23,NY,359926,None,None,None,totalTestEncountersViral,1652061,4642,88083,1502,None,1254,None,None,5/22/2020 00:00,2020-05-22T00:00:00Z,05/21 20:00,23282,88083,63292,2020-05-22T00:00:00Z,None,None,None,None,None,None,1652061,None,None,None,None,None,None,None,None,None,None,None,36,1772,0,359926,51268,359926,None,87,240,64ace39082692129573affdffa24aabbd65a0424,0,0,0,0,0,
2020-05-24,NY,361515,None,None,None,totalTestEncountersViral,1699826,4393,88324,1406,None,1067,None,None,5/24/2020 00:00,2020-05-24T00:00:00Z,05/23 20:00,23391,88324,64080,2020-05-24T00:00:00Z,None,None,None,None,None,None,1699826,None,None,None,None,None,None,None,None,None,None,None,36,1589,0,361515,47765,361515,None,109,241,23ec48f0c31d2d4cda6a1d24839aae5952431a2b,0,0,0,0,0,
2020-05-25,NY,362764,None,None,None,totalTestEncountersViral,1739449,4348,88554,1366,None,1058,None,None,5/25/2020 00:00,2020-05-25T00:00:00Z,05/24 20:00,23488,88554,64280,2020-05-25T00:00:00Z,None,None,None,None,None,None,1739449,None,None,None,None,None,None,None,None,None,None,None,36,1249,0,362764,39623,362764,None,97,230,a0c22ef2105a9294b4d145dd9e1b926fd1c734c0,0,0,0,0,0,
2020-05-26,NY,363836,None,None,None,totalTestEncountersViral,1774128,4265,88686,1273,None,1002,None,None,5/26/2020 00:00,2020-05-26T00:00:00Z,05/25 20:00,23564,88686,64443,2020-05-26T00:00:00Z,None,None,None,None,None,None,1774128,None,None,None,None,None,None,None,None,None,None,None,36,1072,0,363836,34679,363836,None,76,132,0ab5994b5769707b40f5aae446e6a071abd92a61,0,0,0,0,0,
2020-05-27,NY,364965,None,None,None,totalTestEncountersViral,1811544,4208,88866,1261,None,988,None,None,5/27/2020 00:00,2020-05-27T00:00:00Z,05/26 20:00,23643,88866,64632,2020-05-27T00:00:00Z,None,None,None,None,None,None,1811544,None,None,None,None,None,None,None,None,None,None,None,36,1129,0,364965,37416,364965,None,79,180,0034f9e416fc944b8ba0398d21589038bd87767d,0,0,0,0,0,
2020-05-28,NY,366733,None,None,None,totalTestEncountersViral,1876789,4010,89042,1219,None,931,None,None,5/28/2020 00:00,2020-05-28T00:00:00Z,05/27 20:00,23722,89042,64954,2020-05-28T00:00:00Z,None,None,None,None,None,None,1876789,None,None,None,None,None,None,None,None,None,None,None,36,1768,0,366733,65245,366733,None,79,176,0b0c320697324e141da0f4835af06d0393d4f670,0,0,0,0,0,
2020-05-29,NY,368284,None,None,None,totalTestEncountersViral,1944130,3781,89194,1164,None,889,None,None,5/29/2020 00:00,2020-05-29T00:00:00Z,05/28 20:00,23780,89194,65289,2020-05-29T00:00:00Z,None,None,None,None,None,None,1944130,None,None,None,None,None,None,None,None,None,None,None,36,1551,0,368284,67341,368284,None,58,152,d2c1b5cfd0c1f555aab2799988345d856c4334aa,0,0,0,0,0,
2020-05-30,NY,369660,None,None,None,totalTestEncountersViral,2005381,3619,89400,1124,None,857,None,None,5/30/2020 00:00,2020-05-30T00:00:00Z,05/29 20:00,23848,89400,65609,2020-05-30T00:00:00Z,None,None,None,None,None,None,2005381,None,None,None,None,None,None,None,None,None,None,None,36,1376,0,369660,61251,369660,None,68,206,d30a0bffcac2db219eeb36eaf43aa618b3f64842,0,0,0,0,0,
2020-05-31,NY,370770,None,None,None,totalTestEncountersViral,2063825,3436,89590,1050,None,791,None,None,5/31/2020 00:00,2020-05-31T00:00:00Z,05/30 20:00,23905,89590,65934,2020-05-31T00:00:00Z,None,None,None,None,None,None,2063825,None,None,None,None,None,None,None,None,None,None,None,36,1110,0,370770,58444,370770,None,57,190,3df0dcb74f2c12f2eea25115f20f4dbd3b828bd0,0,0,0,0,0,
2020-06-01,NY,371711,None,None,None,totalTestEncountersViral,2113777,3331,89703,999,None,746,None,None,6/1/2020 00:00,2020-06-01T00:00:00Z,05/31 20:00,23959,89703,66110,2020-06-01T00:00:00Z,None,None,None,None,None,None,2113777,None,None,None,None,None,None,None,None,None,None,None,36,941,0,371711,49952,371711,None,54,113,7895d09db1e6c17cc70b9bbefdd72479c8f81c5c,0,0,0,0,0,
2020-06-02,NY,373040,None,None,None,totalTestEncountersViral,2167831,3121,89861,907,None,673,None,None,6/2/2020 00:00,2020-06-02T00:00:00Z,06/01 20:00,24023,89861,66262,2020-06-02T00:00:00Z,None,None,None,None,None,None,2167831,None,None,None,None,None,None,None,None,None,None,None,36,1329,0,373040,54054,373040,None,64,158,36f9a64301e6b0fead8fdd400b21a71b4572b944,0,0,0,0,0,
2020-06-03,NY,374085,None,None,None,totalTestEncountersViral,2229473,2978,89995,865,None,638,None,None,6/3/2020 00:00,2020-06-03T00:00:00Z,06/02 20:00,24079,89995,66502,2020-06-03T00:00:00Z,None,None,None,None,None,None,2229473,None,None,None,None,None,None,None,None,None,None,None,36,1045,0,374085,61642,374085,None,56,134,b00f60fc72fddc0f7eb8c070ec39310739701e4e,0,0,0,0,0,
2020-06-04,NY,375133,None,None,None,totalTestEncountersViral,2293032,2849,89995,832,None,613,None,None,6/4/2020 00:00,2020-06-04T00:00:00Z,06/03 20:00,24133,89995,66756,2020-06-04T00:00:00Z,None,None,None,None,None,None,2293032,None,None,None,None,None,None,None,None,None,None,None,36,1048,0,375133,63559,375133,None,54,0,04bfbf70a52244c4d352a1c14a7d125f7652f4f1,0,0,0,0,0,
2020-06-05,NY,376208,None,None,None,totalTestEncountersViral,2359512,2728,89995,758,None,583,None,None,6/5/2020 00:00,2020-06-05T00:00:00Z,06/04 20:00,24175,89995,66992,2020-06-05T00:00:00Z,None,None,None,None,None,None,2359512,None,None,None,None,None,None,None,None,None,None,None,36,1075,0,376208,66480,376208,None,42,0,71a69da47ef5488f0b332ab6796468d3d7866e0f,0,0,0,0,0,
2020-06-06,NY,377316,None,None,None,totalTestEncountersViral,2437407,2603,89995,720,None,554,None,None,6/6/2020 00:00,2020-06-06T00:00:00Z,06/05 20:00,24212,89995,67261,2020-06-06T00:00:00Z,None,None,None,None,None,None,2437407,None,None,None,None,None,None,None,None,None,None,None,36,1108,0,377316,77895,377316,None,37,0,1ef5653ebb00c3a470a46fae603c639939de49dd,0,0,0,0,0,
2020-06-07,NY,378097,None,None,None,totalTestEncountersViral,2497842,2427,89995,704,None,534,None,None,6/7/2020 00:00,2020-06-07T00:00:00Z,06/06 20:00,24259,89995,67544,2020-06-07T00:00:00Z,None,None,None,None,None,None,2497842,None,None,None,None,None,None,None,None,None,None,None,36,781,0,378097,60435,378097,None,47,0,bafdfb3bb52200eda89032cc42f4130b3f00e26a,0,0,0,0,0,
2020-06-08,NY,378799,None,None,None,totalTestEncountersViral,2555896,2371,89995,678,None,507,None,None,6/8/2020 00:00,2020-06-08T00:00:00Z,06/07 20:00,24299,89995,67687,2020-06-08T00:00:00Z,None,None,None,None,None,None,2555896,None,None,None,None,None,None,None,None,None,None,None,36,702,0,378799,58054,378799,None,40,0,0cf3b6e03e1423f067f8c478c31d04d4b2d2d3e8,0,0,0,0,0,
2020-06-09,NY,379482,None,None,None,totalTestEncountersViral,2605869,2344,89995,663,None,485,None,None,6/9/2020 00:00,2020-06-09T00:00:00Z,06/08 20:00,24348,89995,67808,2020-06-09T00:00:00Z,None,None,None,None,None,None,2605869,None,None,None,None,None,None,None,None,None,None,None,36,683,0,379482,49973,379482,None,49,0,bbd81e8ac38877f89f74664909539448fbd3f5b2,0,0,0,0,0,
2020-06-10,NY,380156,None,None,None,totalTestEncountersViral,2668166,2190,89995,630,None,462,None,None,6/10/2020 00:00,2020-06-10T00:00:00Z,06/09 20:00,24404,89995,68019,2020-06-10T00:00:00Z,None,None,None,None,None,None,2668166,None,None,None,None,None,None,None,None,None,None,None,36,674,0,380156,62297,380156,None,56,0,db538afb48f4f19b55ef506a870f1bd6d75c9a74,0,0,0,0,0,
2020-06-11,NY,380892,None,None,None,totalTestEncountersViral,2729005,2042,89995,581,None,424,None,None,6/11/2020 00:00,2020-06-11T00:00:00Z,06/10 20:00,24442,89995,68211,2020-06-11T00:00:00Z,None,None,None,None,None,None,2729005,None,None,None,None,None,None,None,None,None,None,None,36,736,0,380892,60839,380892,None,38,0,37d9497dc2392c622cbd52abd30aa903820e0a61,0,0,0,0,0,
2020-06-12,NY,381714,None,None,None,totalTestEncountersViral,2801400,1898,89995,552,None,387,None,None,6/12/2020 00:00,2020-06-12T00:00:00Z,06/11 20:00,24495,89995,68399,2020-06-12T00:00:00Z,None,None,None,None,None,None,2801400,None,None,None,None,None,None,None,None,None,None,None,36,822,0,381714,72395,381714,None,53,0,dcd296c9ecc6929f5949106f9527134ab6e66e8a,0,0,0,0,0,
2020-06-13,NY,382630,None,None,None,totalTestEncountersViral,2872240,1734,89995,517,None,360,None,None,6/12/2020 00:00,2020-06-12T00:00:00Z,06/11 20:00,24527,89995,68584,2020-06-12T00:00:00Z,None,None,None,None,None,None,2872240,None,None,None,None,None,None,None,None,None,None,None,36,916,0,382630,70840,382630,None,32,0,a621bd90137369b5805451cdeb36330aea8047ce,0,0,0,0,0,
2020-06-14,NY,383324,None,None,None,totalTestEncountersViral,2934599,1657,89995,499,None,346,None,None,6/13/2020 00:00,2020-06-13T00:00:00Z,06/12 20:00,24551,89995,68761,2020-06-13T00:00:00Z,None,None,None,None,None,None,2934599,None,None,None,None,None,None,None,None,None,None,None,36,694,0,383324,62359,383324,None,24,0,690569c9981326cf1e5b53b180dc93083c8939ae,0,0,0,0,0,
2020-06-15,NY,383944,None,None,None,totalTestEncountersViral,2991210,1608,89995,470,None,323,None,None,6/15/2020 00:00,2020-06-15T00:00:00Z,06/14 20:00,24579,89995,68851,2020-06-15T00:00:00Z,None,None,None,None,None,None,2991210,None,None,None,None,None,None,None,None,None,None,None,36,620,0,383944,56611,383944,None,28,0,2c76e295f98d060199a5d4019b7a7d6622864d6d,0,0,0,0,0,
2020-06-16,NY,384575,None,None,None,totalTestEncountersViral,3051778,1538,89995,449,None,303,None,None,6/16/2020 00:00,2020-06-16T00:00:00Z,06/15 20:00,24608,89995,68938,2020-06-16T00:00:00Z,None,None,None,None,None,None,3051778,None,None,None,None,None,None,None,None,None,None,None,36,631,0,384575,60568,384575,None,29,0,daef44288da91743aa411af7981acde84484d1b5,0,0,0,0,0,
2020-06-17,NY,385142,None,None,None,totalTestEncountersViral,3111119,1479,89995,431,None,304,None,None,6/17/2020 00:00,2020-06-17T00:00:00Z,06/16 20:00,24629,89995,69085,2020-06-17T00:00:00Z,None,None,None,None,None,None,3111119,None,None,None,None,None,None,None,None,None,None,None,36,567,0,385142,59341,385142,None,21,0,25844f052b321bfd32759e4c33684e251e84a2d3,0,0,0,0,0,
2020-06-18,NY,385760,None,None,None,totalTestEncountersViral,3179660,1358,89995,388,None,278,None,None,6/18/2020 00:00,2020-06-18T00:00:00Z,06/17 20:00,24661,89995,69243,2020-06-18T00:00:00Z,None,None,None,None,None,None,3179660,None,None,None,None,None,None,None,None,None,None,None,36,618,0,385760,68541,385760,None,32,0,5a303f5f5ed81d36aed58c0de6b83ae59cd31b05,0,0,0,0,0,
2020-06-19,NY,386556,None,None,None,totalTestEncountersViral,3258963,1284,89995,359,None,256,None,None,6/19/2020 00:00,2020-06-19T00:00:00Z,06/18 20:00,24686,89995,69377,2020-06-19T00:00:00Z,None,None,None,None,None,None,3258963,None,None,None,None,None,None,None,None,None,None,None,36,796,0,386556,79303,386556,None,25,0,14c2e3dca9ca6bd83dbfa8de481d34f5a6745f87,0,0,0,0,0,
2020-06-20,NY,387272,None,None,None,totalTestEncountersViral,3327793,1220,89995,335,None,237,None,None,6/19/2020 23:59,2020-06-19T23:59:00Z,06/19 19:59,24710,89995,69506,2020-06-19T23:59:00Z,None,None,None,None,None,None,3327793,None,None,None,None,None,None,None,None,None,None,None,36,716,0,387272,68830,387272,None,24,0,d4de70fd0267807d1d3a7ab1ccc6cf72a479c869,0,0,0,0,0,
2020-06-21,NY,387936,None,None,None,totalTestEncountersViral,3395319,1142,89995,332,None,237,None,None,6/20/2020 23:59,2020-06-20T23:59:00Z,06/20 19:59,24725,89995,69506,2020-06-20T23:59:00Z,None,None,None,None,None,None,3395319,None,None,None,None,None,None,None,None,None,None,None,36,664,0,387936,67526,387936,None,15,0,eade35877719a31dfe1b5b1f4973beb1bcac910f,0,0,0,0,0,
2020-06-22,NY,388488,None,None,None,totalTestEncountersViral,3452099,1122,89995,330,None,228,None,None,6/21/2020 23:59,2020-06-21T23:59:00Z,06/21 19:59,24739,89995,69710,2020-06-21T23:59:00Z,None,None,None,None,None,None,3452099,None,None,None,None,None,None,None,None,None,None,None,36,552,0,388488,56780,388488,None,14,0,15b6b52c3448f02baef09879b80725db58db028e,0,0,0,0,0,
2020-06-23,NY,389085,None,None,None,totalTestEncountersViral,3500808,1104,89995,302,None,228,None,None,6/22/2020 23:59,2020-06-22T23:59:00Z,06/22 19:59,24766,89995,69710,2020-06-22T23:59:00Z,None,None,None,None,None,None,3500808,None,None,None,None,None,None,None,None,None,None,None,36,597,0,389085,48709,389085,None,27,0,30db29f62eccccc9b274f525c8f1c91cd40ea897,0,0,0,0,0,
2020-06-24,NY,389666,None,None,None,totalTestEncountersViral,3551952,1071,89995,290,None,228,None,None,6/23/2020 23:59,2020-06-23T23:59:00Z,06/23 19:59,24782,89995,69710,2020-06-23T23:59:00Z,None,None,None,None,None,None,3551952,None,None,None,None,None,None,None,None,None,None,None,36,581,0,389666,51144,389666,None,16,0,a8c02ac5e4d5733ec9a26e0158d344bd96c7d26c,0,0,0,0,0,
2020-06-25,NY,390415,None,None,None,totalTestEncountersViral,3619594,996,89995,270,None,167,None,None,6/24/2020 23:59,2020-06-24T23:59:00Z,06/24 19:59,24800,89995,70010,2020-06-24T23:59:00Z,None,None,None,None,None,None,3619594,None,None,None,None,None,None,None,None,None,None,None,36,749,0,390415,67642,390415,None,18,0,4e4038d41db545207ee7b825c310c0e95a3d0866,0,0,0,0,0,
2020-06-26,NY,391220,None,None,None,totalTestEncountersViral,3681317,951,89995,244,None,167,None,None,6/25/2020 23:59,2020-06-25T23:59:00Z,06/25 19:59,24814,89995,70010,2020-06-25T23:59:00Z,None,None,None,None,None,None,3681317,None,None,None,None,None,None,None,None,None,None,None,36,805,0,391220,61723,391220,None,14,0,0415ca28a21a379fdec8a1a34f7bf57b53a7b511,0,0,0,0,0,
2020-06-27,NY,391923,None,None,None,totalTestEncountersViral,3754579,908,89995,230,None,167,None,None,6/26/2020 23:59,2020-06-26T23:59:00Z,06/26 19:59,24830,89995,70010,2020-06-26T23:59:00Z,None,None,None,None,None,None,3754579,None,None,None,None,None,None,None,None,None,None,None,36,703,0,391923,73262,391923,None,16,0,49d082c4525827acb47baf3905154b915f46e62d,0,0,0,0,0,
2020-06-28,NY,392539,None,None,None,totalTestEncountersViral,3816485,869,89995,229,None,167,None,None,6/27/2020 23:59,2020-06-27T23:59:00Z,06/27 19:59,24835,89995,70010,2020-06-27T23:59:00Z,None,None,None,None,None,None,3816485,None,None,None,None,None,None,None,None,None,None,None,36,616,0,392539,61906,392539,None,5,0,c6b2f6c762a5771b69bd2b3a1799ddd8dc4733e2,0,0,0,0,0,
2020-06-29,NY,392930,None,None,None,totalTestEncountersViral,3862913,853,89995,216,None,136,None,None,6/28/2020 23:59,2020-06-28T23:59:00Z,06/28 19:59,24842,89995,70435,2020-06-28T23:59:00Z,None,None,None,None,None,None,3862913,None,None,None,None,None,None,None,None,None,None,None,36,391,0,392930,46428,392930,None,7,0,51bb925b19c9907d34d959bc544eb501ad200318,0,0,0,0,0,
2020-06-30,NY,393454,None,None,None,totalTestEncountersViral,3914938,891,89995,217,None,137,None,None,6/29/2020 00:00,2020-06-29T00:00:00Z,06/28 20:00,24855,89995,70487,2020-06-29T00:00:00Z,None,None,None,None,None,None,3914938,None,None,None,None,None,None,None,None,None,None,None,36,524,0,393454,52025,393454,None,13,0,e526c4b8fb8a28dea6f1fd081b5bebb486a84195,0,0,0,0,0,
2020-07-01,NY,394079,None,None,None,totalTestEncountersViral,3971648,879,89995,226,None,139,None,None,6/30/2020 23:59,2020-06-30T23:59:00Z,06/30 19:59,24866,89995,70590,2020-06-30T23:59:00Z,None,None,None,None,None,None,3971648,None,None,None,None,None,None,None,None,None,None,None,36,625,0,394079,56710,394079,None,11,0,1cc4905dca58c71548a1aa83e8d7a9899abe0e74,0,0,0,0,0,
2020-07-02,NY,394954,None,None,None,totalTestEncountersViral,4041593,878,89995,209,None,129,None,None,7/1/2020 23:59,2020-07-01T23:59:00Z,07/01 19:59,24877,89995,70698,2020-07-01T23:59:00Z,None,None,None,None,None,None,4041593,None,None,None,None,None,None,None,None,None,None,None,36,875,0,394954,69945,394954,None,11,0,2bbc83835b80c4c8818f31a7fc08dbb0ec50c77d,0,0,0,0,0,
2020-07-03,NY,395872,None,None,None,totalTestEncountersViral,4107985,857,89995,188,None,125,None,None,7/2/2020 23:59,2020-07-02T23:59:00Z,07/02 19:59,24885,89995,70794,2020-07-02T23:59:00Z,None,None,None,None,None,None,4107985,None,None,None,None,None,None,None,None,None,None,None,36,918,0,395872,66392,395872,None,8,0,054e3ba99d53b4993142c8345953149af3f3c464,0,0,0,0,0,
2020-07-04,NY,396598,None,None,None,totalTestEncountersViral,4170388,844,89995,190,None,119,None,None,7/3/2020 23:59,2020-07-03T23:59:00Z,07/03 19:59,24896,89995,70877,2020-07-03T23:59:00Z,None,None,None,None,None,None,4170388,None,None,None,None,None,None,None,None,None,None,None,36,726,0,396598,62403,396598,None,11,0,c06fa733f70880c05507f40eeb280ed261dcd053,0,0,0,0,0,
2020-07-05,NY,397131,None,None,None,totalTestEncountersViral,4233803,832,89995,178,None,116,None,None,7/4/2020 23:59,2020-07-04T23:59:00Z,07/04 19:59,24904,89995,70968,2020-07-04T23:59:00Z,None,None,None,None,None,None,4233803,None,None,None,None,None,None,None,None,None,None,None,36,533,0,397131,63415,397131,None,8,0,05692f29b04d179812dfbfd2fcbd8da9855eaf51,0,0,0,0,0,
2020-07-06,NY,397649,None,None,None,totalTestEncountersViral,4288131,817,89995,170,None,103,None,None,7/5/2020 23:59,2020-07-05T23:59:00Z,07/05 19:59,24913,89995,71040,2020-07-05T23:59:00Z,None,None,None,None,None,None,4288131,None,None,None,None,None,None,None,None,None,None,None,36,518,0,397649,54328,397649,None,9,0,aa9a26ffac29f24eadd01c43ab1d33223f72139d,0,0,0,0,0,
2020-07-07,NY,398237,None,None,None,totalTestEncountersViral,4344867,836,89995,160,None,103,None,None,7/6/2020 23:59,2020-07-06T23:59:00Z,07/06 19:59,24924,89995,71091,2020-07-06T23:59:00Z,None,None,None,None,None,None,4344867,None,None,None,None,None,None,None,None,None,None,None,36,588,0,398237,56736,398237,None,11,0,0a68be008fce8f708102ba9aef4ebfa358dac28d,0,0,0,0,0,
2020-07-08,NY,398929,None,None,None,totalTestEncountersViral,4402452,841,89995,166,None,97,None,None,7/7/2020 23:59,2020-07-07T23:59:00Z,07/07 19:59,24944,89995,71185,2020-07-07T23:59:00Z,None,None,None,None,None,None,4402452,None,None,None,None,None,None,None,None,None,None,None,36,692,0,398929,57585,398929,None,20,0,62055fd38017c930cb8e30b53e947b096d2bef61,0,0,0,0,0,
2020-07-09,NY,399513,None,None,None,totalTestEncountersViral,4468016,851,89995,173,None,98,None,None,7/8/2020 23:59,2020-07-08T23:59:00Z,07/08 19:59,24959,89995,71279,2020-07-08T23:59:00Z,None,None,None,None,None,None,4468016,None,None,None,None,None,None,None,None,None,None,None,36,584,0,399513,65564,399513,None,15,0,66c2fef74b3f13565cfcb332c8c876cb5130d4ac,0,0,0,0,0,
2020-07-10,NY,400299,None,None,None,totalTestEncountersViral,4541574,826,89995,178,None,92,None,None,7/9/2020 23:59,2020-07-09T23:59:00Z,07/09 19:59,24968,89995,71371,2020-07-09T23:59:00Z,None,None,None,None,None,None,4541574,None,None,None,None,None,None,None,None,None,None,None,36,786,0,400299,73558,400299,None,9,0,38df098c9a23eb27c7f58729e8a806ee89c8a8a1,0,0,0,0,0,
2020-07-11,NY,401029,None,None,None,totalTestEncountersViral,4610777,799,89995,177,None,100,None,None,7/10/2020 23:59,2020-07-10T23:59:00Z,07/10 19:59,24974,89995,71477,2020-07-10T23:59:00Z,None,None,None,None,None,None,4610777,None,None,None,None,None,None,None,None,None,None,None,36,730,0,401029,69203,401029,None,6,0,1ab63c559bf71e8115a9021bf062c7022507d9bd,0,0,0,0,0,
2020-07-12,NY,401706,None,None,None,totalTestEncountersViral,4673195,801,89995,174,None,102,None,None,7/11/2020 23:59,2020-07-11T23:59:00Z,07/11 19:59,24979,89995,71565,2020-07-11T23:59:00Z,None,None,None,None,None,None,4673195,None,None,None,None,None,None,None,None,None,None,None,36,677,0,401706,62418,401706,None,5,0,7bbe19b953ba6b9fe93c47a216e43d13298c1511,0,0,0,0,0,
2020-07-13,NY,402263,None,None,None,totalTestEncountersViral,4724882,792,89995,175,None,103,None,None,7/12/2020 23:59,2020-07-12T23:59:00Z,07/12 19:59,24989,89995,71643,2020-07-12T23:59:00Z,None,None,None,None,None,None,4724882,None,None,None,None,None,None,None,None,None,None,None,36,557,0,402263,51687,402263,None,10,0,ca360d03b6ee6b36dc4a80135d3007b7147eee75,0,0,0,0,0,
2020-07-14,NY,403175,None,None,None,totalTestEncountersViral,4784927,820,89995,167,None,101,None,None,7/13/2020 23:59,2020-07-13T23:59:00Z,07/13 19:59,24994,89995,71692,2020-07-13T23:59:00Z,None,None,None,None,None,None,4784927,None,None,None,None,None,None,None,None,None,None,None,36,912,0,403175,60045,403175,None,5,0,8bf3a0489093a607aad260a80c6d61e367cce68b,0,0,0,0,0,
2020-07-15,NY,404006,None,None,None,totalTestEncountersViral,4848525,831,89995,165,None,94,None,None,7/14/2020 23:59,2020-07-14T23:59:00Z,07/14 19:59,25003,89995,71782,2020-07-14T23:59:00Z,None,None,None,None,None,None,4848525,None,None,None,None,None,None,None,None,None,None,None,36,831,0,404006,63598,404006,None,9,0,f76709a1839efe2f8873bc54990d1f434d36bfbf,0,0,0,0,0,
2020-07-16,NY,404775,None,None,None,totalTestEncountersViral,4921210,813,89995,165,None,88,None,None,7/15/2020 23:59,2020-07-15T23:59:00Z,07/15 19:59,25014,89995,71867,2020-07-15T23:59:00Z,None,None,None,None,None,None,4921210,None,None,None,None,None,None,None,None,None,None,None,36,769,0,404775,72685,404775,None,11,0,5bc6149512ab2a00031af9f20f88ec150cb96029,0,0,0,0,0,
2020-07-17,NY,405551,None,None,None,totalTestEncountersViral,4999449,765,89995,179,None,98,None,None,7/16/2020 23:59,2020-07-16T23:59:00Z,07/16 19:59,25024,89995,71970,2020-07-16T23:59:00Z,None,None,None,None,None,None,4999449,None,None,None,None,None,None,None,None,None,None,None,36,776,0,405551,78239,405551,None,10,0,d6724db39b443c50950dadd0cebd07647685ea94,0,0,0,0,0,
2020-07-18,NY,406305,None,None,None,totalTestEncountersViral,5069266,743,89995,172,None,100,None,None,7/17/2020 23:59,2020-07-17T23:59:00Z,07/17 19:59,25035,89995,72064,2020-07-17T23:59:00Z,None,None,None,None,None,None,5069266,None,None,None,None,None,None,None,None,None,None,None,36,754,0,406305,69817,406305,None,11,0,b5d703b1aa7f904859be16a6e43d249af22eba4d,0,0,0,0,0,
2020-07-19,NY,406807,None,None,None,totalTestEncountersViral,5115470,722,89995,160,None,96,None,None,7/18/2020 23:59,2020-07-18T23:59:00Z,07/18 19:59,25048,89995,72161,2020-07-18T23:59:00Z,None,None,None,None,None,None,5115470,None,None,None,None,None,None,None,None,None,None,None,36,502,0,406807,46204,406807,None,13,0,0163434ebd5733a12c63f1d6b0e16846f8d8fa14,0,0,0,0,0,
2020-07-20,NY,407326,None,None,None,totalTestEncountersViral,5164812,716,89995,158,None,93,None,None,7/19/2020 23:59,2020-07-19T23:59:00Z,07/19 19:59,25056,89995,72229,2020-07-19T23:59:00Z,None,None,None,None,None,None,5164812,None,None,None,None,None,None,None,None,None,None,None,36,519,0,407326,49342,407326,None,8,0,fae8e53effcb228060324c732d9ec0f3fd7bb3c7,0,0,0,0,0,
2020-07-21,NY,408181,None,None,None,totalTestEncountersViral,5230981,724,89995,163,None,91,None,None,7/20/2020 23:59,2020-07-20T23:59:00Z,07/20 19:59,25058,89995,72302,2020-07-20T23:59:00Z,None,None,None,None,None,None,5230981,None,None,None,None,None,None,None,None,None,None,None,36,855,0,408181,66169,408181,None,2,0,2a2aa88940f6ed3822622aadc7a7fba4cd6a7633,0,0,0,0,0,
2020-07-22,NY,408886,None,None,None,totalTestEncountersViral,5298640,714,89995,179,None,96,None,None,7/21/2020 23:59,2020-07-21T23:59:00Z,07/21 19:59,25068,89995,72386,2020-07-21T23:59:00Z,None,None,None,None,None,None,5298640,None,None,None,None,None,None,None,None,None,None,None,36,705,0,408886,67659,408886,None,10,0,299039d67f3e27e930ad17f1cd86647bfa7b67bc,0,0,0,0,0,
2020-07-23,NY,409697,None,None,None,totalTestEncountersViral,5368338,706,89995,160,None,93,None,None,7/22/2020 23:59,2020-07-22T23:59:00Z,07/22 19:59,25081,89995,72466,2020-07-22T23:59:00Z,None,None,None,None,None,None,5368338,None,None,None,None,None,None,None,None,None,None,None,36,811,0,409697,69698,409697,None,13,0,e47e6f7dfc2bf4201a86dfe75572e750e2e4018c,0,0,0,0,0,
2020-07-24,NY,410450,None,None,None,totalTestEncountersViral,5444845,650,89995,156,None,93,None,None,7/23/2020 23:59,2020-07-23T23:59:00Z,07/23 19:59,25090,89995,72552,2020-07-23T23:59:00Z,None,None,None,None,None,None,5444845,None,None,None,None,None,None,None,None,None,None,None,36,753,0,410450,76507,410450,None,9,0,9c5bd626da3f863d5cc0f7db4a57c44a3e85f030,0,0,0,0,0,
2020-07-25,NY,411200,None,None,None,totalTestEncountersViral,5516311,646,89995,149,None,94,None,None,7/24/2020 23:59,2020-07-24T23:59:00Z,07/24 19:59,25103,89995,72632,2020-07-24T23:59:00Z,None,None,None,None,None,None,5516311,None,None,None,None,None,None,None,None,None,None,None,36,750,0,411200,71466,411200,None,13,0,70ce7372e1cb7b44b5391a5b138205c1c746afd6,0,0,0,0,0,
2020-07-26,NY,411736,None,None,None,totalTestEncountersViral,5569879,637,89995,155,None,90,None,None,7/25/2020 23:59,2020-07-25T23:59:00Z,07/25 19:59,25106,89995,72716,2020-07-25T23:59:00Z,None,None,None,None,None,None,5569879,None,None,None,None,None,None,None,None,None,None,None,36,536,0,411736,53568,411736,None,3,0,224c99a3554e9be712b4b264823326477089387e,0,0,0,0,0,
2020-07-27,NY,412344,None,None,None,totalTestEncountersViral,5627149,642,89995,149,None,84,None,None,7/26/2020 23:59,2020-07-26T23:59:00Z,07/26 19:59,25117,89995,72766,2020-07-26T23:59:00Z,None,None,None,None,None,None,5627149,None,None,None,None,None,None,None,None,None,None,None,36,608,0,412344,57270,412344,None,11,0,f8a0e528c5feb71bad8dbcd4d9e9476e8ba370ab,0,0,0,0,0,
2020-07-28,NY,412878,None,None,None,totalTestEncountersViral,5684546,648,89995,152,None,81,None,None,7/27/2020 23:59,2020-07-27T23:59:00Z,07/27 19:59,25126,89995,72813,2020-07-27T23:59:00Z,None,None,None,None,None,None,5684546,None,None,None,None,None,None,None,None,None,None,None,36,534,0,412878,57397,412878,None,9,0,0a4ab59322822c7736bb20a8763439c99b0e2d66,0,0,0,0,0,
2020-07-29,NY,413593,None,None,None,totalTestEncountersViral,5746822,619,89995,154,None,76,None,None,7/28/2020 23:59,2020-07-28T23:59:00Z,07/28 19:59,25132,89995,72900,2020-07-28T23:59:00Z,None,None,None,None,None,None,5746822,None,None,None,None,None,None,None,None,None,None,None,36,715,0,413593,62276,413593,None,6,0,8b2c06a22bb1840ecb7c34ea0dd5d14870a64a4c,0,0,0,0,0,
2020-07-30,NY,414370,None,None,None,totalTestEncountersViral,5820368,586,89995,142,None,72,None,None,7/29/2020 23:59,2020-07-29T23:59:00Z,07/29 19:59,25145,89995,72973,2020-07-29T23:59:00Z,None,None,None,None,None,None,5820368,None,None,None,None,None,None,None,None,None,None,None,36,777,0,414370,73546,414370,None,13,0,f265114249f148be15edd1a6830c148dd6d354d8,0,0,0,0,0,
2020-07-31,NY,415014,None,None,None,totalTestEncountersViral,5889237,576,89995,140,None,70,None,None,7/30/2020 23:59,2020-07-30T23:59:00Z,07/30 19:59,25150,89995,73055,2020-07-30T23:59:00Z,None,None,None,None,None,None,5889237,None,None,None,None,None,None,None,None,None,None,None,36,644,0,415014,68869,415014,None,5,0,1f9b38b2081ddda1329c9c8d3e306be5da2c640c,0,0,0,0,0,
2020-08-01,NY,415767,None,None,None,totalTestEncountersViral,5971974,581,89995,147,None,72,None,None,7/31/2020 15:35,2020-07-31T15:35:00Z,07/31 11:35,25164,89995,73134,2020-07-31T15:35:00Z,None,None,None,None,None,None,5971974,None,None,None,None,None,None,None,None,None,None,None,36,753,0,415767,82737,415767,None,14,0,610da1dfd70d02cac1b17564d9b276b2052c4cfb,0,0,0,0,0,
2020-08-02,NY,416298,None,None,None,totalTestEncountersViral,6030935,556,89995,143,None,71,None,None,8/1/2020 23:59,2020-08-01T23:59:00Z,08/01 19:59,25170,89995,73222,2020-08-01T23:59:00Z,None,None,None,None,None,None,6030935,None,None,None,None,None,None,None,None,None,None,None,36,531,0,416298,58961,416298,None,6,0,0b6c424b9d9351b8abc32f5dfc5bd4bda39aea3f,0,0,0,0,0,
2020-08-03,NY,416843,None,None,None,totalTestEncountersViral,6082774,536,89995,136,None,62,None,None,8/2/2020 23:59,2020-08-02T23:59:00Z,08/02 19:59,25172,89995,73279,2020-08-02T23:59:00Z,None,None,None,None,None,None,6082774,None,None,None,None,None,None,None,None,None,None,None,36,545,0,416843,51839,416843,None,2,0,20c95fa6009f4fed691b5b276eaf8cd8f8a462c1,0,0,0,0,0,
2020-08-04,NY,417589,None,None,None,totalTestEncountersViral,6153767,568,89995,139,None,69,None,None,8/3/2020 23:59,2020-08-03T23:59:00Z,08/03 19:59,25175,89995,73326,2020-08-03T23:59:00Z,None,None,None,None,None,None,6153767,None,None,None,None,None,None,None,None,None,None,None,36,746,0,417589,70993,417589,None,3,0,2c788e28355b5b41885d17c9c73b9e7bb1baa613,0,0,0,0,0,
2020-08-05,NY,418225,None,None,None,totalTestEncountersViral,6226435,564,89995,134,None,69,None,None,8/4/2020 23:59,2020-08-04T23:59:00Z,08/04 19:59,25179,89995,73410,2020-08-04T23:59:00Z,None,None,None,None,None,None,6226435,None,None,None,None,None,None,None,None,None,None,None,36,636,0,418225,72668,418225,None,4,0,a4dcee8c16c1510d0834bad805789ca306fad020,0,0,0,0,0,
2020-08-06,NY,418928,None,None,None,totalTestEncountersViral,6298805,570,89995,132,None,69,None,None,8/5/2020 23:59,2020-08-05T23:59:00Z,08/05 19:59,25185,89995,73472,2020-08-05T23:59:00Z,None,None,None,None,None,None,6298805,None,None,None,None,None,None,None,None,None,None,None,36,703,0,418928,72370,418928,None,6,0,7873f0f7ad8ede9ac2eb376c98bd7fb583f4dcb5,0,0,0,0,0,
2020-08-07,NY,419642,None,None,None,totalTestEncountersViral,6368975,579,89995,139,None,66,None,None,8/6/2020 23:59,2020-08-06T23:59:00Z,08/06 19:59,25190,89995,73530,2020-08-06T23:59:00Z,None,None,None,None,None,None,6368975,None,None,None,None,None,None,None,None,None,None,None,36,714,0,419642,70170,419642,None,5,0,1730cc934f64c0bfb1057041fe3add84a850c882,0,0,0,0,0,
2020-08-08,NY,420345,None,None,None,totalTestEncountersViral,6443832,573,89995,133,None,64,None,None,8/7/2020 23:59,2020-08-07T23:59:00Z,08/07 19:59,25195,89995,73609,2020-08-07T23:59:00Z,None,None,None,None,None,None,6443832,None,None,None,None,None,None,None,None,None,None,None,36,703,0,420345,74857,420345,None,5,0,082a6b367e0dd83bd97317cf3c56f677f7707280,0,0,0,0,0,
2020-08-09,NY,420860,None,None,None,totalTestEncountersViral,6509644,548,89995,131,None,66,None,None,8/8/2020 23:59,2020-08-08T23:59:00Z,08/08 19:59,25202,89995,73689,2020-08-08T23:59:00Z,None,None,None,None,None,None,6509644,None,None,None,None,None,None,None,None,None,None,None,36,515,0,420860,65812,420860,None,7,0,bd1317e9a79332850e3558eba56aebcd0d6aebd2,0,0,0,0,0,
2020-08-10,NY,421336,None,None,None,totalTestEncountersViral,6563646,535,89995,127,None,62,None,None,8/9/2020 23:59,2020-08-09T23:59:00Z,08/09 19:59,25204,89995,73736,2020-08-09T23:59:00Z,None,None,None,None,None,None,6563646,None,None,None,None,None,None,None,None,None,None,None,36,476,0,421336,54002,421336,None,2,0,5393bf3f06deea2ce030959e738aee7c643eda35,0,0,0,0,0,
2020-08-11,NY,422003,None,None,None,totalTestEncountersViral,6640705,540,89995,120,None,60,None,None,8/10/2020 23:59,2020-08-10T23:59:00Z,08/10 19:59,25211,89995,73779,2020-08-10T23:59:00Z,None,None,None,None,None,None,6640705,None,None,None,None,None,None,None,None,None,None,None,36,667,0,422003,77059,422003,None,7,0,0f9339b64ddb3eab4a77685f98d021ed8d1f44f0,0,0,0,0,0,
2020-08-12,NY,422703,None,None,None,totalTestEncountersViral,6728481,558,89995,123,None,62,None,None,8/11/2020 23:59,2020-08-11T23:59:00Z,08/11 19:59,25218,89995,73842,2020-08-11T23:59:00Z,None,None,None,None,None,None,6728481,None,None,None,None,None,None,None,None,None,None,None,36,700,0,422703,87776,422703,None,7,0,13f89473d7d71f5cd0ef2d7e59c02a0e25f15594,0,0,0,0,0,
2020-08-13,NY,423440,None,None,None,totalTestEncountersViral,6816381,555,89995,124,None,56,None,None,8/12/2020 23:59,2020-08-12T23:59:00Z,08/12 19:59,25228,89995,73907,2020-08-12T23:59:00Z,None,None,None,None,None,None,6816381,None,None,None,None,None,None,None,None,None,None,None,36,737,0,423440,87900,423440,None,10,0,7b540e1969b4e5deb2b259e394114d5f7b77200b,0,0,0,0,0,
2020-08-14,NY,424167,None,None,None,totalTestEncountersViral,6901836,554,89995,127,None,59,None,None,8/13/2020 23:59,2020-08-13T23:59:00Z,08/13 19:59,25232,89995,73997,2020-08-13T23:59:00Z,None,None,None,None,None,None,6901836,None,None,None,None,None,None,None,None,None,None,None,36,727,0,424167,85455,424167,None,4,0,28550b99310f7b540ea99926fbd8f68263609764,0,0,0,0,0,
2020-08-15,NY,424901,None,None,None,totalTestEncountersViral,6990504,523,89995,120,None,58,None,None,8/14/2020 23:59,2020-08-14T23:59:00Z,08/14 19:59,25244,89995,74081,2020-08-14T23:59:00Z,None,None,None,None,None,None,6990504,None,None,None,None,None,None,None,None,None,None,None,36,734,0,424901,88668,424901,None,12,0,b903062fffa1b4dbe181e6d5a191c2e957d5e398,0,0,0,0,0,
2020-08-16,NY,425508,None,None,None,totalTestEncountersViral,7068196,527,89995,128,None,59,None,None,8/15/2020 23:59,2020-08-15T23:59:00Z,08/15 19:59,25250,89995,74154,2020-08-15T23:59:00Z,None,None,None,None,None,None,7068196,None,None,None,None,None,None,None,None,None,None,None,36,607,0,425508,77692,425508,None,6,0,65141325741b2b2348b5417f3f3d876370370dfb,0,0,0,0,0,
2020-08-17,NY,425916,None,None,None,totalTestEncountersViral,7125087,534,89995,133,None,64,None,None,8/16/2020 23:59,2020-08-16T23:59:00Z,08/16 19:59,25256,89995,74207,2020-08-16T23:59:00Z,None,None,None,None,None,None,7125087,None,None,None,None,None,None,None,None,None,None,None,36,408,0,425916,56891,425916,None,6,0,276f5ef07fd136c0306151b43af1660c689c3951,0,0,0,0,0,
2020-08-18,NY,426571,None,None,None,totalTestEncountersViral,7191978,537,89995,126,None,60,None,None,8/17/2020 23:59,2020-08-17T23:59:00Z,08/17 19:59,25264,89995,74258,2020-08-17T23:59:00Z,None,None,None,None,None,None,7191978,None,None,None,None,None,None,None,None,None,None,None,36,655,0,426571,66891,426571,None,8,0,a91dd9508b1b15b2d05818cb7fd49a08527b8bd9,0,0,0,0,0,
2020-08-19,NY,427202,None,None,None,totalTestEncountersViral,7272403,548,89995,131,None,60,None,None,8/18/2020 23:59,2020-08-18T23:59:00Z,08/18 19:59,25270,89995,74328,2020-08-18T23:59:00Z,None,None,None,None,None,None,7272403,None,None,None,None,None,None,None,None,None,None,None,36,631,0,427202,80425,427202,None,6,0,e6eed9ffc433e467b27a3d741babbaab9f32a7c8,0,0,0,0,0,
2020-08-20,NY,427803,None,None,None,totalTestEncountersViral,7353387,518,89995,120,None,62,None,None,8/19/2020 23:59,2020-08-19T23:59:00Z,08/19 19:59,25275,89995,74406,2020-08-19T23:59:00Z,None,None,None,None,None,None,7353387,None,None,None,None,None,None,None,None,None,None,None,36,601,0,427803,80984,427803,None,5,0,1b35f421fdaafaa42e456af929e76510c81ce9fe,0,0,0,0,0,
2020-08-21,NY,428512,None,None,None,totalTestEncountersViral,7452267,490,89995,119,None,58,None,None,8/20/2020 23:59,2020-08-20T23:59:00Z,08/20 19:59,25278,89995,74485,2020-08-20T23:59:00Z,None,None,None,None,None,None,7452267,None,None,None,None,None,None,None,None,None,None,None,36,709,0,428512,98880,428512,None,3,0,026a6306d16c0983b7b2ca606e1be00502bf4a07,0,0,0,0,0,
2020-08-22,NY,429165,None,None,None,totalTestEncountersViral,7547116,483,89995,116,None,56,None,None,8/21/2020 23:59,2020-08-21T23:59:00Z,08/21 19:59,25282,89995,74553,2020-08-21T23:59:00Z,None,None,None,None,None,None,7547116,None,None,None,None,None,None,None,None,None,None,None,36,653,0,429165,94849,429165,None,4,0,4a9433fb041bf97c2230c5b91200cf6fd5f178a0,0,0,0,0,0,
2020-08-23,NY,429737,None,None,None,totalTestEncountersViral,7621159,472,89995,110,None,50,None,None,8/22/2020 23:59,2020-08-22T23:59:00Z,08/22 19:59,25288,89995,74640,2020-08-22T23:59:00Z,None,None,None,None,None,None,7621159,None,None,None,None,None,None,None,None,None,None,None,36,572,0,429737,74043,429737,None,6,0,df082057f73989b9bd9af7e160e5c75c177841c7,0,0,0,0,0,
2020-08-24,NY,430145,None,None,None,totalTestEncountersViral,7683190,482,89995,120,None,54,None,None,8/23/2020 23:59,2020-08-23T23:59:00Z,08/23 19:59,25295,89995,74684,2020-08-23T23:59:00Z,None,None,None,None,None,None,7683190,None,None,None,None,None,None,None,None,None,None,None,36,408,0,430145,62031,430145,None,7,0,59a3ac554f37133e7c24d83961cdb6b7937ed2ad,0,0,0,0,0,
2020-08-25,NY,430774,None,None,None,totalTestEncountersViral,7750445,488,89995,133,None,52,None,None,8/24/2020 23:59,2020-08-24T23:59:00Z,08/24 19:59,25297,89995,74731,2020-08-24T23:59:00Z,None,None,None,None,None,None,7750445,None,None,None,None,None,None,None,None,None,None,None,36,629,0,430774,67255,430774,None,2,0,d8bf583dddf902cb076ae134b475f7509f31d42c,0,0,0,0,0,
2020-08-26,NY,431340,None,None,None,totalTestEncountersViral,7821634,492,89995,136,None,54,None,None,8/25/2020 23:59,2020-08-25T23:59:00Z,08/25 19:59,25305,89995,74791,2020-08-25T23:59:00Z,None,None,None,None,None,None,7821634,None,None,None,None,None,None,None,None,None,None,None,36,566,0,431340,71189,431340,None,8,0,47a14190393397ee2416c70ad7b35fd8aed5b3a2,0,0,0,0,0,
2020-08-27,NY,432131,None,None,None,totalTestEncountersViral,7905071,490,89995,126,None,52,None,None,8/26/2020 23:59,2020-08-26T23:59:00Z,08/26 19:59,25309,89995,74850,2020-08-26T23:59:00Z,None,None,None,None,None,None,7905071,None,None,None,None,None,None,None,None,None,None,None,36,791,0,432131,83437,432131,None,4,0,3ac480a7c641f5798e5df40b205c40c9acaa5b2b,0,0,0,0,0,
2020-08-28,NY,432767,None,None,None,totalTestEncountersViral,8002897,478,89995,122,None,51,None,None,8/27/2020 23:59,2020-08-27T23:59:00Z,08/27 19:59,25312,89995,74923,2020-08-27T23:59:00Z,None,None,None,None,None,None,8002897,None,None,None,None,None,None,None,None,None,None,None,36,636,0,432767,97826,432767,None,3,0,4d4e61281d7a82437002444139379e6e6a8c4798,0,0,0,0,0,
2020-08-29,NY,433402,None,None,None,totalTestEncountersViral,8096770,458,89995,116,None,48,None,None,8/28/2020 23:59,2020-08-28T23:59:00Z,08/28 19:59,25319,89995,74990,2020-08-28T23:59:00Z,None,None,None,None,None,None,8096770,None,None,None,None,None,None,None,None,None,None,None,36,635,0,433402,93873,433402,None,7,0,1bce50f38a57fc9c298d7a2f8c63c0b70fb0ce77,0,0,0,0,0,
2020-08-30,NY,434100,None,None,None,totalTestEncountersViral,8196792,429,89995,112,None,47,None,None,8/29/2020 23:59,2020-08-29T23:59:00Z,08/29 19:59,25327,89995,75062,2020-08-29T23:59:00Z,None,None,None,None,None,None,8196792,None,None,None,None,None,None,None,None,None,None,None,36,698,0,434100,100022,434100,None,8,0,c16917b336c92efb3db515ed23a23fa12261041f,0,0,0,0,0,
2020-08-31,NY,434756,None,None,None,totalTestEncountersViral,8263033,418,89995,109,None,51,None,None,8/30/2020 23:59,2020-08-30T23:59:00Z,08/30 19:59,25328,89995,75100,2020-08-30T23:59:00Z,None,None,None,None,None,None,8263033,None,None,None,None,None,None,None,None,None,None,None,36,656,0,434756,66241,434756,None,1,0,c68a9692f2073dda80d50dcfb0c4c1f1195a331d,0,0,0,0,0,
2020-09-01,NY,435510,None,None,None,totalTestEncountersViral,8340030,432,89995,109,None,54,None,None,8/31/2020 23:59,2020-08-31T23:59:00Z,08/31 19:59,25331,89995,75142,2020-08-31T23:59:00Z,None,None,None,None,None,None,8340030,None,None,None,None,None,None,None,None,None,None,None,36,754,0,435510,76997,435510,None,3,0,d1d63d9c66c17b15659dad37aa8f2dd5a87dff60,0,0,0,0,0,
2020-09-02,NY,436218,None,None,None,totalTestEncountersViral,8428477,445,89995,117,None,61,None,None,9/1/2020 23:59,2020-09-01T23:59:00Z,09/01 19:59,25336,89995,75203,2020-09-01T23:59:00Z,None,None,None,None,None,None,8428477,None,None,None,None,None,None,None,None,None,None,None,36,708,0,436218,88447,436218,None,5,0,08357d8819e24e352ea2be45aee1f30da15e895d,0,0,0,0,0,
2020-09-03,NY,437107,None,None,None,totalTestEncountersViral,8517458,430,89995,117,None,61,None,None,9/2/2020 23:59,2020-09-02T23:59:00Z,09/02 19:59,25343,89995,75255,2020-09-02T23:59:00Z,None,None,None,None,None,None,8517458,None,None,None,None,None,None,None,None,None,None,None,36,889,0,437107,88981,437107,None,7,0,cc1cbd7c5a53da3e69e7008de789bbf9d6e641dd,0,0,0,0,0,
2020-09-04,NY,437971,None,None,None,totalTestEncountersViral,8610853,428,89995,116,None,61,None,None,9/3/2020 23:59,2020-09-03T23:59:00Z,09/03 19:59,25348,89995,75307,2020-09-03T23:59:00Z,None,None,None,None,None,None,8610853,None,None,None,None,None,None,None,None,None,None,None,36,864,0,437971,93395,437971,None,5,0,2f3c435ddf926e87b11c5f912d105986a6e60fed,0,0,0,0,0,
2020-09-05,NY,438772,None,None,None,totalTestEncountersViral,8710614,425,89995,115,None,61,None,None,9/4/2020 23:59,2020-09-04T23:59:00Z,09/04 19:59,25350,89995,75366,2020-09-04T23:59:00Z,None,None,None,None,None,None,8710614,None,None,None,None,None,None,None,None,None,None,None,36,801,0,438772,99761,438772,None,2,0,ae724aa68496414a56eda414853d3b4ad798fb0c,0,0,0,0,0,
2020-09-06,NY,439501,None,None,None,totalTestEncountersViral,8796244,410,89995,119,None,56,None,None,9/5/2020 23:59,2020-09-05T23:59:00Z,09/05 19:59,25359,89995,75425,2020-09-05T23:59:00Z,None,None,None,None,None,None,8796244,None,None,None,None,None,None,None,None,None,None,None,36,729,0,439501,85630,439501,None,9,0,13f371d9ad3d88a05d3dbb1ed724daa299ca43df,0,0,0,0,0,
2020-09-07,NY,440021,None,None,None,totalTestEncountersViral,8855109,413,89995,115,None,57,None,None,9/6/2020 23:59,2020-09-06T23:59:00Z,09/06 19:59,25361,89995,75471,2020-09-06T23:59:00Z,None,None,None,None,None,None,8855109,None,None,None,None,None,None,None,None,None,None,None,36,520,0,440021,58865,440021,None,2,0,bc7244ea52cf9c9f6ff68ee551570aa75672b3f2,0,0,0,0,0,
2020-09-08,NY,440578,None,None,None,totalTestEncountersViral,8912935,445,89995,114,None,52,None,None,9/7/2020 23:59,2020-09-07T23:59:00Z,09/07 19:59,25367,89995,75503,2020-09-07T23:59:00Z,None,None,None,None,None,None,8912935,None,None,None,None,None,None,None,None,None,None,None,36,557,0,440578,57826,440578,None,6,0,b74da256a4cd9121e7b3603929e84c86a0dd957c,0,0,0,0,0,
2020-09-09,NY,441154,None,None,None,totalTestEncountersViral,8976165,463,89995,121,None,59,None,None,9/8/2020 23:59,2020-09-08T23:59:00Z,09/08 19:59,25370,89995,75539,2020-09-08T23:59:00Z,None,None,None,None,None,None,8976165,None,None,None,None,None,None,None,None,None,None,None,36,576,0,441154,63230,441154,None,3,0,15dfad0b62e21eb601dbf36de52b4a3af1a875b7,0,0,0,0,0,
2020-09-10,NY,441911,None,None,None,totalTestEncountersViral,9052978,482,89995,120,None,55,None,None,9/9/2020 23:59,2020-09-09T23:59:00Z,09/09 19:59,25377,89995,75584,2020-09-09T23:59:00Z,None,None,None,None,None,None,9052978,None,None,None,None,None,None,None,None,None,None,None,36,757,0,441911,76813,441911,None,7,0,ab23b7b0e6deb08907e9a6ebef6d6238e73c6d2f,0,0,0,0,0,
2020-09-11,NY,442791,None,None,None,totalTestEncountersViral,9142700,474,89995,120,None,54,None,None,9/10/2020 23:59,2020-09-10T23:59:00Z,09/10 19:59,25382,89995,75649,2020-09-10T23:59:00Z,None,None,None,None,None,None,9142700,None,None,None,None,None,None,None,None,None,None,None,36,880,0,442791,89722,442791,None,5,0,3cb45dcef77d1515de8e5f070ec6ed13a73561c3,0,0,0,0,0,
2020-09-12,NY,443640,None,None,None,totalTestEncountersViral,9245625,467,89995,127,None,51,None,None,9/11/2020 23:59,2020-09-11T23:59:00Z,09/11 19:59,25384,89995,75707,2020-09-11T23:59:00Z,None,None,None,None,None,None,9245625,None,None,None,None,None,None,None,None,None,None,None,36,849,0,443640,102925,443640,None,2,0,e6d73ca05c81b3ceae1ffc5cb7ca4dd678c83227,0,0,0,0,0,
2020-09-13,NY,444365,None,None,None,totalTestEncountersViral,9318293,464,89995,131,None,54,None,None,9/12/2020 23:59,2020-09-12T23:59:00Z,09/12 19:59,25390,89995,75767,2020-09-12T23:59:00Z,None,None,None,None,None,None,9318293,None,None,None,None,None,None,None,None,None,None,None,36,725,0,444365,72668,444365,None,6,0,3f5394c1f7c1ca0d59fb5d4c804c44b12f398786,0,0,0,0,0,
2020-09-14,NY,444948,None,None,None,totalTestEncountersViral,9381651,464,89995,143,None,59,None,None,9/13/2020 23:59,2020-09-13T23:59:00Z,09/13 19:59,25394,89995,75814,2020-09-13T23:59:00Z,None,None,None,None,None,None,9381651,None,None,None,None,None,None,None,None,None,None,None,36,583,0,444948,63358,444948,None,4,0,1d145315e6a06f02f1ae4debb973cd2c5d6fdad1,0,0,0,0,0,
2020-09-15,NY,445714,None,None,None,totalTestEncountersViral,9455329,481,89995,144,None,60,None,None,9/14/2020 23:59,2020-09-14T23:59:00Z,09/14 19:59,25405,89995,75847,2020-09-14T23:59:00Z,None,None,None,None,None,None,9455329,None,None,None,None,None,None,None,None,None,None,None,36,766,0,445714,73678,445714,None,11,0,f52af309ede69be4df2eab2f0321efc6e2138a4f,0,0,0,0,0,
2020-09-16,NY,446366,None,None,None,totalTestEncountersViral,9530416,483,89995,138,None,67,None,None,9/15/2020 23:59,2020-09-15T23:59:00Z,09/15 19:59,25410,89995,75903,2020-09-15T23:59:00Z,None,None,None,None,None,None,9530416,None,None,None,None,None,None,None,None,None,None,None,36,652,0,446366,75087,446366,None,5,0,5a3572f9ce3afaa18829ecec0496e6f7ebb7afb5,0,0,0,0,0,
2020-09-17,NY,447262,None,None,None,totalTestEncountersViral,9621920,486,89995,135,None,68,None,None,9/16/2020 23:59,2020-09-16T23:59:00Z,09/16 19:59,25413,89995,75962,2020-09-16T23:59:00Z,None,None,None,None,None,None,9621920,None,None,None,None,None,None,None,None,None,None,None,36,896,0,447262,91504,447262,None,3,0,50605421beb7946e1e7d091e2beb1217ea083936,0,0,0,0,0,
2020-09-18,NY,448052,None,None,None,totalTestEncountersViral,9711647,478,89995,141,None,62,None,None,9/17/2020 23:59,2020-09-17T23:59:00Z,09/17 19:59,25423,89995,76036,2020-09-17T23:59:00Z,None,None,None,None,None,None,9711647,None,None,None,None,None,None,None,None,None,None,None,36,790,0,448052,89727,448052,None,10,0,1dbb502f3868dd438ac1984a93486ac4221bcc4a,0,0,0,0,0,
2020-09-19,NY,449038,None,None,None,totalTestEncountersViral,9822091,467,89995,144,None,60,None,None,9/18/2020 23:59,2020-09-18T23:59:00Z,09/18 19:59,25425,89995,76101,2020-09-18T23:59:00Z,None,None,None,None,None,None,9822091,None,None,None,None,None,None,None,None,None,None,None,36,986,0,449038,110444,449038,None,2,0,579d66c5fba195863f3a8adb736d8e6cf6911a8d,0,0,0,0,0,
2020-09-20,NY,449900,None,None,None,totalTestEncountersViral,9922446,468,89995,132,None,60,None,None,9/19/2020 23:59,2020-09-19T23:59:00Z,09/19 19:59,25427,89995,76179,2020-09-19T23:59:00Z,None,None,None,None,None,None,9922446,None,None,None,None,None,None,None,None,None,None,None,36,862,0,449900,100355,449900,None,2,0,e20e38a399eb2d21b4fdc4a2189402d60e4a7b46,0,0,0,0,0,
2020-09-21,NY,450473,None,None,None,totalTestEncountersViral,9980765,468,89995,134,None,66,None,None,9/20/2020 23:59,2020-09-20T23:59:00Z,09/20 19:59,25428,89995,76218,2020-09-20T23:59:00Z,None,None,None,None,None,None,9980765,None,None,None,None,None,None,None,None,None,None,None,36,573,0,450473,58319,450473,None,1,0,8ae89f6e039e2964d24d512cbfbd9d54b2430045,0,0,0,0,0,
2020-09-22,NY,451227,None,None,None,totalTestEncountersViral,10064762,470,89995,133,None,67,None,None,9/21/2020 23:59,2020-09-21T23:59:00Z,09/21 19:59,25432,89995,76246,2020-09-21T23:59:00Z,None,None,None,None,None,None,10064762,None,None,None,None,None,None,None,None,None,None,None,36,754,0,451227,83997,451227,None,4,0,83120aeb07aa85ef61221d3a38670f89f3dbea85,0,0,0,0,0,
2020-09-23,NY,451892,None,None,None,totalTestEncountersViral,10135692,490,89995,141,None,68,None,None,9/22/2020 23:59,2020-09-22T23:59:00Z,09/22 19:59,25437,89995,76306,2020-09-22T23:59:00Z,None,None,None,None,None,None,10135692,None,None,None,None,None,None,None,None,None,None,None,36,665,0,451892,70930,451892,None,5,0,f61412ef1c330967a9b201ac77ac36a1a6620623,0,0,0,0,0,
2020-09-24,NY,452847,None,None,None,totalTestEncountersViral,10228645,500,89995,145,None,72,None,None,9/23/2020 23:59,2020-09-23T23:59:00Z,09/23 19:59,25439,89995,76382,2020-09-23T23:59:00Z,None,None,None,None,None,None,10228645,None,None,None,None,None,None,None,None,None,None,None,36,955,0,452847,92953,452847,None,2,0,5012ee654a56d2b6366870e4787da8c52585dc74,0,0,0,0,0,
2020-09-25,NY,453755,None,None,None,totalTestEncountersViral,10323463,511,89995,154,None,76,None,None,9/24/2020 23:59,2020-09-24T23:59:00Z,09/24 19:59,25446,89995,76456,2020-09-24T23:59:00Z,None,None,None,None,None,None,10323463,None,None,None,None,None,None,None,None,None,None,None,36,908,0,453755,94818,453755,None,7,0,97e7ccc2603e6291a6ac01edaada335d7e9be5cd,0,0,0,0,0,
2020-09-26,NY,454760,None,None,None,totalTestEncountersViral,10423416,527,89995,164,None,75,None,None,9/25/2020 23:59,2020-09-25T23:59:00Z,09/25 19:59,25450,89995,76528,2020-09-25T23:59:00Z,None,None,None,None,None,None,10423416,None,None,None,None,None,None,None,None,None,None,None,36,1005,0,454760,99953,454760,None,4,0,1d63b4e04cb966ce0714b0fa16608dc306e52dc4,0,0,0,0,0,
2020-09-27,NY,455626,None,None,None,totalTestEncountersViral,10508186,541,89995,155,None,59,None,None,9/26/2020 23:59,2020-09-26T23:59:00Z,09/26 19:59,25456,89995,76595,2020-09-26T23:59:00Z,None,None,None,None,None,None,10508186,None,None,None,None,None,None,None,None,None,None,None,36,866,0,455626,84770,455626,None,6,0,ca12f7a1bce3731f8d974e8ad3089603b478d103,0,0,0,0,0,
2020-09-28,NY,456460,None,None,None,totalTestEncountersViral,10561122,543,89995,135,None,57,None,None,9/27/2020 23:59,2020-09-27T23:59:00Z,09/27 19:59,25468,89995,76649,2020-09-27T23:59:00Z,None,None,None,None,None,None,10561122,None,None,None,None,None,None,None,None,None,None,None,36,834,0,456460,52936,456460,None,12,0,56e041c3db5b6c0124098236bbdfa875fc218b6e,0,0,0,0,0,
2020-09-29,NY,457649,None,None,None,totalTestEncountersViral,10649353,541,89995,147,None,61,None,None,9/28/2020 23:59,2020-09-28T23:59:00Z,09/28 19:59,25470,89995,76649,2020-09-28T23:59:00Z,None,None,None,None,None,None,10649353,None,None,None,None,None,None,None,None,None,None,None,36,1189,0,457649,88231,457649,None,2,0,f77b9551dff6cda6382a88f9ec3bf047bafbdb01,0,0,0,0,0,
2020-09-30,NY,458649,None,None,None,totalTestEncountersViral,10747313,605,89995,144,None,67,None,None,9/29/2020 23:59,2020-09-29T23:59:00Z,09/29 19:59,25479,89995,76754,2020-09-29T23:59:00Z,None,None,None,None,None,None,10747313,None,None,None,None,None,None,None,None,None,None,None,36,1000,0,458649,97960,458649,None,9,0,541c236925f82c6159c9191ceef3701ceb040536,0,0,0,0,0,
2020-10-01,NY,460031,None,None,None,totalTestEncountersViral,10856531,612,89995,141,None,63,None,None,9/30/2020 23:59,2020-09-30T23:59:00Z,09/30 19:59,25490,89995,76834,2020-09-30T23:59:00Z,None,None,None,None,None,None,10856531,None,None,None,None,None,None,None,None,None,None,None,36,1382,0,460031,109218,460031,None,11,0,c53bbad0f6b11ac39ec8a5f5b9682d6cce6ba50b,0,0,0,0,0,
2020-10-02,NY,461629,None,None,None,totalTestEncountersViral,10976024,648,89995,146,None,63,None,None,10/1/2020 23:59,2020-10-01T23:59:00Z,10/01 19:59,25497,89995,76834,2020-10-01T23:59:00Z,None,None,None,None,None,None,10976024,None,None,None,None,None,None,None,None,None,None,None,36,1598,0,461629,119493,461629,None,7,0,c8103829f2f51ebcbad2196d6322f37aec91111b,0,0,0,0,0,
2020-10-03,NY,463360,None,None,None,totalTestEncountersViral,11110291,647,89995,149,None,70,None,None,10/2/2020 23:59,2020-10-02T23:59:00Z,10/02 19:59,25505,89995,77004,2020-10-02T23:59:00Z,None,None,None,None,None,None,11110291,None,None,None,None,None,None,None,None,None,None,None,36,1731,0,463360,134267,463360,None,8,0,260c4c8d0b2ca14b6e940c0ac3a4aaadf3d5cb98,0,0,0,0,0,
2020-10-04,NY,464582,None,None,None,totalTestEncountersViral,11220620,618,89995,138,None,67,None,None,10/3/2020 23:59,2020-10-03T23:59:00Z,10/03 19:59,25519,89995,77090,2020-10-03T23:59:00Z,None,None,None,None,None,None,11220620,None,None,None,None,None,None,None,None,None,None,None,36,1222,0,464582,110329,464582,None,14,0,c2f24b29109191fbbb31020383350bbf365e22f1,0,0,0,0,0,
2020-10-05,NY,465515,None,None,None,totalTestEncountersViral,11297024,636,89995,149,None,70,None,None,10/4/2020 23:59,2020-10-04T23:59:00Z,10/04 19:59,25527,89995,77141,2020-10-04T23:59:00Z,None,None,None,None,None,None,11297024,None,None,None,None,None,None,None,None,None,None,None,36,933,0,465515,76404,465515,None,8,0,1bc8492151924ffc0cf95fabc66713db8b2c629f,0,0,0,0,0,
2020-10-06,NY,466908,None,None,None,totalTestEncountersViral,11393383,705,89995,158,None,72,None,None,10/5/2020 23:59,2020-10-05T23:59:00Z,10/05 19:59,25536,89995,77192,2020-10-05T23:59:00Z,None,None,None,None,None,None,11393383,None,None,None,None,None,None,None,None,None,None,None,36,1393,0,466908,96359,466908,None,9,0,252297bcbfb140f9b0d5fd7f11aa6f6eca7869b6,0,0,0,0,0,
2020-10-07,NY,468268,None,None,None,totalTestEncountersViral,11501629,748,89995,176,None,72,None,None,10/6/2020 23:59,2020-10-06T23:59:00Z,10/06 19:59,25545,89995,77267,2020-10-06T23:59:00Z,None,None,None,None,None,None,11501629,None,None,None,None,None,None,None,None,None,None,None,36,1360,0,468268,108246,468268,None,9,0,95bd11fba3f95b94788d5071f13bae8132587c26,0,0,0,0,0,
2020-10-08,NY,470104,None,None,None,totalTestEncountersViral,11647440,754,89995,172,None,67,None,None,10/7/2020 23:59,2020-10-07T23:59:00Z,10/07 19:59,25555,89995,77351,2020-10-07T23:59:00Z,None,None,None,None,None,None,11647440,None,None,None,None,None,None,None,None,None,None,None,36,1836,0,470104,145811,470104,None,10,0,6539d9333573f961d4edec4713dbb08ca7a9ae7d,0,0,0,0,0,
2020-10-09,NY,471696,None,None,None,totalTestEncountersViral,11786740,779,89995,168,None,78,None,None,10/8/2020 23:59,2020-10-08T23:59:00Z,10/08 19:59,25561,89995,77432,2020-10-08T23:59:00Z,None,None,None,None,None,None,11786740,None,None,None,None,None,None,None,None,None,None,None,36,1592,0,471696,139300,471696,None,6,0,2f6f8a3ef4c3db1225e80b1a4d1a3bcf55376ae1,0,0,0,0,0,
2020-10-10,NY,473143,None,None,None,totalTestEncountersViral,11921319,826,89995,179,None,81,None,None,10/9/2020 23:59,2020-10-09T23:59:00Z,10/09 19:59,25569,89995,77514,2020-10-09T23:59:00Z,None,None,None,None,None,None,11921319,None,None,None,None,None,None,None,None,None,None,None,36,1447,0,473143,134579,473143,None,8,0,2a8ff3dc3367df545665160a681ea464900540d5,0,0,0,0,0,
2020-10-11,NY,474286,None,None,None,totalTestEncountersViral,12039573,820,89995,186,None,84,None,None,10/10/2020 23:59,2020-10-10T23:59:00Z,10/10 19:59,25574,89995,77631,2020-10-10T23:59:00Z,None,None,None,None,None,None,12039573,None,None,None,None,None,None,None,None,None,None,None,36,1143,0,474286,118254,474286,None,5,0,69c00ee87bb2eeed63cef7f95f37fe82420b3180,0,0,0,0,0,
2020-10-12,NY,475315,None,None,None,totalTestEncountersViral,12131366,878,89995,185,None,84,None,None,10/11/2020 23:59,2020-10-11T23:59:00Z,10/11 19:59,25587,89995,77631,2020-10-11T23:59:00Z,None,None,None,None,None,None,12131366,None,None,None,None,None,None,None,None,None,None,None,36,1029,0,475315,91793,475315,None,13,0,bcf18a217c74ba33309dda818bd197d322b842b0,0,0,0,0,0,
2020-10-13,NY,476708,None,None,None,totalTestEncountersViral,12230436,923,89995,181,None,90,None,None,10/12/2020 23:59,2020-10-12T23:59:00Z,10/12 19:59,25598,89995,77755,2020-10-12T23:59:00Z,None,None,None,None,None,None,12230436,None,None,None,None,None,None,None,None,None,None,None,36,1393,0,476708,99070,476708,None,11,0,647d5bf4a2926e4a254a3dcdd97cc0bdda975ccd,0,0,0,0,0,
2020-10-14,NY,477940,None,None,None,totalTestEncountersViral,12342180,938,89995,201,None,100,None,None,10/13/2020 23:59,2020-10-13T23:59:00Z,10/13 19:59,25605,89995,77870,2020-10-13T23:59:00Z,None,None,None,None,None,None,12342180,None,None,None,None,None,None,None,None,None,None,None,36,1232,0,477940,111744,477940,None,7,0,be9eed4a9c0ff56ffbbd7d06786d951c0e3db9e8,0,0,0,0,0,
2020-10-15,NY,479400,None,None,None,totalTestEncountersViral,12475392,897,89995,197,None,95,None,None,10/14/2020 23:59,2020-10-14T23:59:00Z,10/14 19:59,25618,89995,78006,2020-10-14T23:59:00Z,None,None,None,None,None,None,12475392,None,None,None,None,None,None,None,None,None,None,None,36,1460,0,479400,133212,479400,None,13,0,d803531729ba7d8019cdc8cf784610b53275f875,0,0,0,0,0,
2020-10-16,NY,481107,None,None,None,totalTestEncountersViral,12611431,918,89995,200,None,97,None,None,10/15/2020 23:59,2020-10-15T23:59:00Z,10/15 19:59,25628,89995,78117,2020-10-15T23:59:00Z,None,None,None,None,None,None,12611431,None,None,None,None,None,None,None,None,None,None,None,36,1707,0,481107,136039,481107,None,10,0,0d0dc36ad7e3ee196340a7fa01468e31fcb8c5ae,0,0,0,0,0,
2020-10-17,NY,482891,None,None,None,totalTestEncountersViral,12771403,929,89995,195,None,103,None,None,10/16/2020 23:59,2020-10-16T23:59:00Z,10/16 19:59,25637,89995,78235,2020-10-16T23:59:00Z,None,None,None,None,None,None,12771403,None,None,None,None,None,None,None,None,None,None,None,36,1784,0,482891,159972,482891,None,9,0,ea792944f49ec8f81df6b2868916e8b0273a89b8,0,0,0,0,0,
2020-10-18,NY,484281,None,None,None,totalTestEncountersViral,12900166,913,89995,200,None,102,None,None,10/17/2020 23:59,2020-10-17T23:59:00Z,10/17 19:59,25644,89995,78362,2020-10-17T23:59:00Z,None,None,None,None,None,None,12900166,None,None,None,None,None,None,None,None,None,None,None,36,1390,0,484281,128763,484281,None,7,0,3bf1e4f3cca2ced341100b6cb49897b42758f0da,0,0,0,0,0,
2020-10-19,NY,485279,None,None,None,totalTestEncountersViral,12982175,934,89995,198,None,106,None,None,10/18/2020 23:59,2020-10-18T23:59:00Z,10/18 19:59,25659,89995,78442,2020-10-18T23:59:00Z,None,None,None,None,None,None,12982175,None,None,None,None,None,None,None,None,None,None,None,36,998,0,485279,82009,485279,None,15,0,2c4b4b2a5de7795a7db0ee457960488b28c4ffd8,0,0,0,0,0,
2020-10-20,NY,486480,None,None,None,totalTestEncountersViral,13072715,942,89995,194,None,99,None,None,10/19/2020 23:59,2020-10-19T23:59:00Z,10/19 19:59,25672,89995,78530,2020-10-19T23:59:00Z,None,None,None,None,None,None,13072715,None,None,None,None,None,None,None,None,None,None,None,36,1201,0,486480,90540,486480,None,13,0,02e2713d44cd540d24ee4114f9c77d4934d95ec0,0,0,0,0,0,
2020-10-21,NY,488506,None,None,None,totalTestEncountersViral,13197504,950,89995,201,None,103,None,None,10/20/2020 23:59,2020-10-20T23:59:00Z,10/20 19:59,25679,89995,78645,2020-10-20T23:59:00Z,None,None,None,None,None,None,13197504,None,None,None,None,None,None,None,None,None,None,None,36,2026,0,488506,124789,488506,None,7,0,d2cbfe85ba460b61e218933b2b4c5e91ce290795,0,0,0,0,0,
2020-10-22,NY,490134,None,None,None,totalTestEncountersViral,13332845,986,89995,209,None,106,None,None,10/21/2020 23:59,2020-10-21T23:59:00Z,10/21 19:59,25694,89995,78753,2020-10-21T23:59:00Z,None,None,None,None,None,None,13332845,None,None,None,None,None,None,None,None,None,None,None,36,1628,0,490134,135341,490134,None,15,0,cf57542fd15fae458eeb8b40ff5b8c75be85b916,0,0,0,0,0,
2020-10-23,NY,491771,None,None,None,totalTestEncountersViral,13474353,1023,89995,223,None,109,None,None,10/22/2020 23:59,2020-10-22T23:59:00Z,10/22 19:59,25705,89995,78854,2020-10-22T23:59:00Z,None,None,None,None,None,None,13474353,None,None,None,None,None,None,None,None,None,None,None,36,1637,0,491771,141508,491771,None,11,0,4c27e143c04612302a313d9b995cf98a80966218,0,0,0,0,0,
2020-10-24,NY,493832,None,None,None,totalTestEncountersViral,13631293,1045,89995,231,None,113,None,None,10/23/2020 23:59,2020-10-23T23:59:00Z,10/23 19:59,25718,89995,78960,2020-10-23T23:59:00Z,None,None,None,None,None,None,13631293,None,None,None,None,None,None,None,None,None,None,None,36,2061,0,493832,156940,493832,None,13,0,d65edab2509b369ced0eb81285c066bcd9314af9,0,0,0,0,0,
2020-10-25,NY,495464,None,None,None,totalTestEncountersViral,13752123,1015,89995,227,None,118,None,None,10/24/2020 23:59,2020-10-24T23:59:00Z,10/24 19:59,25730,89995,79092,2020-10-24T23:59:00Z,None,None,None,None,None,None,13752123,None,None,None,None,None,None,None,None,None,None,None,36,1632,0,495464,120830,495464,None,12,0,c41cc58eaa902aea738f06f670caac6742e8da48,0,0,0,0,0,
2020-10-26,NY,496655,None,None,None,totalTestEncountersViral,13834240,1059,89995,237,None,118,None,None,10/25/2020 23:59,2020-10-25T23:59:00Z,10/25 19:59,25742,89995,79162,2020-10-25T23:59:00Z,None,None,None,None,None,None,13834240,None,None,None,None,None,None,None,None,None,None,None,36,1191,0,496655,82117,496655,None,12,0,582c0a0f7b72102680d3b18022a9165e3818b13e,0,0,0,0,0,
2020-10-27,NY,498646,None,None,None,totalTestEncountersViral,13945858,1083,89995,233,None,120,None,None,10/26/2020 23:59,2020-10-26T23:59:00Z,10/26 19:59,25758,89995,79230,2020-10-26T23:59:00Z,None,None,None,None,None,None,13945858,None,None,None,None,None,None,None,None,None,None,None,36,1991,0,498646,111618,498646,None,16,0,de8b9bdade5a5e84556d9b29ec6cc4e182b350de,0,0,0,0,0,
2020-10-28,NY,500677,None,None,None,totalTestEncountersViral,14075518,1085,89995,236,None,120,None,None,10/27/2020 23:59,2020-10-27T23:59:00Z,10/27 19:59,25773,89995,79366,2020-10-27T23:59:00Z,None,None,None,None,None,None,14075518,None,None,None,None,None,None,None,None,None,None,None,36,2031,0,500677,129660,500677,None,15,0,0429674b3328f60933b0062c7233ccc17b548da2,0,0,0,0,0,
2020-10-29,NY,503176,None,None,None,totalTestEncountersViral,14243871,1085,89995,237,None,114,None,None,10/28/2020 23:59,2020-10-28T23:59:00Z,10/28 19:59,25792,89995,79501,2020-10-28T23:59:00Z,None,None,None,None,None,None,14243871,None,None,None,None,None,None,None,None,None,None,None,36,2499,0,503176,168353,503176,None,19,0,c55ee8cac71c14f5a503c62698f4e391472cdf6e,0,0,0,0,0,
2020-10-30,NY,505431,None,None,None,totalTestEncountersViral,14390756,1085,89995,243,None,116,None,None,10/29/2020 23:59,2020-10-29T23:59:00Z,10/29 19:59,25804,89995,79621,2020-10-29T23:59:00Z,None,None,None,None,None,None,14390756,None,None,None,None,None,None,None,None,None,None,None,36,2255,0,505431,146885,505431,None,12,0,b751aafa1ac40b3c2649e75e55adf66680a2686c,0,0,0,0,0,
2020-10-31,NY,507480,None,None,None,totalTestEncountersViral,14527718,1121,89995,248,None,122,None,None,10/30/2020 23:59,2020-10-30T23:59:00Z,10/30 19:59,25807,89995,79717,2020-10-30T23:59:00Z,None,None,None,None,None,None,14527718,None,None,None,None,None,None,None,None,None,None,None,36,2049,0,507480,136962,507480,None,3,0,2af3b501148edac378554f07419d45a9fcd40014,0,0,0,0,0,
2020-11-01,NY,509735,None,None,None,totalTestEncountersViral,14676653,1125,89995,259,None,117,None,None,10/31/2020 23:59,2020-10-31T23:59:00Z,10/31 19:59,25824,89995,79831,2020-10-31T23:59:00Z,None,None,None,None,None,None,14676653,None,None,None,None,None,None,None,None,None,None,None,36,2255,0,509735,148935,509735,None,17,0,683163a29dd228944945bac0958b74ddc79364e0,0,0,0,0,0,
2020-11-02,NY,511368,None,None,None,totalTestEncountersViral,14772754,1151,89995,276,None,117,None,None,11/1/2020 23:59,2020-11-01T23:59:00Z,11/01 18:59,25838,89995,79831,2020-11-01T23:59:00Z,None,None,None,None,None,None,14772754,None,None,None,None,None,None,None,None,None,None,None,36,1633,0,511368,96101,511368,None,14,0,b12a3b06459e9778b5ad2437e82eee28ff18aa8b,0,0,0,0,0,
2020-11-03,NY,513689,None,None,None,totalTestEncountersViral,14900623,1227,89995,268,None,120,None,None,11/2/2020 23:59,2020-11-02T23:59:00Z,11/02 18:59,25853,89995,79990,2020-11-02T23:59:00Z,None,None,None,None,None,None,14900623,None,None,None,None,None,None,None,None,None,None,None,36,2321,0,513689,127869,513689,None,15,0,eed3563f6d7a4682b4d4d773a3fef1ed5ffe3b8c,0,0,0,0,0,
2020-11-04,NY,515815,None,None,None,totalTestEncountersViral,15034157,1253,89995,284,None,129,None,None,11/3/2020 23:59,2020-11-03T23:59:00Z,11/03 18:59,25868,89995,80109,2020-11-03T23:59:00Z,None,None,None,None,None,None,15034157,None,None,None,None,None,None,None,None,None,None,None,36,2126,0,515815,133534,515815,None,15,0,376796bfaf45c20a47842499d2266f020ddb6360,0,0,0,0,0,
2020-11-05,NY,518812,None,None,None,totalTestEncountersViral,15195176,1277,89995,268,None,128,None,None,11/4/2020 23:59,2020-11-04T23:59:00Z,11/04 18:59,25892,89995,80225,2020-11-04T23:59:00Z,None,None,None,None,None,None,15195176,None,None,None,None,None,None,None,None,None,None,None,36,2997,0,518812,161019,518812,None,24,0,e0f12458ca8fd9152d2113a870b4cb254a6033c7,0,0,0,0,0,
2020-11-06,NY,522021,None,None,None,totalTestEncountersViral,15355881,1321,89995,285,None,129,None,None,11/5/2020 23:59,2020-11-05T23:59:00Z,11/05 18:59,25910,89995,80368,2020-11-05T23:59:00Z,None,None,None,None,None,None,15355881,None,None,None,None,None,None,None,None,None,None,None,36,3209,0,522021,160705,522021,None,18,0,fa17f56bb8a2bb5a01138febb470ba649f3be9c9,0,0,0,0,0,
2020-11-07,NY,525608,None,None,None,totalTestEncountersViral,15519172,1381,89995,308,None,138,None,None,11/6/2020 23:59,2020-11-06T23:59:00Z,11/06 18:59,25928,89995,80494,2020-11-06T23:59:00Z,None,None,None,None,None,None,15519172,None,None,None,None,None,None,None,None,None,None,None,36,3587,0,525608,163291,525608,None,18,0,9ef29e2b7b7c37331ebf4604ca33fab89eb17681,0,0,0,0,0,
2020-11-08,NY,529036,None,None,None,totalTestEncountersViral,15664814,1396,89995,295,None,131,None,None,11/7/2020 23:59,2020-11-07T23:59:00Z,11/07 18:59,25947,89995,80646,2020-11-07T23:59:00Z,None,None,None,None,None,None,15664814,None,None,None,None,None,None,None,None,None,None,None,36,3428,0,529036,145642,529036,None,19,0,af53037503f33293883fa6047559ca8c39867e5e,0,0,0,0,0,
2020-11-09,NY,532180,None,None,None,totalTestEncountersViral,15776230,1444,89995,282,None,125,None,None,11/8/2020 23:59,2020-11-08T23:59:00Z,11/08 18:59,25973,89995,80764,2020-11-08T23:59:00Z,None,None,None,None,None,None,15776230,None,None,None,None,None,None,None,None,None,None,None,36,3144,0,532180,111416,532180,None,26,0,471e83868a1184996309818267f92a0d7b8bfbc8,0,0,0,0,0,
2020-11-10,NY,536145,None,None,None,totalTestEncountersViral,15904266,1548,89995,296,None,128,None,None,11/9/2020 23:59,2020-11-09T23:59:00Z,11/09 18:59,26005,89995,80854,2020-11-09T23:59:00Z,None,None,None,None,None,None,15904266,None,None,None,None,None,None,None,None,None,None,None,36,3965,0,536145,128036,536145,None,32,0,9f4b05cc96fe378f315b726bd9f76aaf9f6018bd,0,0,0,0,0,
2020-11-11,NY,540965,None,None,None,totalTestEncountersViral,16068566,1628,89995,304,None,135,None,None,11/10/2020 23:59,2020-11-10T23:59:00Z,11/10 18:59,26026,89995,81020,2020-11-10T23:59:00Z,None,None,None,None,None,None,16068566,None,None,None,None,None,None,None,None,None,None,None,36,4820,0,540965,164300,540965,None,21,0,b603f34f6f2f1d3fa3efa044c350336c8ad4a6a1,0,0,0,0,0,
2020-11-12,NY,545762,None,None,None,totalTestEncountersViral,16231193,1677,89995,308,None,136,None,None,11/11/2020 23:59,2020-11-11T23:59:00Z,11/11 18:59,26055,89995,81198,2020-11-11T23:59:00Z,None,None,None,None,None,None,16231193,None,None,None,None,None,None,None,None,None,None,None,36,4797,0,545762,162627,545762,None,29,0,9324d8f42f397771355dafba387230a72aab8ed9,0,0,0,0,0,
2020-11-13,NY,551163,None,None,None,totalTestEncountersViral,16434914,1737,89995,331,None,137,None,None,11/12/2020 23:59,2020-11-12T23:59:00Z,11/12 18:59,26079,89995,81390,2020-11-12T23:59:00Z,None,None,None,None,None,None,16434914,None,None,None,None,None,None,None,None,None,None,None,36,5401,0,551163,203721,551163,None,24,0,437a1be90c99635fb2cecca2877512425356d0ae,0,0,0,0,0,
2020-11-14,NY,556551,None,None,None,totalTestEncountersViral,16619076,1788,89995,367,None,146,None,None,11/13/2020 23:59,2020-11-13T23:59:00Z,11/13 18:59,26103,89995,81585,2020-11-13T23:59:00Z,None,None,None,None,None,None,16619076,None,None,None,None,None,None,None,None,None,None,None,36,5388,0,556551,184162,556551,None,24,0,66986867c719f42f120cf00e42956144f26bfe9b,0,0,0,0,0,
2020-11-15,NY,560200,None,None,None,totalTestEncountersViral,16752278,1845,89995,378,None,158,None,None,11/14/2020 23:59,2020-11-14T23:59:00Z,11/14 18:59,26133,89995,81788,2020-11-14T23:59:00Z,None,None,None,None,None,None,16752278,None,None,None,None,None,None,None,None,None,None,None,36,3649,0,560200,133202,560200,None,30,0,f016085aed5506b652d3880b26c924d198686ca2,0,0,0,0,0,
2020-11-16,NY,563690,None,None,None,totalTestEncountersViral,16876843,1968,89995,391,None,158,None,None,11/15/2020 23:59,2020-11-15T23:59:00Z,11/15 18:59,26159,89995,81908,2020-11-15T23:59:00Z,None,None,None,None,None,None,16876843,None,None,None,None,None,None,None,None,None,None,None,36,3490,0,563690,124565,563690,None,26,0,d5d639bfcce673158bee045f01318e8fa2602985,0,0,0,0,0,
2020-11-17,NY,568778,None,None,None,totalTestEncountersViral,17036695,2124,89995,408,None,176,None,None,11/16/2020 23:59,2020-11-16T23:59:00Z,11/16 18:59,26189,89995,82022,2020-11-16T23:59:00Z,None,None,None,None,None,None,17036695,None,None,None,None,None,None,None,None,None,None,None,36,5088,0,568778,159852,568778,None,30,0,24c8624c0d9b5c97ede0e683fdabc828ba4ea8e8,0,0,0,0,0,
2020-11-18,NY,574072,None,None,None,totalTestEncountersViral,17191129,2202,89995,423,None,176,None,None,11/17/2020 23:59,2020-11-17T23:59:00Z,11/17 18:59,26225,89995,82022,2020-11-17T23:59:00Z,None,None,None,None,None,None,17191129,None,None,None,None,None,None,None,None,None,None,None,36,5294,0,574072,154434,574072,None,36,0,707878cbb7269f22e09531e1d81a94e7bd9f9430,0,0,0,0,0,
2020-11-19,NY,579382,None,None,None,totalTestEncountersViral,17386368,2276,89995,437,None,200,None,None,11/18/2020 23:59,2020-11-18T23:59:00Z,11/18 18:59,26257,89995,82507,2020-11-18T23:59:00Z,None,None,None,None,None,None,17386368,None,None,None,None,None,None,None,None,None,None,None,36,5310,0,579382,195239,579382,None,32,0,019f39a9e7896a4a6eeb80cd72e6807b37cef6c0,0,0,0,0,0,
2020-11-20,NY,584850,None,None,None,totalTestEncountersViral,17591834,2348,89995,445,None,205,None,None,11/19/2020 23:59,2020-11-19T23:59:00Z,11/19 18:59,26292,89995,82766,2020-11-19T23:59:00Z,None,None,None,None,None,None,17591834,None,None,None,None,None,None,None,None,None,None,None,36,5468,0,584850,205466,584850,None,35,0,72ab2f36bf47bc6c219aea856960c66ec9312b40,0,0,0,0,0,
2020-11-21,NY,590822,None,None,None,totalTestEncountersViral,17799741,2443,89995,467,None,212,None,None,11/20/2020 23:59,2020-11-20T23:59:00Z,11/20 18:59,26326,89995,83031,2020-11-20T23:59:00Z,None,None,None,None,None,None,17799741,None,None,None,None,None,None,None,None,None,None,None,36,5972,0,590822,207907,590822,None,34,0,321ad71d8c7bd9d4565970928b273e9e134e92b8,0,0,0,0,0,
2020-11-22,NY,596214,None,None,None,totalTestEncountersViral,17996351,2562,89995,502,None,234,None,None,11/21/2020 23:59,2020-11-21T23:59:00Z,11/21 18:59,26357,89995,83307,2020-11-21T23:59:00Z,None,None,None,None,None,None,17996351,None,None,None,None,None,None,None,None,None,None,None,36,5392,0,596214,196610,596214,None,31,0,b23cc69e74098f4f6838cc96674acd463884c8f8,0,0,0,0,0,
